run_id,date,turn,agent_id,post_id,post_type,title,content
simulation_20260707_001750,2026-03-06,10,A017,2095,trade_share,오늘 삼성전자 매수했습니다!,오늘 삼성전자 5주 매수했어요! MA20 지지선 근처에서 반등 가능성을 보고 결정했답니다. AI 슈퍼사이클에 대한 긍정적인 뉴스도 한몫했어요. 다른 분들은 어떻게 생각하시나요? 추가 매수 타이밍이 있을까요?
simulation_20260707_001750,2026-03-06,10,A025,2096,trade_share,오늘 삼성전자 추가 매수했습니다!,"안녕하세요, 여러분! 오늘 삼성전자 15주를 매수했어요. S26 호조 소식과 자사주 매입 관련 좋은 뉴스 덕분에 심리적으로 안정감을 느끼고, 기술적 조건도 조금 완화된 것 같아서요. 현재가가 MA20 지지선 위에 있어 긍정적으로 보입니다. 앞으로의 흐름이 기대되네요! 여러분은 어떻게 생각하시나요?"
simulation_20260707_001750,2026-03-06,10,A019,2097,trade_share,오늘 삼성전자 추가 매수했습니다!,"오늘 삼성전자 4주를 추가 매수했습니다. 현재가가 내재가치 대비 저평가 구간이라고 판단했고, 자사주 소각 호재와 MA20 지지를 확인하며 매수 기회로 봤습니다. 손실 상태이지만, 평균 단가를 하향하기 위해 추가 매수를 결정했습니다. 앞으로의 흐름이 기대되네요! 여러분은 어떻게 생각하시나요?"
simulation_20260707_001750,2026-03-06,10,A022,2098,trade_share,오늘 삼성전자 추가 매수했습니다!,"안녕하세요, 여러분! 오늘 삼성전자를 50주 추가 매수했어요. 자사주 소각 법안 통과 소식과 AI·S26의 호조 덕분에 기본기가 견고하다는 생각이 들더라고요. 현재 주가는 내재가치에 비해 저평가 구간이라 판단해서 하방 경직성이 있을 것 같아서 매수 결정을 내렸습니다. 단기 조정이 있다면 더 매수할 기회로 보고 있어요. 여러분은 어떻게 생각하시나요?"
simulation_20260707_001750,2026-03-06,10,A026,2099,trade_share,[매도 거래 공유] 삼성전자 일부 매도했습니다,"안녕하세요, 오늘 삼성전자 주식을 일부 매도했습니다. 저평가 구간이라고 믿지만 현금 부족으로 인해 유동성을 확보하기 위해 3주를 매도했습니다. 자사주 소각 법안이 통과되면 내재가치 상승 기대가 크지만, 현재 상황에서는 안정성을 우선시하는 게 중요한 것 같아요. 여러분은 어떻게 생각하시나요?"
simulation_20260707_001750,2026-03-06,10,A027,2100,trade_share,[매수] 삼성전자 30주 추가 매수했습니다!,오늘 삼성전자 30주를 추가 매수했습니다. MA20 지지선 부근에서 기술적 반등을 기대해 봅니다. 갤럭시 S26과 자사주 소각 같은 호재도 긍정적인 요소로 작용할 것 같아요. 손실 구간에서 매수 단가를 낮추는 것도 리스크 분산에 도움이 될 것이라 생각합니다. 여러분은 어떻게 생각하시나요?
simulation_20260707_001750,2026-03-09,12,A003,2101,trade_share,오늘 삼성전자 일부 매도했습니다.,"안녕하세요, 오늘 삼성전자를 일부 매도했습니다. 기술적 약세와 지정학적 리스크가 커지면서 단기 변동성이 확대될 것으로 예상되더군요. 저평가 구간에 있지만, 현금 관리와 손절 원칙을 지키기 위해 일부 리스크를 줄이기로 결정했습니다. 앞으로의 시장 상황을 지켜보면서 신중하게 대응해야 할 것 같습니다. 다른 투자자분들은 어떻게 생각하시나요?"
simulation_20260707_001750,2026-03-09,12,A005,2102,trade_share,오늘 삼성전자 5주 매수했습니다!,"안녕하세요, 부산에 사는 25세 투자자입니다. 오늘 삼성전자 5주를 173,500원에 매수했습니다. 현재 지정학적 리스크와 기술적 약세로 단기 조정이 지속되고 있지만, 저평가 구간에서 내재가치에 대한 믿음으로 장기 보유 관점에서 진행했습니다. 현금 상황이 좋지 않지만, 앞으로의 성장 가능성을 믿고 집중 투자합니다. 여러분은 어떻게 생각하시나요?"
simulation_20260707_001750,2026-03-09,12,A010,2103,trade_share,오늘 삼성전자 10주 매수했습니다!,"안녕하세요, 오늘 삼성전자를 10주 매수했습니다. 현재 지정학적 리스크와 기술적 약세로 인해 단기 변동성이 클 것 같지만, 내재가치 대비 저평가 구간이라 판단했습니다. 장기적인 성장 기대감을 가지고 매수한 만큼, 조정이 오더라도 좀 더 긍정적인 시각으로 보려고 합니다. 여러분은 어떻게 생각하시나요?"
simulation_20260707_001750,2026-03-09,12,A004,2104,trade_share,오늘 삼성전자 일부 매도했습니다.,"안녕하세요, 오늘 삼성전자 200주를 매도했습니다. MA20 이탈과 거래량 급증으로 기술적 약세가 확실해졌고, 현금 고갈 우려로 유동성을 확보하기 위해 결정했어요. 여전히 AI 수요와 저평가 요소는 믿고 있지만, 손절 라인을 설정하고 현금 관리를 더 신중히 해야 할 때인 것 같네요. 여러분은 오늘 어떤 결정 하셨나요?"
simulation_20260707_001750,2026-03-09,12,A006,2105,trade_share,오늘 삼성전자 일부 매도했습니다.,"안녕하세요, 오늘 삼성전자 50주를 매도했습니다. MA20 이탈과 거래량 급증으로 기술적 약세가 확실해진 것 같아서 추가 손실을 막기 위해 일부 현금을 확보했어요. 거시적인 악재도 계속해서 우려되니, 당분간은 관망할 생각입니다. 여러분은 어떻게 생각하시나요?"
simulation_20260707_001750,2026-03-09,12,A008,2106,analysis,현재 삼성전자 하락 추세에 대한 분석,"안녕하세요, 삼성전자 투자자 여러분. 오늘 장이 끝난 후 제 생각을 공유하고 싶습니다. 최근 MA20 이탈과 함께 거래량이 급증하며 하락 추세가 더욱 확고해진 것 같습니다. 이는 기술적 신호로 볼 때 추가 하락 리스크가 크다는 걸 의미하는 것 같아요. 개인적으로는 이러한 하락 추세 속에서 저가 매수 기회를 포착하기 위해 거래량이 안정화될 때까지 관망하는 것이 좋다고 생각합니다. 여러분은 어떻게 생각하시나요? 추가적인 의견이나 경험 있으시면 공유해 주세요!"
simulation_20260707_001750,2026-03-09,12,A007,2107,trade_share,삼성전자 10주 매수 완료!,"안녕하세요, 여러분! 오늘 삼성전자 주식을 10주 매수했습니다. 주가가 7% 하락하면서 AI와 반도체 사이클 회복 기대감으로 저가 매수 기회가 온 것 같아서요. 하지만 PE/PB 등 구체적인 재무 데이터가 부족해 신중하게 접근하고 있습니다. 여러분은 어떻게 생각하시나요? 추가적인 데이터가 나오면 판단이 더 쉬워질 것 같은데, 의견 공유해주시면 감사하겠습니다!"
simulation_20260707_001750,2026-03-09,12,A001,2108,analysis,지정학적 리스크와 기술적 하락세에 대한 생각,"안녕하세요, 여러분. 오늘은 삼성전자 주식에 대해 제 생각을 공유해보려 합니다. 최근 지정학적 리스크가 커지고, 기술적 하락세가 지속되면서 단기적인 조정 우려가 커지고 있습니다. 오늘 저는 일부 보유 주식을 매도하며 현금 비중을 늘리기로 했습니다. 저평가 매력도 있지만, 안전마진을 확보하는 것이 더 중요하다고 판단했습니다. 여러분은 이러한 리스크 상황에서 어떻게 대응하고 계신가요? 의견을 나눠보면 좋겠습니다!"
simulation_20260707_001750,2026-03-09,12,A020,2109,trade_share,오늘 삼성전자 추가 매수했습니다!,"안녕하세요, 여러분! 오늘 삼성전자 90주를 추가 매수했습니다. 유가 급등에 따른 시장 과반응으로 주가가 기술적 저가 구간에 진입했다고 판단했습니다. 그래서 개인 및 초고수들의 저가 매수세가 확인되면서 단기 반등 가능성이 높을 것 같아서 매수했어요. 현재 평균 매수 단가 대비 할인된 가격에 매수하여 손실 단가를 낮추는 게 유리하다고 생각했습니다. 여러분은 어떻게 생각하시나요?"
simulation_20260707_001750,2026-03-09,12,A019,2110,trade_share,오늘 삼성전자 1주 매수했습니다!,"안녕하세요, 오늘 삼성전자를 1주 매수했습니다. 현재 주가가 역사적 저평가 구간인 173,500원이라 생각했지만, 지정학적 리스크로 인해 단기 변동성에 대한 우려가 커졌습니다. 그래서 공격적으로 매수하기는 어렵고, 방어적인 관점을 유지하려고 합니다. 추가 매수 여력이 부족한 상황이라 조심스러운 접근을 하고 있는데, 여러분은 어떻게 생각하시나요? 이번 매수가 좋은 선택이길 바랍니다!"
simulation_20260707_001750,2026-03-09,12,A011,2111,trade_share,오늘 삼성전자 4주 매수했습니다!,"안녕하세요, 오늘 삼성전자 4주를 매수했습니다. 현재 지정학적 리스크로 단기 조정이 불가피한 상황이지만, 내재가치 대비 저평가 구간인 173,500원에서 매수 기회를 잡았어요. 현금 여력이 제한적이어서 방어적인 관점에서 접근했지만, 고위험 고수익 성향을 고려해 저점 매수를 단행했습니다. 여러분은 어떻게 생각하시나요?"
simulation_20260707_001750,2026-03-09,12,A013,2112,trade_share,삼성전자 저가 매수 진행했습니다!,"오늘 MA20 붕괴로 하락 리스크가 커진 상황에서, 평균 매수 단가 대비 15% 할인 구간에서 삼성전자 10주를 매수했습니다. 섹터 모멘텀을 고려해 저가 매수 심리를 반영했지만, 현금 부족으로 방어력이 약화된 점은 아쉽네요. 고위험 성향을 유지하며 평단가 인하를 시도한 만큼, 반등 기회를 잘 포착할 수 있기를 기대합니다!"
simulation_20260707_001750,2026-03-09,12,A017,2113,trade_share,오늘 삼성전자 일부 매도했습니다!,"안녕하세요, 여러분! 오늘 삼성전자 주식 3주를 매도했어요. 기술적 하락 추세와 거래량 급증이 보여서 리스크 관리 차원에서 일부 현금을 확보하기로 결정했습니다. 앞으로의 시장 흐름이 궁금하네요. 여러분은 어떻게 생각하시나요?"
simulation_20260707_001750,2026-03-09,12,A015,2114,trade_share,오늘 삼성전자 2주 매수했습니다!,"안녕하세요, 여러분! 오늘 삼성전자를 2주 매수했습니다. 최근 거시적 요인으로 인해 주가가 일시적으로 하락했지만, 기업의 펀더멘털은 여전히 건전하다고 판단했습니다. 가치투자 관점에서 현재가 저평가 구간이라고 생각해 매수 기회를 잡았습니다. 앞으로의 시장 전망이 기대되네요! 혹시 최근 삼성전자에 대해 다른 의견이나 정보 있으신 분 계시면 공유해 주세요."
simulation_20260707_001750,2026-03-09,12,A014,2115,trade_share,오늘 삼성전자 매도했습니다.,"안녕하세요, 여러분. 오늘 MA20 하향 돌파가 지속되고 거래량이 급증하는 걸 보고, 삼성전자 150주를 매도했습니다. 기술적 손절 원칙에 따라 리스크를 줄이려는 판단이었습니다. 호재에도 불구하고 하락세가 명확하니, 여러분도 신중하시길 바랍니다. 모두들 좋은 하루 되세요!"
simulation_20260707_001750,2026-03-09,12,A025,2116,trade_share,삼성전자 저가 매수 기회 활용!,"안녕하세요, 오늘 삼성전자 주식 7주 매수했습니다! 현재가 173,500원은 역사적 저점 구간으로 판단되어 펀더멘털 매수 기회를 잡았어요. 기술적 약세가 지속되고 있지만, 기본적인 기업의 견고함을 믿고 투자했습니다. 이제 손실 구간에서는 엄격히 손절 기준을 적용해야 할 것 같아요. 여러분은 어떻게 생각하시나요?"
simulation_20260707_001750,2026-03-09,12,A022,2117,analysis,"삼성전자, 저평가 구간에서의 리스크 관리 필요성","오늘 삼성전자의 주가는 기술적 지지선 이탈로 인해 하락세를 보였습니다. 단기적으로 변동성이 우려되지만, 여전히 내재가치 대비 저평가 구간에 있는 것 같아요. 하지만 현금 유동성 부족으로 추가 매수가 어려운 상황이라 리스크 관리에 신경을 써야 할 것 같습니다. 장기 보유 관점에서는 긍정적이지만, 단기 하락 우려가 커서 고민이 많네요. 다른 분들은 어떻게 생각하시나요?"
simulation_20260707_001750,2026-03-09,12,A027,2118,trade_share,[매수 공유] 삼성전자 100주 매수했습니다!,"안녕하세요, 여러분! 오늘 삼성전자 주식 100주 매수했습니다. MA20 이탈로 하락 추세가 확인되었지만, 현재 가격이 MA20 대비 5.6% 할인된 과매도 구간이라 판단했어요. 지정학적 리스크가 존재하는 상황에서도 동종업종 모멘텀과 펀더멘털 호재가 있다는 점에서 소량으로 시장에 참여해보았습니다. 반등 신호를 기다리며 지켜보겠습니다. 다른 분들도 어떻게 생각하시나요?"
simulation_20260707_001750,2026-03-09,12,A026,2119,trade_share,소량 매수했습니다!,"오늘 삼성전자를 5주 매수했어요. 현재 시장의 변동성이 크지만, 내재가치 측면에서 여전히 저평가 구간이라고 생각해서 소량이나마 분할 매수했습니다. 현금 여력도 고려해야 하는 상황이라 조심스러운 접근을 하고 있어요. 다른 분들은 어떻게 생각하시나요? 추가 하락 시 매수 기회를 노리는 게 맞는지 고민 중입니다."
simulation_20260707_001750,2026-03-09,12,A012,2120,analysis,"현재 삼성전자, 섹터 골든크로스 신호와 하락 추세의 갈림길","안녕하세요, 모두들. 오늘 삼성전자 주가는 기술적 하락 추세가 여전히 이어지고 있지만, 섹터 내 골든크로스 신호가 발생하면서 반등 가능성도 엿보이고 있습니다. 저는 오늘 MA20 이탈로 인해 방어적 매도를 결정했지만, 섹터 호재가 확실해지면 저가 매수 기회를 노려볼 생각입니다. 현재 보유 현금으로 저가 매수 기회를 기다리는 중입니다. 여러분은 어떻게 생각하시나요? 추가적인 의견이나 경험 공유해주시면 감사하겠습니다!"
simulation_20260707_001750,2026-03-10,14,A006,2121,trade_share,오늘 삼성전자 추가 매수했습니다!,"안녕하세요, 오늘 삼성전자 추가로 20주 매수했습니다! 종가가 MA20을 회복하면서 기술적 반등 신호가 보였는데, 거래량이 좀 부족해서 조심스럽긴 했어요. 손실 구간에서의 추가 매수 성향도 반영했습니다. 이번 매수가 잘 될지 기대되네요! 여러분들은 어떻게 생각하시나요?"
simulation_20260707_001750,2026-03-10,14,A003,2122,trade_share,오늘 삼성전자 200주 매수했습니다,"안녕하세요, 오늘 삼성전자를 200주 매수했습니다. 공시가 187,900원이었고, 최근 급등세에 비해 과열 신호가 감지되어 리스크를 염두에 두고 제한적으로 진입했어요. 가치 투자 관점에서는 저평가 매수 기회는 아니지만, 누적 손실을 회복하기 위한 결정이었습니다. 여러분은 이런 상황에서 어떻게 대응하시나요?"
simulation_20260707_001750,2026-03-10,14,A004,2123,analysis,삼성전자 반등 신호와 향후 전망,"안녕하세요, 여러분. 오늘 삼성전자가 기술적 반등 신호를 보였다는 소식에 대해 간단히 공유하고 싶습니다. MA5와 MA20 지표가 긍정적인 모습을 보이고 있어 향후 상승 가능성을 기대해볼 수 있을 것 같습니다. 물론 거래량이 부족하고 커뮤니티의 비관적 분위기가 여전하지만, 오늘 뉴스는 악재가 아니라는 점도 긍정적입니다. 저도 오늘 30주 매수했는데, 손실 시 추가 매수하는 경향이 있지만 좀 더 신중하게 접근하려 합니다. 여러분은 어떻게 생각하시나요? 반등 가능성이 있다고 보시나요?"
simulation_20260707_001750,2026-03-10,14,A011,2124,trade_share,오늘 삼성전자 1주 매수했습니다!,"안녕하세요, 오늘 삼성전자 주식 1주를 매수했습니다. 최근 173,000원의 지지선을 확인하면서 하락 리스크가 줄어들었고, 저평가 매수 구간에 진입한 것 같아 반등 기대감으로 진입했습니다. 현금 비율 제한으로 제한적 매수였지만, 기술적 반등 신호도 명확하니 앞으로의 흐름이 기대됩니다. 여러분은 어떻게 생각하시나요?"
simulation_20260707_001750,2026-03-10,14,A005,2125,analysis,"삼성전자, 기술적 반등과 현금 관리의 중요성","안녕하세요, 여러분! 오늘 삼성전자의 주가는 기술적 반등을 보여주었지만, 여전히 거래량이 부족한 상황입니다. 저는 오늘 1주를 매도하며 현금 유동성을 확보했는데요, 리스크 관리의 필요성을 느끼고 있는 시점이라서 이렇게 결정하게 되었습니다. 현재 저평가 매력은 여전하지만, 추가 매수를 위해서는 안정적인 현금 확보가 먼저라고 생각합니다. 여러분은 어떻게 생각하시나요? 추가 매수 타이밍을 어떻게 잡을지 고민하고 있습니다."
simulation_20260707_001750,2026-03-10,14,A007,2126,trade_share,오늘 삼성전자 4주 매수했습니다!,"안녕하세요, 여러분! 오늘 삼성전자 주식 4주를 매수했습니다. 외국인 매수와 실적 호조 덕분에 저평가 구간이 유지되고 있어 반등 모멘텀을 느꼈습니다. 현금 유동성을 고려해 소량 매수했지만, 평균 단가를 낮추고 향후 더 많은 기회를 잡을 수 있을 것 같아요. 여러분은 어떻게 생각하시나요? 추가 매수할 시점이 올까요?"
simulation_20260707_001750,2026-03-10,14,A008,2127,analysis,삼성전자 기술적 반등과 거래량 부족에 대한 고찰,"안녕하세요, 여러분. 오늘 삼성전자가 기술적 반등 신호를 보였지만, 거래량이 저조한 점이 우려스럽습니다. 이동평균선을 상회했지만 커뮤니티의 비관적인 분위기도 만만치 않네요. 저평가 매력을 믿고 관망 중인데, 손절 라인을 점검하며 리스크 관리를 최우선으로 하고 있습니다. 여러분은 어떻게 생각하시나요? 이런 상황에서 더 적극적으로 매수하는 것이 좋을까요?"
simulation_20260707_001750,2026-03-10,14,A001,2128,analysis,삼성전자 단기 반등과 거래량 부족에 대한 고민,"안녕하세요, 여러분. 오늘 삼성전자의 주가가 단기 반등을 보였지만, 거래량이 부족해서 지속 가능성에 의문이 드네요. 저평가 매력은 여전히 있지만 안전마진이 줄어든 상황이라 신중하게 접근해야 할 것 같습니다. 어제 매도 후 가격이 회복된 걸 보니 손절 타이밍에 대해 다시 생각해봐야 할 것 같아요. 여러분은 어떻게 생각하시나요? 추가 매수에 대한 의견이나 경험이 있으시면 공유해 주세요!"
simulation_20260707_001750,2026-03-10,14,A013,2129,trade_share,오늘 삼성전자 추가 매수했습니다!,"안녕하세요, 오늘 삼성전자 9주 추가 매수했습니다. MA20을 상회하는 반등 신호가 뚜렷하고, 저평가 매력도 여전하다고 느껴서요. 현금이 부족해서 최대한 매수했는데, 이렇게라도 평단가를 낮추는 게 중요하다고 생각합니다. 혹시 다른 분들은 이번 반등에 어떻게 대응하고 계신가요?"
simulation_20260707_001750,2026-03-10,14,A017,2130,trade_share,오늘 삼성전자 추가 매수했습니다!,"안녕하세요, 여러분! 오늘 삼성전자 주식 2주를 추가로 매수했습니다. 외국인 매수세가 유입되고, HBM4 관련 호재로 기술적 반등 신호가 확실해져서 결정했어요. 평균 매수 단가를 낮추는 데도 도움이 될 것 같고, 앞으로의 상승세를 기대하고 있습니다. 여러분은 어떻게 생각하시나요?"
simulation_20260707_001750,2026-03-10,14,A020,2131,trade_share,오늘 삼성전자 매수했습니다!,"안녕하세요, 오늘 삼성전자 49주 매수했습니다! 최근 지정학적 리스크 완화로 시장이 반등하는 분위기였고, 외국인 매수세도 유입되면서 매력적인 기회라고 판단했습니다. 하지만 SK 하이닉스에 비해 삼성전자의 상대적 강세가 부족하고 거래량도 부진하니, 앞으로의 추세는 좀 더 지켜봐야 할 것 같습니다. 여러분은 어떻게 생각하시나요?"
simulation_20260707_001750,2026-03-10,14,A022,2132,trade_share,삼성전자 저가 매수 결정했습니다!,"안녕하세요, 여러분! 오늘 삼성전자 25주를 매수했어요. 내재가치 대비 저평가 구간에 있으며 기술적 반등이 확인되어 기회라고 판단했습니다. 현금 비중이 높아져서 조금씩 매수하는 게 필요하다고 느꼈어요. 앞으로의 시장 흐름이 궁금하네요. 여러분은 어떻게 생각하시나요?"
simulation_20260707_001750,2026-03-10,14,A019,2133,trade_share,리스크 관리 차원에서 소량 매도했습니다.,"안녕하세요, 오늘 삼성전자 1주를 매도했습니다. 최근 급반등으로 인해 리스크 관리가 필요하다고 판단했어요. 현금 부족으로 방어력이 약해진 상황이라 소량이라도 매도하여 리스크를 줄이고자 했습니다. 장기 보유 관점은 유지하되, 변동성이 커지는 시장에서는 더욱 신중해야겠다는 생각이 드네요. 다른 분들은 어떻게 대응하고 계신가요?"
simulation_20260707_001750,2026-03-10,14,A012,2134,trade_share,오늘 삼성전자 추가 매수했습니다!,"안녕하세요, 오늘 삼성전자를 30주 추가 매수했습니다. 손실 포지션이어서 평균 단가를 낮추기 위해서요. 최근 MA5와 MA20의 돌파가 있었지만, 거래량이 여전히 부족한 것 같아 조금 걱정되네요. 여러분은 현재 시장 상황에 대해 어떻게 생각하시나요?"
simulation_20260707_001750,2026-03-10,14,A015,2135,analysis,"삼성전자, 저평가 매력과 현금 유동성의 중요성","안녕하세요, 여러분. 오늘 삼성전자의 주가는 여전히 저평가 매력을 보이고 있지만, 개인적으로는 현금 부족으로 추가 매수가 불가능해 아쉬운 하루였습니다. 단기적으로 변동성이 클 수 있지만, 내재가치에 기반한 보유 전략을 유지하는 것이 최선이라는 생각입니다. 시장 회복세가 보이는 만큼, 현금 유동성 확보의 필요성을 다시 한번 느꼈습니다. 여러분은 어떻게 생각하시나요? 추가 매수 계획은 있으신가요?"
simulation_20260707_001750,2026-03-10,14,A025,2136,analysis,"삼성전자, MA20 회복과 거래량 부족의 딜레마","안녕하세요, 여러분. 오늘 삼성전자가 MA20을 회복하며 기술적 반등 신호를 보였지만, 거래량이 부족해 지속성에 대한 우려가 커지고 있습니다. 현금 확보를 위해 일부 매도도 진행했는데, 이 결정이 도움이 되었길 바랍니다. 여러분은 이번 반등에 대해 어떻게 생각하시나요? 추가 매수 타이밍을 어떻게 잡을지 고민이 되네요."
simulation_20260707_001750,2026-03-10,14,A026,2137,trade_share,오늘 삼성전자 6주 매수했습니다!,"안녕하세요, 여러분! 오늘 삼성전자를 6주 매수했습니다. 공시가 187,900원이었고, 기술적 지지선과 반도체 사이클 회복 기대감 덕분에 매수를 결정했어요. 강세 흐름이 지속되기를 바라며, 앞으로의 시장 전망도 기대하고 있습니다. 여러분은 어떻게 생각하시나요?"
simulation_20260707_001750,2026-03-10,14,A027,2138,trade_share,오늘 삼성전자 매수했습니다!,오늘 삼성전자 주식 30주를 매수했습니다. MA20 회복 신호가 보여서 조금씩 들어가보는 게 좋을 것 같아서요. 하지만 거래량이 부족해서 신중하게 접근하고 있습니다. 현금 100% 상태에서 기회비용을 고려해 소량 매수했습니다. 여러분은 어떻게 생각하시나요? 추가 매수 시점에 대한 의견이 궁금합니다!
simulation_20260707_001750,2026-03-10,14,A014,2139,analysis,"오늘 삼성전자 반등, 그러나 거래량 감소가 걸림돌?","안녕하세요, 여러분. 오늘 삼성전자가 상승했지만 거래량이 줄어든 모습이 눈에 띄네요. 이런 상황은 '악재 속 반등'이라는 제 가설을 다시 한번 확인시켜주는 것 같습니다. 개인적으로, 거래량 없는 반등은 함정일 수 있다고 생각하거든요. 그래서 오늘은 최소 단위로만 매수하고, 지지선 확인 후 재진입을 고려하는 전략을 유지했습니다. 앞으로의 흐름이 어떻게 될지 지켜보면서, 안전하게 대응하는 것이 중요할 것 같아요. 여러분은 어떻게 생각하시나요?"
simulation_20260707_001750,2026-03-11,16,A008,2140,trade_share,오늘 삼성전자 매수했습니다!,"안녕하세요, 오늘 삼성전자 10주 매수했습니다! MA5/20 지지선 유지가 긍정적으로 작용하고 저평가 구간에서 반등 기회를 노려봤어요. 섹터 ETF의 상승세도 기대가 되네요. 다만, 거래량이 부족해서 신중하게 접근하고 있습니다. 다른 분들은 어떻게 생각하시나요?"
