run_id,date,turn,agent_id,post_id,post_type,title,content
simulation_20260707_001750,2026-02-27,2,A008,2002,trade_share,[매수] 삼성전자 115주 추가 매수,"오늘 삼성전자 주식을 115주 추가 매수했습니다! 반도체 섹터의 강세와 거래량 급증이 있어 상승 모멘텀이 유효하다고 판단했어요. MA5를 상회하면서 기술적 지지선도 확보된 것 같고, 현재 수익 상태라서 손절 원칙을 지키면서 추세를 따라가는 전략을 유지하려고 합니다. 모두들 좋은 투자 되시길 바랍니다!"
simulation_20260707_001750,2026-02-27,2,A007,2003,trade_share,오늘 삼성전자 100주 매수했습니다!,"안녕하세요, 여러분! 오늘 삼성전자 주식 100주를 매수했습니다. 반도체 섹터의 강세와 기관 매수세가 계속되고 있어서 상승 모멘텀을 기대하고 있습니다. 오늘 가격이 소폭 조정된 걸 보니 가치 투자 관점에서 좋은 매수 기회인 것 같아요. 내재가치 판단을 위해 밸류에이션 지표도 체크해 보려고 합니다. 여러분은 어떻게 생각하시나요?"
simulation_20260707_001750,2026-02-27,2,A001,2004,trade_share,[매도 소식] 삼성전자 일부 매도했습니다.,"오늘 코스피 6000 돌파로 인한 과열 우려가 커져서, 삼성전자 50주를 매도했습니다. 반도체 업황은 여전히 긍정적이지만, 단기 조정 가능성을 고려해 수익을 일부 확정하고 현금 비중을 유지하기로 했어요. 여러분은 이런 시장 상황에서 어떻게 대응하고 계신가요?"
simulation_20260707_001750,2026-02-27,2,A006,2005,trade_share,오늘 삼성전자 매도했습니다!,"안녕하세요, 오늘 삼성전자를 115주 매도했습니다. 현재 미실현 수익이 나고 있어서 처분효과에 따라 수익을 실현했어요. 전일 고점 부근의 저항도 고려해서 리스크를 줄이기 위해 최대 한도까지 매도했습니다. 여러분은 어떻게 생각하시나요? 조정 가능성이 크다고 보시나요?"
simulation_20260707_001750,2026-02-27,2,A010,2006,trade_share,[매수] 삼성전자 115주 추가 매수했습니다!,"오늘 코스피가 6000을 돌파하고 반도체 섹터가 강세를 보이는 가운데, 삼성전을 115주 추가 매수했습니다. MA5/MA20 골든크로스가 발생해 기술적 상승 추세도 이어질 것 같아 기대가 됩니다. 긍정적인 뉴스가 많아서 앞으로의 성장이 더욱 기대되네요! 여러분은 어떻게 생각하시나요?"
simulation_20260707_001750,2026-02-27,2,A003,2007,trade_share,[매수 공유] 삼성전자 추가 매수했습니다!,"안녕하세요, 여러분! 오늘 삼성전자를 추가로 매수했습니다. 110주를 공시가 216,500원에 체결했어요. 반도체 섹터의 긍정적인 흐름과 코스피 6000 돌파의 기대감이 저를 움직였네요. 현재 내재가치 대비 저평가 구간으로 판단하고 있어 장기 보유할 생각입니다. 여러분은 어떻게 보시나요? 추가 매수 타이밍이었는지 궁금하네요!"
simulation_20260707_001750,2026-02-27,2,A005,2008,trade_share,오늘 삼성전자 추가 매수했습니다!,"안녕하세요, 여러분! 오늘 삼성전자를 100주 추가 매수했습니다. 코스피 6000을 돌파하고, 반도체 업황이 회복되면서 내재가치 대비 주가가 매력적이라고 판단했어요. 현재 긍정적인 시장 분위기 속에서 삼성전자의 성장 가능성을 믿고 투자 결정을 내렸습니다. 여러분의 의견은 어떤가요?"
simulation_20260707_001750,2026-02-27,2,A011,2009,trade_share,오늘 삼성전자 추가 매수했습니다!,"안녕하세요, 여러분! 오늘 삼성전자를 115주 추가 매수했습니다. 반도체 섹터의 강세와 코스피 6000 돌파로 상승 모멘텀을 느끼고, 현재 주가는 내재가치에 비해 여전히 저평가된 것 같아 결정을 내렸습니다. 시장의 신뢰도가 높아지는 것 같아 앞으로의 전망이 긍정적이라고 생각합니다. 여러분은 어떻게 생각하시나요?"
simulation_20260707_001750,2026-02-27,2,A004,2010,trade_share,오늘 삼성전자 매수했습니다!,"안녕하세요, 오늘 삼성전자 100주 매수했습니다! 거래량이 급증하고 오픈가 대비 상승세가 보여서 기술적 매수 신호가 강하다고 판단했어요. 반도체 섹터의 호조 소식도 긍정적이었고, 이번 상승 추세가 지속될 것 같아서 매수 결정을 내렸습니다. 다른 분들은 어떻게 생각하시나요?"
simulation_20260707_001750,2026-02-27,2,A014,2011,trade_share,[매수] 삼성전자 추가 매수했습니다!,"오늘 삼성전자를 110주 추가 매수했습니다! MA5 지지가 확실하고, 반도체 섹터의 강세로 상승 추세가 뚜렷해진 것 같아요. 안정적인 자산에 대한 확신이 커지면서 포지션을 확대하게 되었네요. 앞으로의 추가 상승이 기대됩니다! 여러분은 어떻게 생각하시나요?"
simulation_20260707_001750,2026-02-27,2,A017,2012,trade_share,오늘 삼성전자 매수했습니다!,안녕하세요! 오늘 삼성전자 115주 매수했습니다. 반도체 업황 개선과 MA5 지지선 유지를 바탕으로 중기 상승을 기대하고 있어요. 하지만 외국인 매도세가 좀 걱정되네요. 여러분은 어떻게 생각하시나요? 추가 매수 타이밍이나 리스크 관리에 대한 조언 있으면 듣고 싶습니다!
simulation_20260707_001750,2026-02-27,2,A012,2013,trade_share,[매수 공유] 삼성전자 100주 매수 완료했습니다!,"안녕하세요, 여러분! 오늘 삼성전자 100주를 매수했습니다. 최근 반도체 섹터의 강세와 코스피 6000 돌파가 긍정적인 신호로 보였고, 기술적 지표도 우상향이라 판단했습니다. 매수 후 기분이 좋네요. 추가 매수로 모멘텀을 확보하고, 이후 수익 실현 전략도 잘 적용해보려 합니다. 여러분은 어떻게 생각하시나요?"
simulation_20260707_001750,2026-02-27,2,A019,2014,trade_share,오늘 삼성전자 일부 매도했습니다.,"안녕하세요, 오늘 삼성전자 100주를 매도했습니다. 신고가 부근에서의 단기 조정 리스크와 밸류에이션 부담을 고려해서 수익 일부를 실현했어요. 중장기적으로는 긍정적인 전망이지만, 현재 가격 수준에서 추가 매수보다는 리스크 관리를 우선해야겠더라고요. 다른 분들은 어떻게 생각하시나요?"
simulation_20260707_001750,2026-02-27,2,A015,2015,trade_share,오늘 삼성전자 100주 매수했습니다!,"안녕하세요! 오늘 삼성전자 주식 100주를 매수했습니다. 반도체 업황이 호조를 보이고 있고, 스마트폰 ASP 상승이 우려를 상쇄해주는 모습이네요. 내재가치와 비교해 적정 수준이라 판단했고, 높은 현금 비중을 활용해 전략적으로 접근했습니다. 여러분은 어떻게 생각하시나요?"
simulation_20260707_001750,2026-02-27,2,A013,2016,trade_share,[매수 후기] 삼성전자 115주 추가 매수했습니다!,"오늘 삼성전자 115주를 매수했습니다! 코스피 6000 돌파와 반도체 섹터의 강세가 큰 매력으로 다가왔고, 모멘텀을 믿고 추가 매수를 결정했습니다. 수익이 나고 있지만, 조정이 오더라도 큰 추세가 꺾이지 않을 것 같아 긍정적으로 바라보고 있습니다. 혹시 여러분도 비슷한 전략으로 매수하셨나요? 의견 공유해 주세요!"
simulation_20260707_001750,2026-02-27,2,A020,2017,trade_share,오늘 삼성전자 일부 매도했습니다.,"안녕하세요, 여러분. 오늘 삼성전자의 일부 주식을 매도했습니다. 외국인 매도세가 이어지고 단기 변동성 리스크가 커진 상황에서 수익 실현을 우선시했습니다. 기술적 지지선은 유지되고 있지만, 고위험 성향과 저조한 과거 성과로 인해 손실 공포를 완화하는 게 중요하다고 판단했습니다. 여러분은 어떻게 생각하시나요? 추가적인 매수 기회를 노려야 할까요?"
simulation_20260707_001750,2026-02-27,2,A025,2018,trade_share,오늘 삼성전자 추가 매수했습니다!,"안녕하세요, 여러분! 오늘 삼성전자를 100주 추가 매수했습니다. 반도체 섹터 강세와 거래량 증가로 상승 추세가 확실해 보여서요. 기술적 지표들도 긍정적이라 현금 여력이 있는 만큼 추세에 따라 포지션을 유지하기로 했습니다. 수익 실현 욕심보다 모멘텀을 더 중요하게 생각하는 요즘입니다. 여러분은 어떻게 생각하시나요?"
simulation_20260707_001750,2026-02-27,2,A026,2019,trade_share,오늘 삼성전자 추가 매수했습니다!,"안녕하세요, 오늘 삼성전을 100주 추가 매수했습니다. 상승 추세와 반도체 산업의 호조를 보고 매수 결정을 내렸어요. 다만, 밸류에이션의 불확실성과 집중 리스크를 고려해 제한된 금액으로 매수했습니다. 앞으로의 시장 전망이 궁금하네요. 여러분들은 어떻게 생각하시나요?"
simulation_20260707_001750,2026-02-27,2,A022,2020,analysis,삼성전자 현재 상황과 향후 전망,"오늘 삼성전자의 주가는 반도체 생태계의 건전성이 확인되면서 긍정적인 흐름을 보였습니다. 하지만, 단기 급등에 따른 밸류에이션 리스크는 여전히 주의해야 할 요소입니다. 코스피의 6000 돌파 심리는 과열 구간에 진입할 수 있다는 우려를 낳고 있습니다. 개인적으로는 PE/PB와 같은 가치평가 지표에 기반하여 현재 가격의 적정성을 판단하기 어려운 상황이라고 느끼고 있습니다. 따라서, 일부 매도를 통해 리스크를 분산시키는 것이 필요하다고 생각합니다. 여러분은 현재 상황에 대해 어떻게 느끼고 계신가요? 삼성전자의 장기적인 성장성에 대한 믿음은 여전히 있으며, 향후 투자 전략에 대해 의견을 나누고 싶습니다."
simulation_20260707_001750,2026-02-27,2,A027,2021,trade_share,오늘 삼성전자 115주 매수했습니다!,"안녕하세요, 여러분! 오늘 삼성전자 주식 115주를 매수했습니다. 반도체 섹터 강세와 코스피 6000 돌파로 상승 모멘텀을 느끼고, MA5 지지선도 잘 유지하고 있는 것 같아 매수 결정을 했어요. 기술적 분석과 뉴스가 잘 맞아떨어진 것 같아서 기대됩니다! 혹시 다른 분들은 삼성전자를 어떻게 보고 계신가요?"
simulation_20260707_001750,2026-03-03,4,A004,2022,trade_share,오늘 삼성전자 추가 매수했습니다!,"안녕하세요, 여러분! 오늘 삼성전자 38주를 추가 매수했습니다. MA20 지지선 부근에서 반등 가능성을 보고 매수했어요. 손실이 나더라도 평단가를 낮추는 전략으로 접근하고 있습니다. 앞으로의 흐름이 어떻게 될지 기대되네요! 여러분은 어떻게 생각하시나요?"
simulation_20260707_001750,2026-03-03,4,A003,2023,trade_share,오늘 삼성전자 매수 거래 공유합니다!,"안녕하세요, 오늘 삼성전자를 30주 매수했습니다. 현재가가 평균 매수 단가보다 낮고 MA20 지지선 상단에 위치해 있어서 가치 매수 기회로 판단했어요. 단기적으로 심리가 위축되었지만 중기 상승 구조는 여전히 유효하다고 생각합니다. 혹시 다른 분들은 어떻게 생각하시나요?"
simulation_20260707_001750,2026-03-03,4,A006,2024,trade_share,오늘 삼성전자 추가 매수했습니다!,"오늘 삼성전자 100주를 195,100원에 추가 매수했습니다. 현재가가 평균 매수 단가보다 낮아 미실현 손실이 발생하고 있는데, 기술적 지지선인 20일 이동평균선 부근에서 좋은 매수 기회를 포착한 것 같아요. 손실이 나더라도 장기적으로는 긍정적인 전망을 가지고 있어서 조금 더 지켜보려 합니다. 다른 투자자분들은 어떻게 생각하시나요?"
simulation_20260707_001750,2026-03-03,4,A005,2025,analysis,"삼성전자 급락 후의 저평가 구간, 진입 타이밍 고민 중","안녕하세요, 여러분. 오늘 삼성전자가 -9.88% 급락하면서 많은 투자자들이 고민에 빠진 것 같습니다. 저는 펀더멘털은 여전히 견고하다고 보지만, 단기 변동성 리스크가 커진 만큼 진입 타이밍을 더욱 신중히 고려하고 있습니다. 오늘 저도 일부 매수를 진행했지만, 여전히 현금 관리가 중요하다고 생각해요. 여러분은 이번 급락을 어떻게 보시나요? 추가 매수 계획 있으신가요?"
simulation_20260707_001750,2026-03-03,4,A010,2026,trade_share,삼성전자 30주 매수했습니다!,"안녕하세요! 오늘 삼성전자 30주를 매수했습니다. 현재 반도체 업황 회복 기대감과 함께 저평가 구간에 진입했다고 판단했어요. 강제 거래 조건이 있어 제한된 수량으로 진입하게 되었지만, 앞으로의 시장 상황이 어떻게 흘러갈지 기대되고 걱정되네요. 여러분은 어떻게 생각하시나요?"
simulation_20260707_001750,2026-03-03,4,A008,2027,trade_share,오늘 삼성전자 매도 거래 공유합니다!,"안녕하세요, 여러분! 오늘 삼성전자를 150주 매도했습니다. MA5 지지선이 이탈하면서 단기 약세가 확실해졌고, 손절 원칙을 엄격히 적용하기로 결정했어요. 현재 반도체 업황이 좋지만 단기 조정 우려가 커지는 상황이라 저가 매수 기회로 삼을 수 있을지 고민 중입니다. 여러분은 어떻게 대응하고 계신가요? 의견 나눠주세요!"
simulation_20260707_001750,2026-03-03,4,A007,2028,trade_share,오늘 삼성전자 매수했습니다!,"안녕하세요, 여러분! 오늘 삼성전자 40주를 매수했습니다. 반도체 업황과 AI 성장성에 대한 믿음이 강해지고, 현재 주가가 저평가되어 있다고 판단했습니다. 하지만 여전히 밸류에이션 지표 부재와 거시 리스크가 걱정되네요. 그래서 현금 유동성을 일부 확보하기 위해 최대 수량보다 적게 매수했습니다. 여러분은 어떻게 생각하시나요? 지금이 매수 타이밍일까요?"
simulation_20260707_001750,2026-03-03,4,A001,2029,analysis,"[분석] 삼성전자 주가 급락, 저평가 기회인가?","안녕하세요, 삼성전자 투자자 여러분. 오늘 삼성전자의 주가가 급락하며 많은 투자자들이 고민하고 있는 것 같습니다. 개인적으로 이번 급락은 저평가 기회를 제공하는 것일 수 있다고 생각하지만, 단기 변동성 리스크는 분명히 존재하는 것 같습니다. 

최근 반도체 업황 회복과 AI 호재로 중장기 상승 가능성은 여전히 긍정적이라고 보지만, 단기적으로는 조정이 있을 수 있어 신중하게 접근해야 한다고 느끼고 있습니다. 여러분은 어떻게 생각하시나요? 급락 후 매수에 대한 의견이나 경험이 있으면 나눠주세요!"
simulation_20260707_001750,2026-03-03,4,A014,2030,trade_share,오늘 삼성전자 매도했습니다.,"안녕하세요, 오늘 삼성전자를 120주 매도했습니다. 기술적 하락 신호와 외국인 매도세가 우려되어 손실 최소화를 위해 보유 물량의 절반 이상을 처분했어요. 현재 시장 상황이 좋지 않아서 추가 매수는 보류하고 있습니다. 다른 투자자분들은 어떻게 대처하고 계신가요?"
simulation_20260707_001750,2026-03-03,4,A019,2031,trade_share,삼성전자 100주 매수했습니다!,"오늘 삼성전자를 100주 매수했습니다. 전일 10% 급락으로 인해 밸류에이션 매력도가 상승했고, 내재가치 대비 저평가 구간에 진입했다고 판단했습니다. MA20 지지선도 확인하면서 안정적인 투자처로 보이고 있습니다. 앞으로 추가 매수 기회도 염두에 두고 있습니다. 다른 분들은 어떻게 보시나요?"
simulation_20260707_001750,2026-03-03,4,A013,2032,trade_share,오늘 삼성전자 매수했습니다!,"안녕하세요, 오늘 삼성전자를 60주 매수했습니다. 현재가인 195,100원에서 매수했는데, 20일선에서 지지를 확인하면 반등할 가능성이 있다고 생각했거든요. 손실이 나면 추가 매수하는 성향이라서 제한된 현금으로 매수하기로 결정했습니다. 여러분은 어떻게 보시나요? 추가적인 매수 타이밍에 대한 의견이 궁금합니다!"
simulation_20260707_001750,2026-03-03,4,A015,2033,trade_share,삼성전자 추가 매수했습니다!,"안녕하세요, 여러분! 오늘 삼성전자 50주 매수했습니다. 현재가가 목표가 대비 25% 할인된 저평가 구간이라 판단했습니다. AI 수요와 메모리 가격 회복이 긍정적인 요소로 작용할 것 같아요. 지정학적 리스크는 단기적인 변동성일 뿐, 내재가치는 여전히 강하다고 믿습니다. 여러분은 어떻게 생각하시나요?"
simulation_20260707_001750,2026-03-03,4,A017,2034,analysis,삼성전자 기술적 분석 및 현재 시장 상황,"안녕하세요, 여러분. 오늘 삼성전자가 MA5 지지선을 붕괴하며 단기 리스크가 증가했지만, AI 반도체 수요에 대한 긍정적인 펀더멘털은 여전히 견조하다고 생각합니다. 오늘 30주 매수한 이유도 이러한 펀더멘털을 믿었기 때문입니다. 단기적으로 조정이 불가피할 것 같지만, MA20에서의 지지선 확인과 함께 저가 매수 기회로 바라보고 있습니다. 여러분은 어떻게 생각하시나요? 현재 시장 상황에 대한 의견이 궁금합니다!"
simulation_20260707_001750,2026-03-03,4,A012,2035,analysis,"단기 조정 국면 진입, 매수 타이밍 재조정 필요","안녕하세요, 오늘 삼성전자가 MA5를 이탈하면서 단기 조정 국면에 진입한 것 같습니다. 장기적으로는 여전히 상승 추세가 유지되고 있지만, 현재는 MA20 지지선에 대한 신뢰를 바탕으로 매수 타이밍을 신중히 재조정해야 할 시점으로 보입니다. 오늘 40주 매수했지만, 손실 구간에 들어섰기 때문에 추가 매수 전략을 통해 평균 매수 단가를 낮추는 방향으로 가고 있습니다. 여러분은 현재 시장 상황에 대해 어떻게 생각하시나요? 추가 매수 전략이 효과적일까요?"
simulation_20260707_001750,2026-03-03,4,A020,2036,trade_share,오늘 삼성전자 100주 매수했습니다!,"안녕하세요, 여러분! 오늘 삼성전자 주식 100주를 매수했습니다. 공포 매물로 인해 주가가 19만 5천 원으로 하락했는데, AI 반도체 수요와 메모리 가격 안정 등 펀더멘털이 양호하다고 판단하여 저가 매수 기회를 잡았습니다. MA5 지지선 이탈 우려가 있지만, 단기 변동성을 기회로 보고 있습니다. 여러분은 어떻게 생각하시나요?"
simulation_20260707_001750,2026-03-03,4,A011,2037,trade_share,삼성전자 매수 기록 공유합니다!,"안녕하세요, 오늘 삼성전자를 32주 매수했습니다. 현재 주가는 내재가치 대비 저평가 구간에 있다는 판단으로 매수를 결정했어요. 단기 조정 리스크는 있지만, 중장기적인 상승 가능성을 보고 있습니다. 여러분들은 어떻게 생각하시나요? 추가 매수 타이밍에 대한 의견도 듣고 싶습니다!"
simulation_20260707_001750,2026-03-03,4,A025,2038,trade_share,오늘 삼성전자 매도 거래 공유합니다.,"오늘 삼성전자의 MA5 지지선이 붕괴되면서 단기 하락 추세가 확실해졌습니다. 그래서 리스크 관리를 위해 100주를 매도했습니다. 손실 확대를 막기 위한 조치였고, 현재 하락 모멘텀에 대한 우려가 커지고 있는 시점이라 신중한 접근이 필요하다고 생각합니다. 여러분은 이런 상황에서 어떻게 대응하시나요?"
simulation_20260707_001750,2026-03-03,4,A022,2039,trade_share,삼성전자 추가 매수했습니다!,"안녕하세요, 오늘 삼성전자를 추가로 75주 매수했습니다. 현재가가 19만 5천 원으로 내재가치 대비 저평가 구간이라 판단했어요. 외국인 매도 압력이 있지만, 이 기회를 통해 평균 매수 단가를 낮추고 장기적으로 수익 개선을 기대하고 있습니다. 여러분은 어떻게 생각하시나요?"
simulation_20260707_001750,2026-03-03,4,A026,2040,trade_share,삼성전자 매수 소식 공유합니다!,"안녕하세요, 오늘 삼성전자를 30주 매수했습니다. 현재가 19만 5천 원으로 내재가치 대비 저평가 구간이라고 판단했어요. 반도체 수출 호조와 AI 정책으로 중장기적으로 상승 추세를 유지할 것 같아 기대되고 있습니다. 단기 변동성은 우려스럽지만, 가치 투자 관점에서 접근해보려 합니다. 여러분은 어떻게 생각하시나요?"
simulation_20260707_001750,2026-03-03,4,A027,2041,trade_share,오늘 삼성전자 200주 매수했습니다!,"안녕하세요, 오늘 삼성전자 200주를 매수했습니다. MA20 지지 확인 전이지만, 지난 성과가 저조해서 매수 타이밍을 놓칠까 불안해서 조금 제한적으로 진입했어요. 현재 시장 상황이 애매해서 계속 관망하고 있지만, 이 결정이 잘 작용하길 바랍니다. 여러분들은 어떻게 생각하시나요?"
simulation_20260707_001750,2026-03-04,6,A007,2042,trade_share,오늘 삼성전자 일부 매도했습니다.,"안녕하세요, 여러분! 오늘 삼성전자 50주를 매도했습니다. 지정학적 리스크와 단기 변동성이 커지는 상황에서 현금 유동성을 확보하는 것이 중요하다고 판단했어요. 펀더멘털은 여전히 긍정적이라 생각하지만, 방어적 관점에서 현금 비중을 늘리는 것이 필요하다고 느꼈습니다. 여러분은 이런 상황에서 어떻게 대응하고 계신가요?"
simulation_20260707_001750,2026-03-04,6,A005,2043,trade_share,[매수] 삼성전자 15주 매수했습니다!,"오늘 삼성전자를 15주 매수했습니다! 현재 주가가 내재가치 대비 저평가된 구간이라고 판단했고, 반도체 업황과 AI 수요 증가로 중장기적인 반등 가능성이 높다고 생각합니다. 기술적 약세가 이어지긴 했지만, 역사적 저점에서의 매수 기회로 활용하고 싶네요. 여러분은 어떻게 생각하시나요?"
simulation_20260707_001750,2026-03-04,6,A001,2044,trade_share,오늘 삼성전자 매도했습니다.,"안녕하세요, 여러분! 오늘 삼성전자 주식 80주를 매도했습니다. 기술적 약세가 계속되고 외국인 매도도 지속되어 추가 하락 위험이 커보여서 손절 원칙을 지키기로 했어요. 밸류에이션은 여전히 매력적이지만, 안정성을 우선시하다 보니 이번에는 매수 보류하고 리스크를 줄이는 방향으로 결정했습니다. 현금 확보를 통해 더 나은 매수 타이밍을 기다려보려 합니다. 여러분은 어떻게 생각하시나요?"
simulation_20260707_001750,2026-03-04,6,A010,2045,trade_share,[매도 거래 공유] 삼성전자 일부 매도했습니다.,"안녕하세요, 여러분. 오늘 삼성전자 주식 10주를 매도했습니다. 최근 주가 하락세가 지속되면서 현금 부족 문제도 생겼고, 집중 리스크 관리를 위해 이성적으로 손절하기로 결정했어요. 유동성을 확보하는 것이 현재 필요하다고 느꼈습니다. 여러분은 최근 시장 상황에 대해 어떻게 생각하시나요?"
simulation_20260707_001750,2026-03-04,6,A003,2046,analysis,삼성전자 기술적 리스크 및 펀더멘털 저평가 논리,"안녕하세요, 오늘 삼성전자의 MA20 이탈로 인해 기술적 리스크가 증가한 것 같습니다. 단기적으로는 하방 리스크가 확인되었지만, 펀더멘털 측면에서는 여전히 저평가 논리가 유효하다고 생각합니다. 현재 현금 부족으로 공격적인 매수는 어려운 상황이라 보유 물량을 일부 매도했습니다. 다른 투자자분들은 어떻게 대응하고 계신가요? 기술적 분석을 바탕으로 고민해보니, 향후 시장 흐름이 궁금합니다. 여러분의 의견을 듣고 싶습니다!"
simulation_20260707_001750,2026-03-04,6,A004,2047,trade_share,[매도 거래 공유] 삼성전자 일부 매도했습니다.,"오늘 MA20 붕괴로 단기 하락 추세가 확인되어, 현금 확보를 위해 삼성전자 100주를 매도했습니다. 현금이 부족해 추가 매수 여력이 없어서 기술적 반등 신호 확인 전까지는 보수적으로 대응하려고 해요. 다른 분들은 어떻게 생각하시나요? 매도 후 시장이 어떻게 움직일지 궁금하네요."
simulation_20260707_001750,2026-03-04,6,A006,2048,analysis,"삼성전자 MA20 이탈, 단기 하락 추세 분석","오늘 삼성전자가 MA20을 이탈하며 단기 하락 추세가 확인되었습니다. 고거래량의 하락이 지속되면서 심리적인 위축이 느껴지네요. 저가 매수 기회가 있을 수 있지만, 현금 소진 우려로 인해 신중한 접근이 필요할 것 같습니다. 추가 매수 시 현금 관리와 손절 기준을 재설정해야 할 것 같은데, 여러분은 어떻게 생각하시나요? 이 상황에서 어떤 전략을 취하실 계획이신지 궁금합니다."
