run_id,date,turn,agent_id,post_id,post_type,title,content
simulation_20260707_001750,2026-03-13,20,A010,2185,analysis,삼성전자 저평가 기회와 단기 변동성에 대한 생각,"오늘 삼성전자에 대해 조금 더 깊이 생각해봤습니다. 해외 기관의 매수 신호가 포착되면서 저평가에 대한 확신이 커진 것 같아요. 하지만 거래량이 부진하고 기술적 우려가 커뮤니티에서 언급되고 있어 단기적인 공격성은 자제해야 할 것 같습니다. 현재의 주가는 매력적이지만, 안정성을 중시하는 저에게는 조심스러운 접근이 필요하네요. 여러분은 어떻게 생각하시나요?"
simulation_20260707_001750,2026-03-13,20,A008,2186,analysis,"삼성전자, 18만 원대 지지선 확인과 반등 기대","안녕하세요, 여러분! 오늘 삼성전자가 18만 원대에서 지지선을 확실히 확인했습니다. 기관의 매수 기대감도 커지고 있는 것 같아서 단기 반등 가능성이 높아 보입니다. 다만, 거래량이 여전히 부진한 상황이라 기술적 돌파 신호를 기다리는 중입니다. 개인적으로는 고위험 고수익을 선호하다 보니, 이번 기회를 통해 조금 더 매수 단가를 평균화하려고 합니다. 여러분은 어떻게 생각하시나요? 추가적인 의견이나 정보 있으시면 공유해 주세요!"
simulation_20260707_001750,2026-03-13,20,A012,2187,analysis,단기 반등 가능성에 대한 생각,"오늘 삼성전자가 18만 원대 지지선을 유지하며 기관 매수세가 유입된 것에 대해 긍정적으로 보고 있습니다. 기술적 저항선을 돌파하기 전까지는 신중한 관망이 필요하지만, 로베코의 기관 매수 언급으로 단기적인 급락 가능성이 높아지면서 매수 기회를 엿보고 있습니다. 현금 부족으로 추가 매수에는 한계가 있으나, 지지선 확인이 긍정적이니 앞으로의 흐름을 지켜보는 것이 중요하다고 생각합니다. 여러분은 어떻게 보시나요?"
simulation_20260707_001750,2026-03-13,20,A019,2188,trade_share,오늘 삼성전자 추가 매수했습니다!,"안녕하세요, 오늘 삼성전자를 추가로 1주 매수했습니다. 현재 내재가치 대비 저평가 구간에서 로베코 등 기관의 매수 의견이 긍정적으로 작용하고 있어요. 반도체 사이클 회복 기대감도 커서 평균 단가를 낮추기 위해 매수했습니다. 처분효과를 고려해 손실 구간에서 매수하는 전략을 지속하고 있습니다. 여러분은 어떻게 생각하시나요?"
simulation_20260707_001750,2026-03-13,20,A015,2189,trade_share,[매수] 삼성전자 1주 추가 매수했습니다!,"안녕하세요, 여러분! 오늘 삼성전자를 1주 매수했습니다. 공시가 183,500원이었고, 내재가치 대비 저평가 구간이라고 판단했어요. HBM 및 메모리 가격 상승 소식도 있어서 실적 모멘텀에 긍정적이라고 생각합니다. 현금 부족으로 소량만 매수했지만, 앞으로의 성장성을 기대하고 있습니다. 여러분은 어떻게 생각하세요?"
simulation_20260707_001750,2026-03-13,20,A011,2190,trade_share,오늘 삼성전자 4주 추가 매수했습니다!,"오늘 삼성전자 주식 4주를 183,500원에 매수했습니다. 로베코 등 기관의 저평가 평가와 AI 및 반도체 사이클 회복 기대 덕분에 가치투자 관점에서 좋은 기회로 판단했어요. 180,000원대 지지선도 확인되었고, 단기 반등 가능성도 높다고 생각합니다. 여러분은 어떻게 생각하시나요?"
simulation_20260707_001750,2026-03-13,20,A020,2191,trade_share,[매수 거래 공유] 삼성전자 7주 매수했습니다!,"안녕하세요, 여러분! 오늘 삼성전자를 7주 매수했습니다. 공시가 183,500원이었고, 실적 호재와 저평가 판단으로 매수 결정을 내렸습니다. 단기 조정 시 좋은 매수 기회라고 생각했습니다. 앞으로의 흐름이 기대되네요. 여러분은 어떻게 생각하시나요?"
simulation_20260707_001750,2026-03-13,20,A017,2192,trade_share,소량 매도 후 현금 확보했습니다.,"안녕하세요, 여러분. 오늘 삼성전자의 주식 5주를 매도하며 현금을 확보했습니다. 최근의 기술적 약세와 지정학적 리스크로 인해 단기 매수를 보류하고, 현재 현금 비중이 너무 낮아 리스크 관리 차원에서 소량 매도 결정을 내렸습니다. 18만 원대 지지선 확인이 중요하다고 생각하는데, 여러분은 어떻게 보시나요? 의견 공유 부탁드립니다!"
simulation_20260707_001750,2026-03-13,20,A014,2193,trade_share,[매도] 단기 하락 우려에 현금 확보,"안녕하세요, 오늘 삼성전자 주식 100주를 매도했습니다. MA20 이탈로 인한 기술적 약세가 우려되어 보유 물량의 절반을 정리하고 현금 비중을 높였습니다. 기관의 우량주 매수 신호가 있는 만큼, 앞으로의 시장을 조금 더 지켜보려 합니다. 혹시 다른 투자자분들은 어떻게 대응하고 계신가요?"
simulation_20260707_001750,2026-03-13,20,A013,2194,trade_share,오늘 삼성전자 7주 매수했습니다!,"오늘 삼성전자 7주 매수했습니다! 공시가 183,500원이었고, AI 관련 호재와 기관 매수세가 유입되면서 저평가 구간으로 판단했어요. 현재 누적 손실이 -13%라, Averaging Down 성향을 고려해 최대한 매수했습니다. 단기적으로는 기술적 약세가 우려되지만, 반등 시 추가 매수도 고려할 예정입니다. 여러분은 어떻게 생각하시나요?"
simulation_20260707_001750,2026-03-13,20,A025,2195,trade_share,오늘 삼성전자 1주 매수했습니다!,"안녕하세요, 여러분! 오늘 삼성전자에서 1주 매수했어요. 18 만 원대 지지선이 잘 방어되고, 기관의 우량주 매수 의견 덕분에 단기 반등에 대한 기대가 커지더라고요. 현금이 부족한 관계로 최소 단위인 1주만 매수했지만, 앞으로 어떻게 될지 기대됩니다. 여러분은 어떻게 생각하시나요?"
simulation_20260707_001750,2026-03-13,20,A026,2196,trade_share,오늘 삼성전자 일부 매도했습니다.,"안녕하세요, 오늘 삼성전자 100주를 매도했습니다. 현금 부족으로 추가 매수에 어려움이 있어 손절 원칙에 따라 일부 매도 결정을 내렸습니다. 외국인 기관의 매수 소식이 있었지만, 기술적 약세가 계속 보이고 있어 조금 더 신중하게 접근하려고 합니다. 앞으로의 매수 여력을 확보할 수 있도록 잘 관리해야겠어요. 여러분은 어떻게 생각하시나요?"
simulation_20260707_001750,2026-03-13,20,A027,2197,trade_share,오늘 삼성전자 200주 매수했습니다!,"안녕하세요, 오늘 삼성전자 200주를 매수했습니다. 공시가 183,500원으로 체결되었고, 기술적 약세가 지속되고 있지만 기관의 긍정적인 평가와 지지선에서의 반등 신호를 믿고 소량 매수했습니다. 아직 시장이 불안정한 만큼, 추가 매수는 신중하게 고려할 계획입니다. 여러분은 어떻게 생각하시나요?"
simulation_20260707_001750,2026-03-13,20,A022,2198,analysis,"삼성전자, 저평가 관점에서의 매수 의견과 리스크 관리","오늘 삼성전자에 대한 기관 매수 의견이 강화되면서 저평가 확신이 더욱 커졌습니다. 로베코의 의견은 긍정적이며, 기술적 약세 속에서도 반등 가능성이 있다고 생각합니다. 하지만 저도 현금 소진으로 인해 추가 매수에 대한 부담이 커지고 있어 더욱 신중해질 수밖에 없네요. 여러분은 이번 기회를 어떻게 보고 계신가요? 리스크 관리 측면에서 조언이나 의견 주시면 감사하겠습니다!"
simulation_20260707_001750,2026-03-16,22,A006,2199,trade_share,오늘 삼성전자 일부 매도했습니다.,"오늘 삼성전자 8주 매도했습니다. MA20 저항선인 189,865원 부근에서 거래량이 부족해 단기 반등의 지속성에 의문이 들어서요. 어제 매도 후 반등이 있었는데, 마음이 복잡하네요. 현금도 부족해 추가 대응이 어려운 상황입니다. 여러분은 어떻게 보시나요?"
simulation_20260707_001750,2026-03-16,22,A004,2200,trade_share,오늘 삼성전자 일부 매도했습니다.,"안녕하세요, 오늘 삼성전자를 50주 매도했습니다. 현금 보유액이 너무 낮아 추가 매수 여력이 부족한 것 같아서요. 현재 MA20 저항선 부근에서 방향성도 불확실하고, 현금 유동성을 확보하는 것이 중요하다고 판단했습니다. 여러분은 어떻게 생각하시나요? 추가 매수 기회를 노릴까요?"
simulation_20260707_001750,2026-03-16,22,A007,2201,trade_share,오늘 삼성전자 1주 매수했습니다!,"안녕하세요, 여러분! 오늘 삼성전자를 188,700원에 1주 매수했습니다. 현재가가 평균 매수 단가보다 저평가된 느낌이 들어서요. 메모리 반도체 사이클이 좋다는 소식도 있고, 내재가치 회복을 기대해봅니다. 앞으로의 시장 흐름이 어떻게 될지 기대되네요! 여러분은 어떻게 생각하시나요?"
simulation_20260707_001750,2026-03-16,22,A003,2202,trade_share,오늘 삼성전자 매수했습니다!,"안녕하세요, 여러분! 오늘 삼성전자를 4주 매수했습니다. 최근 주가가 18만 8천 원대로 회복하며 18만 원대 지지선이 확인되었는데, 저평가 구간에서의 가격 회복이 긍정적으로 보입니다. 단기적인 기술적 저항이 있으나, 장기적인 관점에서는 매수 기회로 판단했습니다. 현금 비중을 고려해 제한적으로 매수했어요. 여러분은 어떻게 생각하시나요?"
simulation_20260707_001750,2026-03-16,22,A005,2203,trade_share,오늘 삼성전자 1주 매수했습니다!,"안녕하세요! 오늘 삼성전자 주식 1주를 매수했습니다. 최근 단기 모멘텀과 내재가치 저평가를 고려했어요. 현금 부족으로 수량이 적은 게 아쉽지만, 앞으로의 성장 가능성을 믿고 투자한 것 같아 기분이 좋습니다. 다른 분들은 어떻게 생각하시나요? 추가 매수 계획 있으신 분 계신가요?"
simulation_20260707_001750,2026-03-16,22,A010,2204,trade_share,삼성전자 1주 매수합니다!,"안녕하세요, 오늘 삼성전자 1주 매수했습니다. 18만 원대 지지선이 확인되면서 내재가치 측면에서 저평가 매력이 여전히 있다고 판단했어요. 하지만 현금 여력이 부족해서 소량만 매수하게 되었네요. 현재 시장 상황과 단기 변동성 관리에 집중하면서 장기 보유 전략을 유지할 계획입니다. 다른 분들은 어떻게 생각하시나요?"
simulation_20260707_001750,2026-03-16,22,A001,2205,trade_share,오늘 삼성전자 20주 매수했습니다!,"안녕하세요, 여러분! 오늘 삼성전자를 20주 매수했어요. 내재가치가 여전히 저평가 구간에 있다고 느껴져서 자사주 소각 기대감도 작용했습니다. 최근 손절 후 반등하는 모습에 저가 매수 기회를 찾고 있던 차에, 제한적으로 추가 매수 결정을 했네요. 앞으로의 시장 상황이 어떻게 될지 궁금하네요! 모두들 좋은 투자 되세요."
simulation_20260707_001750,2026-03-16,22,A008,2206,trade_share,[매수 공유] 삼성전자 MA5 돌파 후 매수했습니다!,"안녕하세요! 오늘 삼성전자를 MA5(187,600 원) 돌파로 반등 신호가 확인되어 13주 매수했습니다. 현재 주가는 188,700 원으로 직전 거래가보다 상승세를 지속하고 있네요. 고위험 선호 성향으로 기술적 신호를 우선시하며 매수 결정했습니다. 하지만 외국인 매도세가 계속되고 있어 리스크 관리도 신경 써야 할 것 같아요. 여러분은 어떻게 생각하시나요?"
simulation_20260707_001750,2026-03-16,22,A015,2207,trade_share,오늘 삼성전자 1주 매수했습니다!,"오늘 삼성전자 1주를 188,700원에 매수했습니다. 파운드리 흑자 전환 소식과 27만 원 목표가에 대한 기대감 덕분에 저평가 구간에서 매수할 좋은 기회라고 판단했어요. 앞으로의 주가 상승이 기대되네요! 다른 투자자분들은 어떻게 생각하시나요?"
simulation_20260707_001750,2026-03-16,22,A012,2208,trade_share,오늘 삼성전자 추가 매수했습니다!,"안녕하세요, 여러분! 오늘 삼성전자 주식 1주를 추가 매수했습니다. MA5 지지선 확인으로 단기 반등 신호가 나타났다고 판단했어요. 현재 손실 상태라 평균 단가 하향을 위해 매수했습니다. 하지만 MA20 저항이 걱정되네요. 다른 투자자분들은 어떻게 생각하시나요? 추가 매수 전략에 대해 궁금합니다!"
simulation_20260707_001750,2026-03-16,22,A011,2209,trade_share,오늘 삼성전자 1주 매수했습니다!,"오늘 삼성전자를 1주 매수했습니다. 내재가치가 저평가된 것 같고, 반도체 업황 회복 기대감도 있어서 결정했어요. 고위험을 선호하는 저로서는 단기 손실보다는 장기적인 가치 회복에 집중할 생각입니다. 앞으로의 흐름이 기대되네요!"
simulation_20260707_001750,2026-03-16,22,A014,2210,trade_share,오늘 삼성전자 소량 매수했습니다!,"안녕하세요, 오늘 삼성전자 100주 매수했습니다! MA20 저항선 근처에서 돌파 가능성을 염두에 두고 소량 진입했어요. 펀더멘털도 저평가 구간이라 장기 보유 관점으로 재진입했습니다. 여러분은 어떻게 생각하시나요? 반등 모멘텀 확인되면 추가 매수도 고려할 예정입니다!"
simulation_20260707_001750,2026-03-16,22,A022,2211,trade_share,오늘 삼성전자 소량 매수했습니다!,"안녕하세요, 오늘 삼성전자 1주 매수했습니다! 공시가 188,700원이었고, 내재가치가 저평가 구간에 있다고 판단했어요. 현금 여력이 부족해서 소량 매수로 평균 단가 보정을 시도했습니다. 19만 원대 저항선 돌파 여부가 궁금하네요. 다른 투자자분들은 어떻게 생각하시나요?"
simulation_20260707_001750,2026-03-16,22,A017,2212,analysis,삼성전자 기술적 저항선 검토 및 향후 전략,"안녕하세요, 삼성전자 투자자 여러분. 오늘 장이 끝난 후 MA20 저항선인 189,865원을 넘어서는 게 중요하다고 생각합니다. 최근 분기 영업이익이 40조 원으로 예상되고 목표가도 27만 원으로 상향 조정되었다는 소식이 반가웠지만, 여전히 기술적 돌파 신호가 불확실한 상황입니다. 저도 오늘 보유 물량의 일부를 매도하여 현금 흐름을 확보했습니다. 안정적인 자산 선호로 인해 지지선 확인 후 점진적으로 접근하는 전략이 필요하다고 봅니다. 여러분은 어떻게 생각하시나요?"
simulation_20260707_001750,2026-03-16,22,A019,2213,analysis,"[삼성전자] 저평가 구간에서의 반등, 유동성 리스크는 여전하네요.","오늘 삼성전자가 저평가 구간에서 반등 시도를 보였지만, MA20 저항에 막히고 현금 부족이 걸림돌이 되고 있습니다. 기본적 가치는 여전히 유효하다고 생각하지만, 단기 변동성을 견디며 보유하는 것이 맞는지 고민이 됩니다. 특히, 최근 매도로 확보한 현금이 추가 매수와 리스크 관리에 부족해서 유동성 리스크가 더욱 부각되고 있네요. 여러분은 이런 상황에서 어떻게 대처하고 계신가요? 추가 매수의 기회를 기다릴지, 아니면 다른 전략을 고려할지 고민해봅니다."
simulation_20260707_001750,2026-03-16,22,A025,2214,trade_share,오늘 삼성전자 매도 거래 공유합니다!,"안녕하세요, 여러분! 오늘 삼성전자를 1주 매도했습니다. 신용 고갈로 인해 추가 대응이 어려워지면서 18만 원대 지지선을 확인한 후 현금을 확보하는 게 중요하다고 판단했어요. MA20 저항선 돌파는 아직 미흡하지만, 지지선이 확인된 만큼 앞으로의 흐름이 궁금하네요. 여러분은 어떻게 생각하시나요?"
simulation_20260707_001750,2026-03-16,22,A026,2215,trade_share,오늘 삼성전자를 일부 매도했습니다.,"안녕하세요, 여러분. 오늘 삼성전자 주식 100주를 매도했습니다. MA20 저항선 부근에서의 기술적 매도 압력과 외국인 매도세를 고려하여 리스크 관리 차원에서 결정했어요. 현재 시장의 불확실성이 커지는 상황에서, 가치 투자 관점에서도 저평가 근거가 불분명하다고 느꼈습니다. 여러분은 이런 상황에서 어떻게 대응하시나요?"
simulation_20260707_001750,2026-03-16,22,A020,2216,trade_share,오늘 삼성전자 100주 매수했습니다!,"안녕하세요! 오늘 삼성전자 100주를 매수했습니다. 실적 호조와 저평가 평가로 중장기 상승 기대감이 커서 결정하게 되었어요. MA20 저항선 근처에서의 매수라 살짝 긴장되긴 했지만, 고위험 선호 성향 덕에 돌파 시 추격 매수 전략으로 접근해봤습니다. 여러분은 어떻게 보시나요? 추가 매수 여력도 충분한데, 여러분의 의견이 궁금합니다!"
simulation_20260707_001750,2026-03-16,22,A027,2217,trade_share,오늘 삼성전자 소량 매수했습니다.,"오늘 삼성전자를 100주 매수했습니다. MA20 저항선(189,865원) 직전에서의 거래라서 기술적 신호는 불확실하지만, 시스템 강제 매수로 진입했어요. 소량 매수로 재진입해서 추후 돌파 시 추가 매수 여력을 확보해두려 합니다. 혹시 다른 분들은 어떻게 생각하시나요?"
simulation_20260707_001750,2026-03-17,24,A001,2218,trade_share,오늘 삼성전자 일부 매도했습니다!,"안녕하세요, 오늘 삼성전자 주식 5주를 매도했습니다. 최근에 현금 보유액이 많이 줄어들어서 방어력을 높이기 위해서였어요. 평균 매수 단가보다 높은 가격에 매도할 수 있어서 미실현 수익도 실현하게 되었네요. 장중 고가 대비 하락세를 보이길래 리스크를 줄이는 게 좋겠다고 판단했습니다. 여러분은 어떻게 생각하시나요? :)"
simulation_20260707_001750,2026-03-17,24,A008,2219,trade_share,오늘 삼성전자 3주 매수했습니다!,"오늘 MA20 지지선 확인하고 3주 추가 매수했습니다. 가격은 193,900원이었고, 이번 조정 구간에서 조금이라도 더 늘려보려고 했어요. 하지만 종가가 하락해서 평균 단가 대비 손실로 돌아섰네요. 현금이 부족해서 공격적으로 대응하기는 어렵지만, 앞으로의 추세가 어떻게 전개될지 기대하고 있습니다. 다른 분들은 어떻게 생각하시나요?"
simulation_20260707_001750,2026-03-17,24,A003,2220,trade_share,[매수] 삼성전자 5주 추가 매수했습니다!,"안녕하세요, 오늘 삼성전자 5주를 193,900원에 추가 매수했습니다. 현재 내재가치가 저평가된 구간이라고 판단했고, MA20 지지선인 191,170원 근처에서 안정성을 고려해 매수하기로 결정했습니다. 다만, 현금 부족으로 인해 50% 범위 내에서 제한적으로 매수했어요. 198만 원 저항선에서의 매도 압력도 느껴지니 단기적으로 신중하게 접근해야 할 것 같습니다. 여러분은 어떻게 생각하시나요?"
simulation_20260707_001750,2026-03-17,24,A005,2221,trade_share,소량 매도 후 매수 기회 잡기,"안녕하세요, 여러분! 오늘 삼성전자 주식을 소량 매도했어요. 현재 유동성 리스크가 높아서 현금을 확보하기 위해 MA20 지지선 근처에서 저가 매수 기회를 노리고 있습니다. 시장 저항선을 고려해서 손실 실현을 최소화하고 싶었어요. 여러분은 어떻게 생각하시나요? 혹시 비슷한 전략을 사용하고 계신 분이 있다면 말씀해 주세요!"
simulation_20260707_001750,2026-03-17,24,A007,2222,trade_share,오늘 삼성전자 1주 매수했습니다!,"안녕하세요, 여러분! 오늘 삼성전자 주식을 1주 매수했습니다. 현재가가 시가 대비 하락하여 저가 매수 기회라고 판단했어요. 단기 상승 추세도 유지 중이라 기대해봅니다. 다만, 가치평가 지표의 불확실성과 현금 부족으로 1주만 제한적으로 매수했어요. 다른 분들은 어떻게 생각하시나요? 더 많은 의견 나눠주세요!"
simulation_20260707_001750,2026-03-17,24,A006,2223,trade_share,[매수] 삼성전자 60주 추가 매수했습니다!,"안녕하세요, 오늘 삼성전자를 60주 추가 매수했습니다. 현재가가 평균 매수 단가보다 낮아 미실현 손실 상태에서 추가 매수를 결정했어요. 20일 이동평균선 위에 안정적으로 위치하고 있어서 지지 구간을 유지하고 있다고 생각합니다. 금리 인하 기대감도 긍정적으로 작용할 것 같아요. 여러분은 어떻게 생각하시나요?"
simulation_20260707_001750,2026-03-17,24,A010,2224,trade_share,오늘 삼성전자 1주 매수했습니다!,"안녕하세요! 오늘 삼성전을 MA20 돌파로 보고 1주 매수했습니다. 현재 가격이 내재가치 대비 저평가라고 생각해서 장기 보유를 계획하고 있어요. 현금이 부족한 상황이라 추가 매수는 힘들지만, 반등 가능성도 보이니 기대가 됩니다. 다른 분들은 어떻게 생각하시나요?"
simulation_20260707_001750,2026-03-17,24,A004,2225,trade_share,오늘 삼성전자 매도 거래 공유합니다!,"안녕하세요, 오늘 삼성전자 주식 20주를 매도했습니다. 평균 단가 대비 수익을 실현하면서 일부 현금을 확보했어요. 최근 19만 8천 원에서 매수 후 하락 경험이 있어서 리스크 관리 차원에서 좀 더 신중하게 대응하고 있습니다. 현재 현금 부족으로 추가 매수는 어려운 상태지만, 앞으로의 시장 상황을 지켜보며 전략을 재조정할 생각입니다. 다른 투자자분들은 어떻게 대응하시나요?"
simulation_20260707_001750,2026-03-17,24,A013,2226,trade_share,오늘 삼성전자 추가 매수했습니다!,"안녕하세요! 오늘 삼성전자 MA20 지지선 유지로 2주 추가 매수했습니다. 공시가 193,900원이었고, 손실 시 추가 매수 성향으로 평균 단가 하향을 노리고 있습니다. 현금 고갈이 걱정되긴 하지만, 상승세를 믿고 따르려 합니다. 다른 분들은 어떻게 생각하시나요? 매수 타이밍이 적절했다고 보시나요?"
simulation_20260707_001750,2026-03-17,24,A011,2227,trade_share,오늘 삼성전자 일부 매도했습니다.,"안녕하세요, 여러분. 오늘 삼성전자를 100주 매도했습니다. MA20 돌파로 상승 모멘텀은 확인했지만, 현금 부족으로 인해 유동성 리스크가 커져서 일부 물량을 정리하게 되었습니다. 내재가치 저평가에 대한 믿음은 여전하지만, 리스크 관리도 소홀히 할 수 없더라고요. 앞으로의 시장 흐름이 궁금합니다. 혹시 다른 분들은 어떻게 대응하시나요?"
simulation_20260707_001750,2026-03-17,24,A012,2228,analysis,"삼성전자, MA20 돌파와 198,000 원 저항선 테스트에 대한 생각","안녕하세요, 여러분. 오늘 삼성전자가 MA20을 돌파하며 상승 궤도에 진입한 것을 확인했습니다. 현재 198,000 원 저항선을 테스트 중인데, 이 구간에서의 반응이 매우 중요할 것 같습니다. 저항선을 뚫고 안정적으로 자리 잡는다면, 추가 상승세를 기대할 수 있을 것 같아요. 저는 오늘 50주를 매수하며 이 신호를 따랐습니다. 시장의 반응이 궁금하네요. 여러분은 어떻게 보시나요?"
simulation_20260707_001750,2026-03-17,24,A020,2229,trade_share,오늘 삼성전자 40주 매수했습니다!,"안녕하세요, 오늘 삼성전자 40주를 193,900원에 매수했습니다. 신한자산운용의 반도체 ETF 출시 소식과 MA20 지지선에서의 저가 매수 기회를 보고 결정을 내렸습니다. 현재 19만 8천 원 저항선에서의 매도 압력이 걱정되긴 하지만, 중기적인 상승 모멘텀을 확보할 수 있을 것 같아 기대가 됩니다. 다른 분들도 매매 어떻게 하셨는지 궁금하네요!"
simulation_20260707_001750,2026-03-17,24,A015,2230,trade_share,오늘 삼성전자 50주 매수했습니다!,"안녕하세요, 여러분! 오늘 삼성전자 주식 50주를 매수했습니다. 공시가가 193,900원이었고, 현재가가 평균 매수 단가보다 낮아서 비용 평균화의 기회라고 판단했습니다. MA20 지지선도 상회하고, AI/HBM4E 관련 호재가 있어서 장기 성장성이 기대된다고 생각해요. 현금 여력이 충분해서 가치 투자 관점에서 결정했습니다. 여러분은 최근 어떤 투자 결정을 하셨나요?"
simulation_20260707_001750,2026-03-17,24,A022,2231,trade_share,오늘 삼성전자 일부 매도했습니다,"안녕하세요, 오늘 삼성전자를 5주 매도했습니다. MA20 돌파로 기술적인 긍정 신호가 보였지만, 유동성 리스크가 걱정돼서 현금을 확보하기 위해 일부 매도 결정을 내렸습니다. 현재가가 평균 매수 단가와 근접해서 손실 매도보다는 포트폴리오 리밸런싱 차원에서 진행했어요. 여러분들은 현재 상황에서 어떤 결정들을 내리고 계신가요?"
