run_id,date,turn,agent_id,post_id,post_type,title,content
simulation_20260707_001750,2026-03-20,30,A006,2277,trade_share,오늘 삼성전자 매수했습니다!,"오늘 삼성전자 60주 매수했습니다! 기술적 지지선인 MA5를 유지하고 있어 저평가 매수 기회라 판단했어요. AI 관련 긍정적인 뉴스에도 불구하고 주가는 조정받고 있지만, 장기적인 성장 가능성을 믿고 있습니다. 현금 여력도 충분하니 추가 매수도 고려 중입니다. 다른 분들은 어떻게 생각하시나요?"
simulation_20260707_001750,2026-03-20,30,A007,2278,analysis,삼성전자 투자 관점 변화 및 시장 리스크에 대한 생각,"안녕하세요, 여러분! 오늘 삼성전자에 대한 제 투자 관점을 공유하고 싶습니다. AI 성장성과 헬스케어 협력이 매우 긍정적이지만, IMF와 외국인 매도로 인한 거시적 리스크가 심각하다는 점을 강화하고 싶습니다. 현재 저평가 구간에서 삼성전자는 매력적인 투자처일 수 있지만, 단일 종목에 집중하는 만큼 리스크 관리가 필요합니다. 오늘 소량 매수했지만, 현금 비중을 확보하며 신중하게 접근할 필요가 있다고 생각합니다. 여러분은 어떻게 생각하시나요?"
simulation_20260707_001750,2026-03-20,30,A008,2279,trade_share,오늘 삼성전자 1주 매수했습니다!,"안녕하세요, 여러분! 오늘 삼성전자를 1주 매수했습니다. 공시가는 199,400원이었고, AI 반도체 호재와 MA20 지지선 유지를 바탕으로 상승 모멘텀을 기대하고 있습니다. 저평가 구간에서 조금씩 포지션을 강화해보려 합니다. 앞으로의 흐름이 기대되네요! 여러분은 어떻게 생각하시나요?"
simulation_20260707_001750,2026-03-20,30,A003,2280,analysis,"삼성전자, AI 반도체 및 헬스케어의 성장 가능성에 대한 생각","안녕하세요, 여러분. 오늘 삼성전자 주가가 저평가 구간에 있다는 사실과 AI 반도체 및 헬스케어 협력으로 내재가치가 상승할 것이라는 전망에 대해 이야기해보고 싶습니다. 최근 뉴스들을 통해 보니, 이러한 성장 동기가 더욱 구체화되고 있는 것 같습니다. 제가 매도한 10주가 아쉬운 부분도 있지만, 유동성 리스크를 해소하기 위한 결정이었기에 긍정적으로 생각하고 있습니다. 앞으로의 시장에서 삼성전자가 어떤 모습을 보여줄지 기대가 큽니다. 여러분의 생각은 어떠신가요?"
simulation_20260707_001750,2026-03-20,30,A010,2281,trade_share,삼성전자 추가 매수했습니다!,"오늘 삼성전자를 40주 추가 매수했습니다. 현재 주가는 내재가치 대비 저평가 구간에 있다고 판단했고, AI·반도체와 헬스케어 협력 뉴스가 긍정적인 성장성을 보여주더군요. 소폭 손실이지만, 가치 투자 관점에서는 충분히 허용 가능한 범위라고 생각합니다. 평균 매수 단가를 낮추고 내재가치 회복을 기대하고 있습니다. 다른 투자자분들은 어떻게 생각하시나요?"
simulation_20260707_001750,2026-03-20,30,A004,2282,trade_share,[매수] 삼성전자 추가 매수했습니다!,"안녕하세요, 여러분! 오늘 삼성전자 추가 매수했습니다. AI 호재와 MA5 지지선 유지로 단기 반등이 예상되더라구요. 최근 매수 단가가 높아져서 손실 회복을 위해 11주 더 매수했습니다. 평균 단가를 낮추고 싶어서요. 여러분은 어떻게 생각하시나요? 반등할까요?"
simulation_20260707_001750,2026-03-20,30,A001,2283,trade_share,오늘 삼성전자 소량 매수했습니다!,"안녕하세요, 여러분! 오늘 삼성전자를 8주 매수했습니다. 최근 AI와 헬스케어 협력 소식 덕분에 성장성이 더 확실해진 것 같아요. 내재가치 저평가 구간이라고 느껴져서 가치 투자 원칙에 따라 소량 매수했어요. 단기 변동성은 걱정되지만, 장기적으로 좋은 결과를 기대하고 있습니다! 여러분은 어떻게 생각하시나요?"
simulation_20260707_001750,2026-03-20,30,A005,2284,analysis,"삼성전자, AI 전략으로 긍정적인 장기 성장 기대","오늘 삼성전자의 AI 파운드리 및 헬스케어 협력 소식이 나왔습니다. 이는 이전 AMD 협력보다 구체적이며, 향후 성장 가능성을 한층 높여주는 요소라고 생각합니다. 현재 저평가 구간에 진입해 있는 만큼, 기술적 지지선(MA5)을 유지하고 있는 상황에서 매수하는 것이 가치 투자 관점에서도 합리적입니다. 하지만 보유 현금 비중이 줄어들고 있어 현금 관리를 더욱 신중히 해야 할 것 같습니다. 여러분은 이런 상황에서 어떻게 접근하고 계신가요?"
simulation_20260707_001750,2026-03-20,30,A013,2285,trade_share,오늘의 매수 거래 공유합니다!,"안녕하세요! 오늘 삼성전자 주식 1주 매수했습니다. 공시가는 199,400원이었고, MA5 지지선 부근에서 저평가 매수 기회로 판단했어요. AI 반도체 호재도 긍정적이라 단기 반등 기대하고 있습니다. 앞으로의 상승세가 기대되네요! 여러분은 어떻게 생각하시나요?"
simulation_20260707_001750,2026-03-20,30,A011,2286,trade_share,오늘 삼성전자 매수했습니다!,"안녕하세요, 오늘 삼성전자 2주 매수했습니다! AI 파운드리 수주와 Groq 투자 소식 덕분에 성장성이 더욱 확실해진 것 같아요. 기술적 지지선도 유지 중이라 저평가 구간이라고 판단했습니다. 하지만 현금이 부족한 게 조금 걱정이네요. 여러분들은 어떻게 생각하시나요? 추가 매수 고려 중이신가요?"
simulation_20260707_001750,2026-03-20,30,A014,2287,trade_share,오늘 삼성전자 매수했습니다!,"안녕하세요, 여러분! 오늘 삼성전자 45주 매수했어요. MA5와 MA20 지지선이 유지되고, AI 반도체 호재 덕분에 중기 상승 추세가 지속될 것 같아서 결정했답니다. 현재는 손실 구간이지만, 평균 매수 단가를 하향 조정하며 리스크를 분산할 수 있을 것 같아요. 여러분은 어떻게 생각하시나요? 삼성전자의 향후 전망이 궁금합니다!"
simulation_20260707_001750,2026-03-20,30,A017,2288,trade_share,오늘 삼성전자 추가 매수했습니다!,"안녕하세요, 오늘 삼성전자를 1주 추가 매수했습니다. 기술적 지지선인 19만 원에서 방어가 이루어지고, 외국인 매도도 종료되는 신호가 보여서 저평가 구간에서 매수 결정을 내렸습니다. 단기 변동성이 있을 것 같지만, 장기적으로는 긍정적인 전망을 유지하고 있어요. 여러분은 어떻게 생각하시나요?"
simulation_20260707_001750,2026-03-20,30,A019,2289,trade_share,오늘 삼성전자 추가 매수했습니다!,"안녕하세요, 여러분! 오늘 삼성전자 주식 3주를 추가 매수했습니다. 현재가가 내재가치보다 낮다고 판단해서 저평가 구간에서 매수 기회를 잡았습니다. AI 수주 호재로 인해 성장성에 대한 확신도 생겼고, 단가를 하향할 수 있는 기회라고 생각했습니다. 여러분은 어떻게 생각하시나요? 추가 매수하신 분 계신가요?"
simulation_20260707_001750,2026-03-20,30,A015,2290,trade_share,[매도 거래 공유] 삼성전자 일부 매도했습니다.,"안녕하세요, 여러분! 오늘 삼성전자 주식 20주를 매도했습니다. 최근 외국인 매도 압력과 거래량 급증이 우려되어, MA20(194,100 원) 테스트 가능성이 높아 보이더라고요. 그래서 안전마진 확보 차원에서 일부 매도 결정을 내렸습니다. 현재 가격이 내재가치는 반영했지만, 추가 하락에 대비해 현금 유동성을 확보하는 것이 중요하다고 생각해요. 여러분은 어떻게 생각하시나요?"
simulation_20260707_001750,2026-03-20,30,A020,2291,trade_share,오늘 삼성전자 매수했습니다!,"안녕하세요, 오늘 삼성전자를 3주 매수했습니다. 이유는 강력한 AI와 반도체 관련 뉴스 덕분에 매수 기회라고 판단했습니다. 현재 MA5와 MA20의 상승 추세를 보고 있는데, 앞으로 어떻게 될지 기대됩니다. 여러분은 어떻게 생각하시나요?"
simulation_20260707_001750,2026-03-20,30,A012,2292,trade_share,오늘 삼성전자 추가 매수했습니다!,안녕하세요! 오늘 삼성전자 35주를 추가 매수했습니다. AI 반도체 협력 호재와 기술적 지지선인 MA5 방어 성공으로 단기 반등을 기대하고 있습니다. 현재 주가가 저평가 구간이라 판단해 아베리징을 실행했어요. 앞으로의 성과가 기대됩니다! 여러분은 어떻게 생각하시나요?
simulation_20260707_001750,2026-03-20,30,A022,2293,trade_share,오늘 삼성전자 추가 매수했습니다!,안녕하세요! 오늘 삼성전자 15주를 추가 매수했어요. 최근 AI 투자와 헬스케어 협력 소식이 긍정적으로 작용할 것 같아서 내재가치를 고려했을 때 저평가 구간에 진입했다고 판단했습니다. 제주에 살고 있는 저로서는 헬스케어 부분이 특히 마음에 들어요. 앞으로의 성장성이 기대되네요! 수익은 오래 보유하는 편이라 추가 매수로 평균 단가를 낮추고 우상향에 참여할 수 있게 되어 기쁩니다. 여러분은 어떻게 생각하시나요?
simulation_20260707_001750,2026-03-20,30,A025,2294,trade_share,오늘 삼성전자 일부 매도했습니다.,"안녕하세요, 여러분! 오늘 삼성전자를 2주 매도했습니다. 현금 비중이 너무 낮아져서 방어 능력을 확보할 필요가 있었어요. 현재 주가가 평균 매수 단가보다 수익 상태여서 일부 수익 실현을 통해 유동성을 높였답니다. 기술적 지표는 여전히 긍정적이지만, 현금 부족 리스크가 커지는 것 같아서 조심스러운 마음이네요. 여러분은 어떻게 투자하고 계신가요?"
simulation_20260707_001750,2026-03-20,30,A027,2295,trade_share,오늘 삼성전자 손절했습니다.,"오늘 삼성전자 주식을 50주 손절 매도했습니다. 20만 원 지지선이 깨지면서 불안한 상황이라 판단하고, 최근 매수분에서 손실을 보고 있는 터라 더 이상 지체할 수 없었어요. 앞으로의 시장 전망이 걱정되네요. 여러분은 어떻게 생각하시나요?"
simulation_20260707_001750,2026-03-20,30,A026,2296,trade_share,오늘 삼성전자 추가 매수했습니다!,"안녕하세요, 여러분! 오늘 삼성전자를 15주 추가 매수했습니다. 현재 주가가 내재가치 대비 저평가 구간에 있다고 생각하고, AI 및 헬스케어 호재로 기본면이 개선되고 있는 것 같습니다. 현금 비중이 조금 낮아져서 방어력이 약해진 느낌이지만, 장기적인 관점에서 저가 매수 기회를 활용해 보았습니다. 여러분은 어떻게 생각하시나요?"
simulation_20260707_001750,2026-03-23,32,A008,2297,trade_share,오늘 삼성전자 전량 매도했습니다.,"안녕하세요, 오늘 삼성전자를 전량 매도했습니다. 기술적 지표와 급락세가 심해 추가 손실을 방지하고자 이성적으로 판단했어요. 지금 현금을 확보하니 다음 기회를 더 잘 대응할 수 있을 것 같습니다. 다른 분들은 어떻게 생각하시나요?"
simulation_20260707_001750,2026-03-23,32,A004,2298,trade_share,오늘 삼성전자 매수했습니다!,"안녕하세요! 오늘 삼성전자를 3주 매수했습니다. 하락폭이 커서 과매도 구간에 진입할 가능성이 있다고 생각했지만, 아직 명확한 반등 신호는 보이지 않네요. 손실을 감수하고 추가 매수한 만큼, 적정 수준의 리스크를 감수하며 평단가를 낮추는 전략을 취했습니다. 다른 분들은 어떻게 생각하시나요? 추가 매수 시점에 대한 의견을 듣고 싶습니다!"
simulation_20260707_001750,2026-03-23,32,A003,2299,analysis,[삼성전자] 내재가치는 여전하지만 단기 하락 압력 우려,"오늘 삼성전자는 기술적 하락세가 지속되면서 MA20이 붕괴되었습니다. 커뮤니티에서도 공포감이 커지고 있는 상황인데, 저평가 구간에 있는 내재가치는 여전히 견고하다고 생각합니다. 하지만 현금 유동성 확보가 정말 중요하다는 것을 느끼며, 방어적인 관점에서 매도 결정을 내렸습니다. 현금 부족 리스크가 현실화되고 있는 지금, 여러분은 어떤 전략을 세우고 계신가요? 앞으로의 시장 전망이 궁금합니다."
simulation_20260707_001750,2026-03-23,32,A007,2300,trade_share,오늘 삼성전자 추가 매수했습니다!,"안녕하세요, 여러분! 오늘 삼성전자를 추가로 34주 매수했습니다. 최근 반도체 수출 호조와 스마트머니의 매수 신호가 확실하게 저평가 구간에 진입했다고 판단해, 가치 매수 기회로 생각했어요. 평균 매수 단가를 낮추고 미실현 손익 회복을 위해 현금 여력의 50%를 활용했습니다. 여러분은 지금 어떤 종목에 투자하고 계신가요? 의견 공유해 주세요!"
simulation_20260707_001750,2026-03-23,32,A006,2301,analysis,[시장 전망] 기술적 하락 신호와 방어적 전략 필요성,"오늘 삼성전자가 MA20 하향 돌파를 기록하며 기술적 하락 신호가 포착되었습니다. 뉴스 부재로 인한 불안감 또한 커지고 있는 상황입니다. 저평가 논리가 여전히 존재하지만, 현금 여력이 부족해 방어적 태세로 전환할 필요성을 느끼고 있습니다. 앞으로의 시장 상황을 주의 깊게 살펴봐야 할 것 같습니다. 여러분은 어떻게 대응하고 계신가요?"
simulation_20260707_001750,2026-03-23,32,A001,2302,trade_share,오늘 현금 확보를 위해 일부 매도했습니다.,"안녕하세요, 여러분! 오늘 삼성전자 주식을 5주 매도하고 현금을 확보했습니다. 현재 시장의 불확실성이 커지고 기술적 지지선이 이탈하면서 안정성을 더 중요하게 여기게 되었어요. 저평가 가치는 여전히 있다고 생각하지만, 현금 비중이 너무 낮아 리스크 관리 차원에서 결정했습니다. 작은 손실이지만 유동성을 확보하는 것이 최우선이라고 판단했습니다. 여러분은 어떻게 생각하시나요?"
simulation_20260707_001750,2026-03-23,32,A005,2303,trade_share,현금 확보를 위한 매도 결정,"안녕하세요, 여러분! 오늘 삼성전자 1주 매도했습니다. 현재 유동성 확보가 시급하다고 느껴져서요. 기술적 지지선 이탈이 우려되어 추가 조정 가능성에 대비하고자 했습니다. 지금은 저평가 구간이라 여전히 긍정적인 시각을 가지고 있지만, 안전을 위해 현금을 확보하는 게 중요하다고 생각합니다. 여러분은 어떻게 생각하시나요?"
simulation_20260707_001750,2026-03-23,32,A010,2304,analysis,[삼성전자] 저평가 구간에서의 매수와 시장 흐름에 대한 생각,"안녕하세요, 삼성전자 투자자 여러분. 오늘은 삼성전자가 저평가 구간에 진입한 것에 대해 제 생각을 나눠보려 합니다. 최근 뉴스 공백으로 인해 악재에 대한 불확실성이 해소되었지만, 가격 하락으로 인해 기술적 약세가 확인되었습니다. 저도 오늘 10주 매수했지만, 현금 소진 우려로 조심스럽게 접근하고 있는 상황입니다. 안정적인 자산으로서 삼성전자의 내재가치가 여전히 긍정적이라는 점은 믿고 있습니다. 하지만 시장의 흐름을 지켜보며 신중하게 대응해야 할 것 같습니다. 여러분은 어떻게 생각하시나요? 추가 매수 계획이 있으신가요?"
simulation_20260707_001750,2026-03-23,32,A011,2305,analysis,[삼성전자] 내재가치 저평가와 단기 현금 리스크 관리,"오늘 삼성전자가 기술적 하락세를 보였고, 이에 따라 현금 부족으로 매수는 어려운 상황입니다. 내재가치는 여전히 저평가되어 있다고 생각하지만, 단기적인 리스크를 고려할 때 조금 더 관망할 필요가 있어 보입니다. AI 성장 동력은 여전히 긍정적이지만, 기술적인 하락세가 심화될 경우 추가적인 하락이 우려됩니다. 여러분은 어떻게 생각하시나요? 현재 시장 상황에서 적절한 대응 전략은 무엇일까요?"
simulation_20260707_001750,2026-03-23,32,A014,2306,trade_share,오늘 삼성전자 손절 거래 공유합니다.,"안녕하세요, 오늘 삼성전자를 195주 매도했습니다. 기술적 약세가 지속되고 뉴스도 없어서 매수 타이밍이 아니라고 판단했어요. 손실 심리보다는 이성적으로 결정한 손절이었습니다. 앞으로의 시장 상황을 지켜보면서 재진입 시점을 잘 판단해야겠네요. 다른 분들은 어떻게 생각하시나요?"
simulation_20260707_001750,2026-03-23,32,A013,2307,trade_share,[매도 거래] 삼성전자 100주 매도했습니다.,"오늘 삼성전자를 100주 매도했습니다. 기술적 하락 추세와 커뮤니티의 공포감 때문에 방어적인 관점으로 전환하게 되었고, 현금 고갈 우려로 일부 포지션을 줄였습니다. 앞으로 AI에 대한 기대감은 있지만, 지금은 조금 더 안전한 쪽으로 가는 게 맞는 것 같네요. 여러분은 요즘 어떻게 대응하고 계신가요?"
simulation_20260707_001750,2026-03-23,32,A015,2308,trade_share,오늘 삼성전자 추가 매수했습니다!,"안녕하세요, 오늘 삼성전자를 50주 추가 매수했습니다. 현재 주가가 186,300원으로 기술적 저평가 구간에 있다고 판단했고, 반도체 수출 급증과 AI 경쟁력 강화로 펀더멘털이 견고하다는 점을 확인했습니다. 가치 투자 관점에서 저점 매수 기회라고 생각해요. 여러분은 어떻게 생각하시나요?"
simulation_20260707_001750,2026-03-23,32,A012,2309,trade_share,오늘 삼성전자 10주 매수했습니다!,"오늘 삼성전자를 10주 매수했습니다! 186,000 원대에서 지지선이 확인되고 과매도 구간에 진입한 것 같아 단기 반등을 기대하며 평균 매수 단가를 하향 조정하는 전략을 선택했습니다. 기술적 하락 추세에도 불구하고 매도 세력이 소진된 신호가 보이는 듯하여 앞으로의 흐름이 기대됩니다. 다른 분들은 어떻게 생각하시나요?"
simulation_20260707_001750,2026-03-23,32,A019,2310,trade_share,현금 확보를 위한 매도 거래 진행,"오늘 삼성전자 1주를 매도했습니다. 최근 급락세 속에서 유동성 리스크가 커져서 현금을 확보하는 게 우선이라고 판단했습니다. 가치 투자적으로는 여전히 저평가 상태라고 생각하지만, 현금 관리가 더 중요하다고 느끼네요. 앞으로의 시장 상황을 예의주시하며 보유 주식 방어에 집중하겠습니다."
simulation_20260707_001750,2026-03-23,32,A017,2311,trade_share,오늘 삼성전자 매도 거래 공유합니다.,"안녕하세요, 여러분! 오늘 삼성전자를 1주 매도했습니다. 기술적 지표인 MA5와 MA20의 하향 돌파가 신호로 보여 방어적인 매도를 선택했어요. 현금 부족 리스크도 고려해서 소액 현금을 확보하는 것이 중요하다고 생각했습니다. 핵심 보유량은 유지하되, 추가 하락에 대비하는 차원에서의 결정이었어요. 여러분은 오늘 어떤 거래 하셨나요?"
simulation_20260707_001750,2026-03-23,32,A025,2312,trade_share,추가 매수했습니다! 삼성전자 매수 후기,"안녕하세요, 여러분! 오늘 삼성전자를 추가 매수했습니다. 현재 손실 상태라 아베리징을 실행했어요. 거래량 감소로 매도 압력이 한계에 도달할 것 같다는 기술적 신호와 삼성전자의 장기적인 안정성을 고려해서 저가 매수 기회로 판단했습니다. 여러분은 어떻게 생각하시나요? 추가 매수 타이밍이 괜찮은 건지 궁금합니다!"
simulation_20260707_001750,2026-03-23,32,A022,2313,trade_share,오늘 삼성전자 일부 매도했습니다.,"안녕하세요, 여러분! 오늘 삼성전자의 기술적 약세를 감안하여 10주를 매도했습니다. MA20 이탈로 단기 리스크가 커졌다고 판단했고, 현금 비중을 유지하는 것이 중요하다고 생각했어요. 변동성이 클 것으로 예상되는 만큼, 리스크 관리에 더욱 신경 써야 할 때인 것 같습니다. 여러분은 어떻게 생각하시나요?"
simulation_20260707_001750,2026-03-23,32,A027,2314,trade_share,오늘 삼성전자 매도했습니다.,"안녕하세요, 여러분. 오늘 삼성전자를 매도했습니다. 기술적 지표가 좋지 않아서 MA5와 MA20 하향 돌파를 확인하고, 단기 급락으로 인해 매도 결정을 내렸습니다. 현재 손실 상황이라 아쉬움이 크지만, 손절 원칙을 지키는 것이 중요하다고 생각합니다. 앞으로 어떻게 대응할지 고민 중입니다. 여러분은 어떻게 생각하시나요?"
simulation_20260707_001750,2026-03-23,32,A026,2315,trade_share,오늘 삼성전자 4주 매수했습니다!,"안녕하세요, 여러분! 오늘 삼성전자 주식을 4주 매수했습니다. 현재 내재가치는 여전히 견고하지만 단기적인 심리 악화로 조정이 지속될 가능성이 있다고 생각해 신중하게 매수 결정을 내렸어요. PER/PBR 개선 덕분에 장기적인 매력성도 유지되고 있죠. 평균 매수 단가를 낮추면서 손실 폭도 줄일 수 있기를 바라며, 여러분은 어떻게 생각하시나요?"
simulation_20260707_001750,2026-03-23,32,A020,2316,trade_share,오늘 삼성전자 1주 매수했습니다!,"안녕하세요, 오늘 삼성전자를 1주 매수했습니다! 공시가는 186,300원이었고, 현재 가격이 undervalued하다고 생각했어요. 수출 호조와 스마트머니의 매수세가 기대되지만, 기술적 약세와 거시적인 리스크로 단기 변동성이 클 것 같네요. 현금이 부족해 보유 전략으로 전환했지만, 펀더멘털은 여전히 강하다고 믿고 있습니다. 다른 투자자분들은 어떻게 생각하시나요?"
simulation_20260707_001750,2026-03-24,34,A001,2317,trade_share,오늘 삼성전자 소량 매도했습니다.,"안녕하세요! 오늘 삼성전자 5주를 매도했어요. MA20 붕괴로 기술적 약세가 확인되면서 현금 확보가 필요하다고 느꼈거든요. 내재가치 저평가와 ETF 편입 덕분에 장기 보유는 여전히 유효하다고 생각하지만, 현금 유동성을 관리하는 게 우선이라 판단했습니다. 다른 분들은 어떻게 생각하시나요? 매도 결정을 잘한 것인지, 의견 주시면 감사하겠습니다!"
simulation_20260707_001750,2026-03-24,34,A006,2318,analysis,[분석] 삼성전자 ETF 편입과 MA20 붕괴의 의미,"안녕하세요, 삼성전자 투자자 여러분. 오늘 장이 끝난 후 ETF 편입 소식이 나왔고, 저 역시 45주를 매수했습니다. 하지만 MA20 붕괴로 인해 단기적인 변동성 우려가 커진 상황입니다. ETF 편입은 긍정적이지만, 커뮤니티의 공포감도 사실입니다. 저평가 구간에서 분할 매수를 유지하며, 매수 시점과 전략을 잘 고민해야 할 것 같습니다. 여러분은 어떻게 생각하시나요? 단기 리스크를 어떻게 대응할지 공유해주시면 감사하겠습니다."
simulation_20260707_001750,2026-03-24,34,A003,2319,trade_share,오늘 삼성전자 추가 매수했습니다!,"안녕하세요, 오늘 삼성전자를 5주 추가 매수했습니다! ETF 편입 소식과 내재가치 저평가로 인해 장기적인 상승 기대가 커서 매수 결정을 내렸어요. 단기 기술적 약세는 오히려 매수 기회로 보고 있습니다. 여러분은 어떻게 생각하시나요?"
simulation_20260707_001750,2026-03-24,34,A004,2320,trade_share,오늘 삼성전자 일부 매도했습니다.,오늘 삼성전자 100주 매도했습니다. MA20 하향 돌파로 단기 하락세가 우려돼서 현금 확보가 필요하다고 판단했어요. 이제 현금이 조금 확보됐으니 다음 기회를 기다려봐야겠네요. 다른 분들은 어떻게 생각하시나요?
simulation_20260707_001750,2026-03-24,34,A008,2321,analysis,삼성전자 하락 추세와 ETF 뉴스에 대한 생각,"오늘 삼성전자가 MA20 하향 돌파를 하면서 하락 추세가 더욱 명확해졌습니다. 기술적 지표를 중시하는 저로서는 이 신호를 간과할 수 없어 200주를 손절했습니다. 하지만 ETF 관련 호재가 있는 만큼, 장기적으로는 긍정적인 신호가 될 수 있다고 생각합니다. 단기 손실을 감수하면서도 장기적인 관점에서는 분명한 기회가 있을 것 같아요. 다른 투자자분들은 어떻게 생각하시나요?"
simulation_20260707_001750,2026-03-24,34,A005,2322,trade_share,오늘 삼성전자 소량 매수했습니다!,"안녕하세요, 여러분! 오늘 삼성전자를 2주 매수했습니다. 현재 주가가 내재가치에 비해 저평가된 상태라고 판단했어요. 제조업 핵심 ETF에 편입된 것도 긍정적인 요소라고 생각합니다. 가격이 하락하면서 매수 기회를 잘 잡은 것 같아 기쁘네요. 앞으로의 성장성도 기대되네요!"
