run_id,date,turn,agent_id,decision_date,market_features_date,news_start_date,news_start_time,news_max_date,news_end_time,execution_date,information_mode,news_depth,selected_news_count,read_news_count,search_read_count,depth2_search_keywords,depth2_search_result_count,depth2_view_change,news_sentiment,action,quantity,order_type,price,submitted_order,belief_summary,view_change,decision_reason,risk_control,order_corrections
simulation_20260701_174513,2026-02-27,1,A008,2026-02-27,2026-02-26,2026-02-26,15:30,2026-02-27,15:30,2026-02-27,pre_close_cutoff,1,3,9,0,,,,positive,buy,227,limit,220000.0,True,"HBM 수주와 기관 매수세, 기술적 돌파가 맞아떨어져 상승 추세가 강력합니다. 고위험 성향에 맞춰 모멘텀을 따라가되, 실물 경제 괴리 리스크는 모니터링하겠습니다.",중립적 관점에서 강세 관점으로 전환되었습니다. 국민연금 뉴스와 기술적 돌파 신호가 기존 '기다림' 전략을 '진입 고려'로 바꾸었습니다.,"뉴스 (HBM4E 수주 확정, 기관 매수세 유입) 와 기술적 지표 (MA5/MA20 정배열, 거래량 증가 11.5%) 가 상승 모멘텀을 강력히 지지합니다. 시장 심리 (코스피 6000 돌파, 국민연금 매도 중단) 또한 호재로 작용하여, 고위험 고수익 성향에 맞춰 모멘텀 추종 전략을 실행합니다. 현재 포트폴리오는 100% 현금 상태이므로, 상승 추세 초기 진입 기회를 활용합니다.","손절 라인 설정 (MA5 하회 시 또는 진입가 대비 -5% 손실 시 이성적 매도), 현금 비중 관리 (최대 50% 한도 준수), FOMO 에 휩쓸리지 않고 기술적 지지선 확인 습관 유지. 실물 경제 괴리 리스크 모니터링.",
simulation_20260701_174513,2026-02-27,1,A012,2026-02-27,2026-02-26,2026-02-26,15:30,2026-02-27,15:30,2026-02-27,pre_close_cutoff,0,4,0,0,,,,mixed,buy,200,limit,216000.0,True,"기술적 돌파와 기관 매수세로 상승 모멘텀이 강하나, 밸류에이션 괴리 우려로 진입 시 타이밍을 신중히 잡아야 한다.",초기 중립 관점에서 기술적 지표 (MA 돌파) 와 기관 매수 뉴스에 힘입어 매수 관점으로 전환했다.,"기술적 지표 (MA5/MA20 상향 정렬, 거래량 증가) 와 기관 매수세 유입으로 상승 모멘텀이 강하다고 판단. 거시 환경 (반도체 업황 회복, 금리 안정) 도 호재이나, 밸류에이션 괴리 우려가 있어 추격 매수보다는 조정 시 진입을 노림.",총 자산의 50% 이내 (약 43%) 로 진입하여 현금 잔여액 확보. 손실 발생 시 추가 매수 (아베리징) 를 위한 유동성 보유. 괴리 뉴스 확인 시 수익 실현 타이밍 신중히 검토.,
simulation_20260701_174513,2026-02-27,1,A022,2026-02-27,2026-02-26,2026-02-26,15:30,2026-02-27,15:30,2026-02-27,pre_close_cutoff,1,3,9,0,,,,mixed,buy,1,limit,218000.0,True,"HBM4E 기술력과 기관 매수세로 상승 흐름은 유효하나, 실물 경제와의 괴리 우려로 가치 평가에 기반한 신중한 접근이 필요함.","중립적 관점에서 기술 호재와 기관 매수세 확인으로 상승 가능성 높게 평가하나, 밸류에이션 리스크를 추가 고려함.",,,"hold->buy, price<=0->current_price"
simulation_20260701_174513,2026-02-27,1,A011,2026-02-27,2026-02-26,2026-02-26,15:30,2026-02-27,15:30,2026-02-27,pre_close_cutoff,1,3,9,0,,,,positive,buy,229,limit,218000.0,True,HBM4E 수주와 국민연금 매도 중단 신호로 삼성전자에 대한 투자 확신이 극대화되었다. 저평가 구간에서의 집중 매수가 적절하다고 판단한다.,중립적 관점에서 명확한 매수 관점으로 전환. HBM4E 기술 호재와 기관 매수세 유입으로 가치 평가와 성장성 모두 확인됨.,"Belief 에 명시된 HBM4E 수주 확정 및 기관 매수세 유입으로 인한 명확한 매수 신호를 근거로 매수 결정을 내렸습니다. 현재 주가 21 만 8 천 원은 내재가치 대비 저평가 구간으로 판단되며, 상승 추세 (MA5/20 상회) 와 거래량 증가 (11.5%) 가 모멘텀을 뒷받침합니다. 포트폴리오가 100% 현금 상태이므로, 고위험 고수익 성향과 집중 투자 전략에 따라 최대 허용 금액 (50%) 을 활용하여 진입합니다.","단일 종목 집중 투자로 인한 변동성 리스크를 관리하기 위해 거래 제약상 최대 50% (5,000 만 원) 이내로 주문 수량을 제한했습니다. 전일 7% 급등에 따른 단기 조정 (Pullback) 가능성과 거시경제 지표와의 괴리 리스크를 모니터링하며, 추후 손절 기준 설정 시에는 내재가치 하락 시점과 기술적 지지선 이탈을 기준으로 판단할 예정입니다.",
simulation_20260701_174513,2026-02-27,1,A033,2026-02-27,2026-02-26,2026-02-26,15:30,2026-02-27,15:30,2026-02-27,pre_close_cutoff,1,3,9,0,,,,mixed,buy,200,limit,220000.0,True,"반도체 기술 우위와 기관 지지는 확실하나, 실물경제 괴리 리스크를 고려하여 가치 투자 관점에서 접근을 검토한다.","중립적 관점에서 '신중한 낙관'으로 전환. 국민연금 매도 중단과 HBM 기술 경쟁력 확인으로 매수 의지 강화, 실물경제 괴리 뉴스는 리스크 관리 필요성 추가.","HBM4E 기술 경쟁력과 국민연금 매도 중단 등 기관 매수 지속으로 장기 성장성 확보. 내재가치 측면에서 매력적이나 단기 7% 급등으로 과열 우려가 있어 220,000 원 지정가 설정. 현금 100% 상태이므로 진입 필요.","최대 50% 한도 (5,000 만 원) 내 4,400 만 원 투자로 현금 잔여 확보. 단기 조정 시 추가 매수 여력 보유. 손절 원칙에 따라 내재가치 이탈 시 매도 검토.",
simulation_20260701_174513,2026-02-27,1,A047,2026-02-27,2026-02-26,2026-02-26,15:30,2026-02-27,15:30,2026-02-27,pre_close_cutoff,1,3,9,0,,,,positive,buy,227,limit,220000.0,True,엔비디아 HBM 공급처로서의 기술 경쟁력 확보와 국민연금의 수급 안정화로 내재가치 상승이 확인되었습니다. 현재 주가는 매력적인 진입 구간으로 판단하여 매수 관점을 유지합니다.,기존 중립 관점에서 긍정적 관점으로 전환했습니다. HBM 기술 입증과 기관 수급 안정화가 가치 투자 기준을 충족시켜 진입 타이밍으로 판단됩니다.,"엔비디아 HBM 공급처로서의 기술 입증과 국민연금 수급 안정화 (Belief Dim 1, 4) 로 내재가치 상승이 확인됨. 현재 주가는 내재가치 대비 저평가 구간 (Belief Dim 2) 이며, 5 일/20 일 이동평균선 상회 등 강세 구조 (Market View) 로 판단. 현금 100% 보유 상태이므로 가치 투자 관점에서 매수 진입.",단일 종목 집중 투자이므로 진입 후 MA20 하단 또는 -5% 손실 시 이성적 손절 원칙 적용. 최대 50% 현금 비중 유지하여 추가 변동성 대비. 단기 과열 가능성 (7% 급등) 고려하여 지정가 주문으로 진입 가격 통제.,
simulation_20260701_174513,2026-02-27,1,A040,2026-02-27,2026-02-26,2026-02-26,15:30,2026-02-27,15:30,2026-02-27,pre_close_cutoff,1,3,9,0,,,,positive,buy,227,limit,220000.0,True,,,"기술적 지표 (MA5>MA20 골든크로스, 거래량 급증) 와 뉴스 호재 (HBM 경쟁력, 국민연금 매수 유예) 가 일치하여 강세장 진입 신호로 판단. 고위험 고수익 성향에 따라 상승 모멘텀을 포착하기 위한 추격 매수.",거래 제약 (최대 5000 만 원) 을 준수하여 총 자산의 50% 만 투입하고 현금 50% 를 유보. 지정가 주문으로 진입 가격 통제 및 단기 조정 시 추가 대응 여력 확보.,
simulation_20260701_174513,2026-02-27,1,A086,2026-02-27,2026-02-26,2026-02-26,15:30,2026-02-27,15:30,2026-02-27,pre_close_cutoff,1,3,9,0,,,,positive,buy,229,limit,218000.0,True,"HBM4E 기술 우위와 기관 매수세 유입으로 상승 모멘텀이 확인되었으나, 실물 경제와의 괴리 리스크를 고려하여 신중하게 접근한다.",중립적 관점에서 '신중한 매수' 관점으로 전환. 국민연금의 매도 중단과 HBM4E 기술 경쟁력 확인이 신뢰도 상승을 확인함.,"HBM4E 기술 우위와 국민연금 등 기관 매수세 유입으로 상승 모멘텀이 확인되었으나, 밸류에이션이 적정선 상단에 위치해 있어 지정가 주문으로 진입 가격을 통제한다. 실물 경제 괴리 리스크를 고려하되, 검증된 자산에 대한 신념으로 단일 종목 집중 전략을 적용한다.",단일 종목 집중 리스크를 관리하기 위해 최대 매수 가능 금액 (5000 만 원) 의 99% 수준으로 진입하여 현금 잔여분을 확보한다. 실물 경제 둔화 및 단기 과매수 리스크 발생 시 추가 매수 또는 손절 기준을 유연하게 조정할 계획이다.,
simulation_20260701_174513,2026-02-27,1,A095,2026-02-27,2026-02-26,2026-02-26,15:30,2026-02-27,15:30,2026-02-27,pre_close_cutoff,1,3,9,0,,,,mixed,buy,100,limit,216000.0,True,"AI 호재와 기관 매수로 상승 추세는 확실하나, 단기 과열 우려로 신중한 접근이 필요함.","중립적 관점에서 상승 추세를 확인했으나, 고가 진입에 대한 우려로 신중한 매수 관점으로 수정.","기술적 지표상 MA5, MA20 위에 위치하며 상승 추세 확인 (시장 데이터). 그러나 당일 7% 급등으로 밸류에이션 부담 및 단기 조정 가능성 존재 (뉴스/시장 데이터). 노후 자금 특성상 고가 진입 리스크를 줄이기 위해 현재가보다 약간 낮은 가격에 호가 설정.","총 자산의 25% 이내 (약 2,160 만 원) 로 제한적 진입하여 현금 유동성 확보. 향후 조정 시 추가 매수 (손실 시 추가 매수 경향) 를 위한 여유 자금 보유. 과거 수익률 부진으로 인한 손실 공포 관리.",
simulation_20260701_174513,2026-02-27,1,A078,2026-02-27,2026-02-26,2026-02-26,15:30,2026-02-27,15:30,2026-02-27,pre_close_cutoff,2,4,9,10,"삼성전자 PER, 삼성전자 PB, 삼성전자 분기 실적, HBM4E 수주 현황, 원/달러 환율, 미국 금리 전망, 국내 소비 지출, 반도체 재고 사이클",10,수정,mixed,buy,200,limit,208000.0,True,"HBM4E 기술력은 확실하나, 급등한 주가와 실물경제 괴리, 관세 리스크를 고려해 가치 평가 후 진입을 신중히 결정함.",초기 중립에서 '기술력은 긍정적이나 가치 평가와 거시 리스크 확인 필요'로 수정. 급등세에 대한 과열 우려 추가.,"현재 보유 주식 0 주이므로 매수 필수. 가치 투자자로서 급등세 추격 매수 지양, 전일 종가 (218,000 원) 대비 약 4.6% 할인된 지정가 매수 주문으로 내재가치 확인. 61 세 투자자 특성상 안정성 우선, 최대 거래 금액 (5,000 만 원) 의 50% 이내 (약 4,160 만 원) 로 진입하여 현금 잔여액 확보. 관세 및 밸류에이션 리스크 (Belief dim_2, dim_3) 를 고려한 신중한 진입.","지정가 주문으로 과열 구간 진입 방지 및 매수 단가 보호. 현금 5,840 만 원 확보하여 추가 매수 기회 대비 및 유동성 유지. 내재가치와 주가 괴리 확대 시 손절 원칙 적용. 단기 변동성 확대 (Belief dim_1) 시 현금 비중 관리 원칙 준수.",
