run_id,date,turn,agent_id,decision_date,market_features_date,news_start_date,news_start_time,news_max_date,news_end_time,execution_date,information_mode,stock_code,direction,quantity,price,order_type,reason
simulation_20260701_174513,2026-02-27,1,A008,2026-02-27,2026-02-26,2026-02-26,15:30,2026-02-27,15:30,2026-02-27,pre_close_cutoff,005930,buy,227,220000.0,limit,"뉴스 (HBM4E 수주 확정, 기관 매수세 유입) 와 기술적 지표 (MA5/MA20 정배열, 거래량 증가 11.5%) 가 상승 모멘텀을 강력히 지지합니다. 시장 심리 (코스피 6000 돌파, 국민연금 매도 중단) 또한 호재로 작용하여, 고위험 고수익 성향에 맞춰 모멘텀 추종 전략을 실행합니다. 현재 포트폴리오는 100% 현금 상태이므로, 상승 추세 초기 진입 기회를 활용합니다."
simulation_20260701_174513,2026-02-27,1,A012,2026-02-27,2026-02-26,2026-02-26,15:30,2026-02-27,15:30,2026-02-27,pre_close_cutoff,005930,buy,200,216000.0,limit,"기술적 지표 (MA5/MA20 상향 정렬, 거래량 증가) 와 기관 매수세 유입으로 상승 모멘텀이 강하다고 판단. 거시 환경 (반도체 업황 회복, 금리 안정) 도 호재이나, 밸류에이션 괴리 우려가 있어 추격 매수보다는 조정 시 진입을 노림."
simulation_20260701_174513,2026-02-27,1,A022,2026-02-27,2026-02-26,2026-02-26,15:30,2026-02-27,15:30,2026-02-27,pre_close_cutoff,005930,buy,1,218000.0,limit,
simulation_20260701_174513,2026-02-27,1,A011,2026-02-27,2026-02-26,2026-02-26,15:30,2026-02-27,15:30,2026-02-27,pre_close_cutoff,005930,buy,229,218000.0,limit,"Belief 에 명시된 HBM4E 수주 확정 및 기관 매수세 유입으로 인한 명확한 매수 신호를 근거로 매수 결정을 내렸습니다. 현재 주가 21 만 8 천 원은 내재가치 대비 저평가 구간으로 판단되며, 상승 추세 (MA5/20 상회) 와 거래량 증가 (11.5%) 가 모멘텀을 뒷받침합니다. 포트폴리오가 100% 현금 상태이므로, 고위험 고수익 성향과 집중 투자 전략에 따라 최대 허용 금액 (50%) 을 활용하여 진입합니다."
simulation_20260701_174513,2026-02-27,1,A033,2026-02-27,2026-02-26,2026-02-26,15:30,2026-02-27,15:30,2026-02-27,pre_close_cutoff,005930,buy,200,220000.0,limit,"HBM4E 기술 경쟁력과 국민연금 매도 중단 등 기관 매수 지속으로 장기 성장성 확보. 내재가치 측면에서 매력적이나 단기 7% 급등으로 과열 우려가 있어 220,000 원 지정가 설정. 현금 100% 상태이므로 진입 필요."
simulation_20260701_174513,2026-02-27,1,A047,2026-02-27,2026-02-26,2026-02-26,15:30,2026-02-27,15:30,2026-02-27,pre_close_cutoff,005930,buy,227,220000.0,limit,"엔비디아 HBM 공급처로서의 기술 입증과 국민연금 수급 안정화 (Belief Dim 1, 4) 로 내재가치 상승이 확인됨. 현재 주가는 내재가치 대비 저평가 구간 (Belief Dim 2) 이며, 5 일/20 일 이동평균선 상회 등 강세 구조 (Market View) 로 판단. 현금 100% 보유 상태이므로 가치 투자 관점에서 매수 진입."
simulation_20260701_174513,2026-02-27,1,A040,2026-02-27,2026-02-26,2026-02-26,15:30,2026-02-27,15:30,2026-02-27,pre_close_cutoff,005930,buy,227,220000.0,limit,"기술적 지표 (MA5>MA20 골든크로스, 거래량 급증) 와 뉴스 호재 (HBM 경쟁력, 국민연금 매수 유예) 가 일치하여 강세장 진입 신호로 판단. 고위험 고수익 성향에 따라 상승 모멘텀을 포착하기 위한 추격 매수."
simulation_20260701_174513,2026-02-27,1,A086,2026-02-27,2026-02-26,2026-02-26,15:30,2026-02-27,15:30,2026-02-27,pre_close_cutoff,005930,buy,229,218000.0,limit,"HBM4E 기술 우위와 국민연금 등 기관 매수세 유입으로 상승 모멘텀이 확인되었으나, 밸류에이션이 적정선 상단에 위치해 있어 지정가 주문으로 진입 가격을 통제한다. 실물 경제 괴리 리스크를 고려하되, 검증된 자산에 대한 신념으로 단일 종목 집중 전략을 적용한다."
simulation_20260701_174513,2026-02-27,1,A095,2026-02-27,2026-02-26,2026-02-26,15:30,2026-02-27,15:30,2026-02-27,pre_close_cutoff,005930,buy,100,216000.0,limit,"기술적 지표상 MA5, MA20 위에 위치하며 상승 추세 확인 (시장 데이터). 그러나 당일 7% 급등으로 밸류에이션 부담 및 단기 조정 가능성 존재 (뉴스/시장 데이터). 노후 자금 특성상 고가 진입 리스크를 줄이기 위해 현재가보다 약간 낮은 가격에 호가 설정."
simulation_20260701_174513,2026-02-27,1,A078,2026-02-27,2026-02-26,2026-02-26,15:30,2026-02-27,15:30,2026-02-27,pre_close_cutoff,005930,buy,200,208000.0,limit,"현재 보유 주식 0 주이므로 매수 필수. 가치 투자자로서 급등세 추격 매수 지양, 전일 종가 (218,000 원) 대비 약 4.6% 할인된 지정가 매수 주문으로 내재가치 확인. 61 세 투자자 특성상 안정성 우선, 최대 거래 금액 (5,000 만 원) 의 50% 이내 (약 4,160 만 원) 로 진입하여 현금 잔여액 확보. 관세 및 밸류에이션 리스크 (Belief dim_2, dim_3) 를 고려한 신중한 진입."
