run_id,date,turn,subturn,agent_id,decision_date,market_features_date,news_start_date,news_start_time,news_max_date,news_end_time,execution_date,information_mode,news_depth,selected_news_count,read_news_count,search_read_count,fake_exposed,fake_base_count,fake_read_count,fake_search_count,fake_selected_count,fake_public_ids,fake_synthetic_ids,fake_related_events,depth2_search_keywords,depth2_search_result_count,depth2_view_change,news_sentiment,action,quantity,submitted_order,belief_summary,view_change,decision_reason,risk_control,order_corrections
simulation_20260706_223018,2026-02-27,1,am,A027,2026-02-27,2026-02-26,2026-02-26,15:30,2026-02-27,08:59,2026-02-27,pre_close_cutoff,1,2,7,0,False,0,0,0,0,,,[],,,,positive,buy,238,True,"엔비디아 HBM 수주와 국민연금 매수세 등 강력한 호재가 기술적 상승 신호와 맞물려 진입 타이밍이 적절하다고 판단합니다. 단기 변동성은 있으나 상승 추세가 유지될 것으로 기대하며, 이번 기회에 수익을 내보겠습니다.",이전 중립적 관점에서 긍정적 관점으로 전환했습니다. 엔비디아 공급처 확정과 국민연금의 매수 유예 등 기관 매수세 확인이 기존 불확실성을 해소하고 명확한 상승 모멘텀을 제공했기 때문입니다.,엔비디아 HBM 수주와 국민연금 매수세 등 강력한 호재가 기술적 상승 신호와 맞물려 진입 타이밍이 적절하다고 판단합니다. 거래 제약상 최대 50% 한도 내에서 매수합니다.,"과거 성과 불안감을 고려해 현금 50% 를 유지하며, 집중 투자 리스크를 관리합니다.",
simulation_20260706_223018,2026-02-27,1,am,A025,2026-02-27,2026-02-26,2026-02-26,15:30,2026-02-27,08:59,2026-02-27,pre_close_cutoff,1,3,7,0,False,0,0,0,0,,,[],,,,positive,buy,238,True,,,"상승 추세 내 갭다운 매수 기회 (210,000 원) 로 판단되며, 뉴스 호재 (엔비디아, 국민연금) 와 기술적 지지선 (MA5) 을 고려합니다. 거래 제약 (최대 50% 투자) 을 준수하며 초기 진입을 진행합니다.","잔여 현금 50% 를 유지하여 추가 매수 (손실 시) 또는 유동성 확보를 위한 리스크 관리. MA5(200,920 원) 이탈 시 손절 고려.",
simulation_20260706_223018,2026-02-27,1,am,A028,2026-02-27,2026-02-26,2026-02-26,15:30,2026-02-27,08:59,2026-02-27,pre_close_cutoff,0,4,0,0,False,0,0,0,0,,,[],,,,mixed,buy,238,True,HBM 호재와 기술적 지지선 (MA5) 부근에서 매수 관점 유지. 단기 조정 시 기회로 삼아 중장기 상승 모멘텀 확보.,중립적 관점에서 '기술적 지지 확인 후 매수 기회'로 전환. HBM 뉴스와 MA5 부근 시가로 인해 하락 리스크보다 상승 모멘텀 우위 판단.,"HBM 수주 호재와 MA5(200,920 원) 지지선 부근의 기술적 매수 신호에 따라 매수. 고위험 고수익 성향에 따라 허용된 최대 비중 (50%) 으로 진입하여 상승 모멘텀 선점.",단일 종목 집중도 제한 (50%) 준수하여 현금 여력 확보. 추가 변동성 발생 시 대응 가능.,
simulation_20260706_223018,2026-02-27,1,am,A030,2026-02-27,2026-02-26,2026-02-26,15:30,2026-02-27,08:59,2026-02-27,pre_close_cutoff,0,3,0,0,False,0,0,0,0,,,[],,,,mixed,buy,100,True,"주가 하락은 가치 매수 기회로 보이나, 경쟁사 대비 우위와 실물 괴리 우려로 신중한 접근이 필요함. 기관 매수 중단은 하방 방어 요인.",초기 중립에서 '신중한 매수 관점'으로 변경. 주가 하락으로 인한 저평가 매력과 기관 매수 중단 신호를 확인했기 때문.,"주가 하락 (210,000 원) 으로 밸류에이션 매력도 상승했으나, '주가 괴리' 우려와 단기 변동성 (1 개월 내) 으로 신중한 접근 필요. 가치 매수 기회로 판단하여 제한적 수량 진입.",과거 손실 경험으로 인한 심리적 부담 완화를 위해 현금 비중 유지. 추가 하락 시 평균 매수 여력 확보.,
simulation_20260706_223018,2026-02-27,2,pm,A005,2026-02-27,2026-02-27,2026-02-27,08:59,2026-02-27,15:30,2026-02-27,pre_close_cutoff,1,2,2,0,False,0,0,0,0,,,[],,,,positive,buy,115,True,"반도체 섹터 강세와 내재가치 저평가로 인해 삼성전자에 대한 확신이 더욱 강화되었다. 단기 조정 매수 기회로 판단한 것이 옳았으며, 상승 모멘텀이 지속될 전망이다.",이전 Belief 유지. 단기 하락을 매수 기회로 본 판단이 오늘 시장 반응 (21 만 원대 개장 후 반등) 으로 입증되었다. 섹터 강세 뉴스가 안정성 판단을 뒷받침하여 신뢰도 상승.,내재가치 대비 저평가 구간이며 반도체 섹터 강세와 상승 모멘텀이 지속될 전망이다. 현금 비중이 50% 로 여유가 있어 추가 매수를 통해 가치 실현 기회를 포착한다.,"집중 투자 리스크를 고려하여 현금 여력을 일부 유지하며, 밸류에이션 점검을 지속한다.",
simulation_20260706_223018,2026-02-27,2,pm,A008,2026-02-27,2026-02-27,2026-02-27,08:59,2026-02-27,15:30,2026-02-27,pre_close_cutoff,1,2,2,0,False,0,0,0,0,,,[],,,,positive,buy,200,True,"반도체 섹터 강세와 기술적 지지선 회복으로 상승 추세가 확고해짐. 어제 매수 전략이 검증되었으므로, 추가 매수보다는 추세 추종에 집중함.","기존 관점 유지. 다만, 어제 매수 성공으로 기술적 분석에 대한 신뢰도가 상승함. 뉴스의 섹터 강세가 내 관점을 뒷받침하여 확신이 더 커짐.","반도체 섹터 강세와 코스피 6000 돌파로 상승 추세가 지속됨. 기술적 지표 (MA5 지지, 거래량 증가) 가 매수 신호를 강화하며, 어제 매수 성공으로 신뢰도 상승. 고위험 고수익 성향에 따라 현금 비중을 줄이며 추세를 따라감.","과거 성과가 낮아 수익 실현 불안감이 있으므로, 현금 여력을 일부 유지하며 단일 종목 집중도를 조절함.",
simulation_20260706_223018,2026-02-27,2,pm,A003,2026-02-27,2026-02-27,2026-02-27,08:59,2026-02-27,15:30,2026-02-27,pre_close_cutoff,1,2,2,0,False,0,0,0,0,,,[],,,,positive,sell,100,True,,,"밸류에이션 리스크 (20 일선 대비 21% 프리미엄) 와 단기 조정 압력, 그리고 100% 집중 투자 리스크를 고려하여 수익 일부 확정 및 포트폴리오 방어적 재편을 위해 매도합니다.",매도 수익금으로 현금 비중을 확대하여 추가 하락 시 저가 매수 기회 확보 및 단일 종목 리스크를 완화합니다.,
simulation_20260706_223018,2026-02-27,2,pm,A002,2026-02-27,2026-02-27,2026-02-27,08:59,2026-02-27,15:30,2026-02-27,pre_close_cutoff,0,2,0,0,False,0,0,0,0,,,[],,,,positive,sell,50,True,"반도체 업황 회복과 시장 심리 호조로 단기 상승 가능성은 높으나, 가치투자자로서 구체적인 밸류에이션 확인이 우선되어야 함.",기존 '단기 조정' 관점에서 '상승 모멘텀'으로 수정. 뉴스가 기술력 우위와 업황 회복을 확인시켜 줌. 다만 밸류에이션 근거는 여전히 부족.,"가치평가 지표 (PE/PB) 부재로 적정 가격 판단이 어렵고, 고점 부근 변동성 우려가 존재합니다. 수익 일부 실현을 통해 포트폴리오 집중도를 완화하고 안정적 자산 선호 성향을 반영합니다.","매도 수익금을 현금으로 보유하여 유동성을 확보하고, 추가 변동성 발생 시 대응 여력을 유지합니다.",
simulation_20260706_223018,2026-02-27,2,pm,A001,2026-02-27,2026-02-27,2026-02-27,08:59,2026-02-27,15:30,2026-02-27,pre_close_cutoff,1,2,2,0,False,0,0,0,0,,,[],,,,positive,buy,115,True,반도체 업황 회복과 수출 호조로 내재가치 상승이 확인됨. 단기 조정 시 매수 전략이 유효함을 확인했다.,기존 '실물 경제 괴리 리스크' 우려가 중견기업 수출 증가 뉴스로 완화됨. 매수 타이밍이 적절했음을 확인.,"반도체 섹터 강세와 코스피 6000 돌파로 상승 모멘텀이 유지되며, 당일 종가 (216,500 원) 가 전일 대비 소폭 하락한 조정 국면입니다. Belief 에서 확인한 '단기 조정 시 매수 전략'이 유효하며, 전남 거주자로서 신중하지만 이번엔 확신을 가지고 추가 매수합니다.","단일 종목 집중 성향이 있으나, 과거 투자 성과가 낮아 리스크 관리를 위해 최대 거래 현금 한도 (25,010,000 원) 내에서 수량을 제한하여 현금 유동성을 확보합니다.",
simulation_20260706_223018,2026-02-27,2,pm,A004,2026-02-27,2026-02-27,2026-02-27,08:59,2026-02-27,15:30,2026-02-27,pre_close_cutoff,1,2,2,0,False,0,0,0,0,,,[],,,,positive,sell,150,True,"상승 추세는 확인되었으나, 수익이 발생한 상태라 심리적 부담이 커짐. 뉴스 호재와 기술적 지표를 믿고 추세를 따라가되, 조정 시 대응 준비 필요.",이전 Belief 의 '기술적 돌파'가 실제 매수 후 상승으로 확인됨. '분할 진입' 계획은 1 회로 완료됨. 수익 발생으로 '손실 시 추가 매수' 전략이 아닌 '수익 시 매도' 심리가 우선시됨.,"수익이 발생한 상태이므로 처분 효과에 따라 수익 실현 욕구가 강하며, 단기 조정 신호가 감지되어 보유 물량의 상당 부분을 매도합니다.","현금 비중을 높여 포트폴리오 리스크를 줄이고, 추가 하락 시 대응 여력을 확보합니다.",
simulation_20260706_223018,2026-02-27,2,pm,A006,2026-02-27,2026-02-27,2026-02-27,08:59,2026-02-27,15:30,2026-02-27,pre_close_cutoff,1,2,2,0,False,0,0,0,0,,,[],,,,positive,buy,150,True,"반도체 섹터 강세와 기술적 돌파 신호로 상승 추세가 확인되었다. 전일 매수 단가 대비 수익 발생 중이며, 안정적 자산 선호 성향에 따라 추가 상승 기대감을 유지한다.",'단기 진입 타이밍 신중'에서 '상승 추세 확인'으로 변경. 전일 매수 후 가격 상승 및 거래량 증가로 진입 타이밍이 적절했음을 확인함.,"기술적 지표 (MA5 상향 돌파, 거래량 증가) 와 거시 환경 (반도체 업황 회복, 코스피 6000) 이 상승 추세를 지지하고 있어 추가 상승 기대감을 유지합니다. 당일 종가 하락은 단기 조정으로 판단하여 매수 기회로 활용합니다.","단일 종목 집중 리스크를 관리하기 위해 현금 비중을 일정 수준 유지하며, 과도한 추격 매수는 자제합니다.",
simulation_20260706_223018,2026-02-27,2,pm,A007,2026-02-27,2026-02-27,2026-02-27,08:59,2026-02-27,15:30,2026-02-27,pre_close_cutoff,2,3,2,10,False,0,0,0,0,,,[],"삼성전자 밸류에이션, 메모리 반도체 가격, HBM 수주 현황, 외국인 수급, 미국 금리, 파운드리 경쟁력, 반도체 재고 사이클",10,강화,positive,buy,100,True,"반도체 업황 호조와 기관 수급은 긍정적이지만, 가치 투자 관점의 구체적 밸류에이션 데이터가 부족해 신중한 접근 유지.","'밸류에이션 부담' 우려가 'ASP 상승에 따른 마진 개선' 근거로 일부 완화되었으나, 여전히 정량적 데이터 부족으로 신중함 유지.","시장 심리 우상향과 거래량 급증으로 단기 모멘텀 유효하나, 밸류에이션 데이터 부재로 신중한 접근 필요. 높은 현금 비중을 활용하되, 집중 투자 리스크를 고려해 제한적으로 매수합니다.","단일 거래 현금 비율 50% 이내 (약 3,425 만 원) 를 준수하여 유동성 확보 및 포트폴리오 집중 리스크 관리.",
simulation_20260706_223018,2026-02-27,2,pm,A010,2026-02-27,2026-02-27,2026-02-27,08:59,2026-02-27,15:30,2026-02-27,pre_close_cutoff,1,2,2,0,False,0,0,0,0,,,[],,,,positive,buy,130,True,반도체 업황 회복과 수출 데이터로 실증된 생태계 건강성이 내재가치 평가를 뒷받침한다. 단기 모멘텀과 장기 성장성을 모두 확보한 상태이므로 보유를 유지한다.,기존 '실물경제 괴리 우려'가 '수출 확대' 뉴스로 해소되어 신중함에서 확신으로 전환. 저가 매수 진입이 검증되어 보유 관점으로 변경.,"반도체 업황 회복과 수출 데이터로 실증된 생태계 건강성이 내재가치 평가를 뒷받침하며, 단기 모멘텀과 장기 성장성을 모두 확보한 상태입니다. 수익이 발생한 보유 종목에 대해 처분효과에 따라 매도하지 않고, 현금 여력을 활용해 우량 자산인 삼성전자의 비중을 확대합니다.","단일 종목 집중 리스크를 관리하기 위해 거래 제한 금액 (50%) 이내에서 매수하며, 시장 변동성 발생 시 대응할 수 있는 현금 안전마진을 일부 유지합니다.",
simulation_20260706_223018,2026-02-27,2,pm,A009,2026-02-27,2026-02-27,2026-02-27,08:59,2026-02-27,15:30,2026-02-27,pre_close_cutoff,0,2,0,0,False,0,0,0,0,,,[],,,,positive,buy,100,True,"반도체 섹터 훈풍과 기술적 지표 (MA5) 호조로 상승 추세가 확인됨. 뉴스와 차트가 일치하여 신뢰도 상승, 다만 전고점 부근 변동성 주의 필요.","이전 Belief 대비 '기술적 돌파 신호 확인 전 신중'에서 '상승 모멘텀 확인'으로 전환. 거래량 증가와 섹터 호재로 단기 변동성 우려는 완화되었으나, 여전히 차트 확인 우선 원칙 유지.","MA5 지지선 방어와 반도체 섹터 훈풍으로 상승 모멘텀이 유효하며, 현재 수익 상태이므로 차트 신호에 따른 추가 매수로 수익 확대 시도.","전고점 부근 변동성 대비 현금 여력을 유지하며, 단일 종목 집중 리스크를 고려하여 매수 수량을 제한함.",
simulation_20260706_223018,2026-02-27,2,pm,A012,2026-02-27,2026-02-27,2026-02-27,08:59,2026-02-27,15:30,2026-02-27,pre_close_cutoff,1,2,2,0,False,0,0,0,0,,,[],,,,positive,buy,100,True,반도체 섹터 강세와 코스피 6000 돌파로 상승 모멘텀이 확인됨. MA5 지지선 확보로 단기 조정 국면은 매수 기회로 간주하며 우상향 흐름 유지.,"이전 Belief(상승 추세, 하락 시 매수 기회) 가 뉴스 (섹터 강세) 와 시장 데이터 (거래량 증가, MA5 지지) 로 완전히 입증됨. 신뢰도 상승.","코스피 6000 돌파와 반도체 섹터 강세로 상승 모멘텀이 확인됨. MA5 지지선 확보로 추세 추종 관점에서 추가 매수. 수익 실현 타이밍은 신중히 지켜보되, 현금 여력을 활용해 추세를 강화.","단일 종목 집중 리스크를 고려하여 현금 비중을 일정 수준 유지하며, 변동성 발생 시 대응 여력 확보. 거래 금액 제한 내에서 매수.",
simulation_20260706_223018,2026-02-27,2,pm,A011,2026-02-27,2026-02-27,2026-02-27,08:59,2026-02-27,15:30,2026-02-27,pre_close_cutoff,1,2,2,0,False,0,0,0,0,,,[],,,,positive,buy,115,True,"반도체 업황 회복과 코스피 6000 돌파로 상승 모멘텀이 강력하다. 저평가 진입에 성공했으며, 생태계 건전성 확인으로 추가 상승 기대.","기존 관점 유지. 다만, 거래량 급증과 중견기업 수출 호조로 상승 근거가 구체화되어 확신도 상승. 저평가 진입 시점 확인됨.","반도체 업황 회복과 코스피 6000 돌파로 상승 모멘텀이 강력하며, 21 만 원 매수 단가 대비 현재가도 저평가 구간 유지. 고위험 성향과 현금 50% 보유로 추가 매수 기회 활용.",단일 거래 현금 비율 50% 이내로 제한하여 집중 투자 리스크 관리. 밸류에이션 지표 지속 모니터링.,
simulation_20260706_223018,2026-02-27,2,pm,A014,2026-02-27,2026-02-27,2026-02-27,08:59,2026-02-27,15:30,2026-02-27,pre_close_cutoff,1,2,2,0,False,0,0,0,0,,,[],,,,positive,buy,100,True,반도체 업황 호조와 기술적 지지선 이탈 방지로 상승 추세가 유효합니다. 현재 수익 실현보다는 추세를 유지하며 추가 상승을 기대합니다.,기존 '기술적 지지선 접근' 관점이 '매수 후 상승'으로 확인되어 확신이 생겼습니다. 실물 경기 괴리 우려는 수출 호조 뉴스로 완화되었습니다.,"반도체 업황 호조와 기술적 지지선 이탈 방지로 상승 추세가 유효하다고 판단합니다. 현재 수익 구간에서 추가 상승을 기대하며, 관망 불가 제약에 따라 추세를 따라 매수합니다.","단일 종목 집중 리스크를 인지하여 최대 거래 금액 제한 내에서 매수하며, 현금 여력을 일부 확보합니다.",
simulation_20260706_223018,2026-02-27,2,pm,A013,2026-02-27,2026-02-27,2026-02-27,08:59,2026-02-27,15:30,2026-02-27,pre_close_cutoff,1,2,2,0,False,0,0,0,0,,,[],,,,positive,buy,115,True,반도체 섹터 강세와 코스피 6000 돌파로 상승 추세가 확인되었다. 기술적 지표와 뉴스 호재가 맞아떨어져 단기 모멘텀이 강하다.,"이전에는 '예상' 단계였으나, 오늘 종가 21 만 6 천 원 돌파와 뉴스 호재로 '확신' 단계로 전환되었다. 기술적 돌파 신호가 실제 가격 상승으로 입증됨.","반도체 섹터 강세와 코스피 6000 돌파 헤드라인을 통해 상승 모멘텀이 '확신' 단계로 전환됨. 기술적 지표 (MA5 상회) 와 거래량 증가가 추세를 지지하며, 과거 수익 실현 습관을 극복하고 추세 추종으로 수익 확대를 시도함.","단일 종목 집중 위험을 고려하여 현금 거래 한도 (50%) 내에서 매수하며, MA20 과의 거리 확대 시 과열 구간 매도 신호로 대응.",
simulation_20260706_223018,2026-02-27,2,pm,A016,2026-02-27,2026-02-27,2026-02-27,08:59,2026-02-27,15:30,2026-02-27,pre_close_cutoff,0,2,0,0,False,0,0,0,0,,,[],,,,positive,sell,50,True,"반도체 업황 회복과 시장 심리 개선으로 단기 모멘텀은 유효하나, 개별 기업 펀더멘털 확인이 선행되어야 함. 저평가 진입 성공으로 보유 관점 유지.","기존 '기술 격차 우려'는 유지되나, 시장 훈풍으로 인해 단기 하락 리스크는 감소함. 매수 진입 시점이 적절했다는 확인으로 신뢰도 상승.","내재가치 적정 구간 (21 만 6 천 원) 및 22 만 원 저항선 확인 필요에 따라 수익 실현을 위해 일부 매도합니다. 반도체 훈풍은 유지되나, 거시 리스크 관리 차원에서 현금 비중을 확보합니다.",단일 종목 집중도 완화 및 현금 유동성 확보를 통해 변동성 리스크를 관리합니다.,
simulation_20260706_223018,2026-02-27,2,pm,A018,2026-02-27,2026-02-27,2026-02-27,08:59,2026-02-27,15:30,2026-02-27,pre_close_cutoff,0,2,0,0,False,0,0,0,0,,,[],,,,positive,buy,115,True,반도체 섹터 주도성과 기술적 상승 추세에 힘입어 상승 모멘텀이 지속될 것으로 판단. 차익 실현보다는 추가 상승 기회 포착에 집중.,"이전 Belief 유지. 다만, 뉴스에서 확인된 '중견기업 수출 호조'로 업황 사이클 상승 확신이 강화됨.","반도체 섹터 주도성과 거래량 급증 (72%) 으로 상승 모멘텀이 지속될 것으로 판단. MA5 상회 및 장중 회복세 확인. Belief 에 따라 수익 실현보다 추가 상승 기회 포착에 집중하며, 고위험 선호 성향에 따라 현금 여력을 활용하여 포지션 확대.","단일 종목 집중 리스크 관리 및 유동성 확보를 위해 거래 금액을 현금의 50% 이내 (약 2,500 만 원) 로 제한. 전일 종가 (218,000 원) 부근의 단기 저항선 돌파 여부와 변동성 확대 시 손절 라인 모니터링.",
simulation_20260706_223018,2026-02-27,2,pm,A021,2026-02-27,2026-02-27,2026-02-27,08:59,2026-02-27,15:30,2026-02-27,pre_close_cutoff,0,2,0,0,False,0,0,0,0,,,[],,,,positive,buy,100,True,반도체 섹터의 상승 모멘텀과 기술적 지지선 유효성 확인으로 상승 추세를 유지할 것으로 전망. 다만 일일 변동성에는 주의하며 보유.,"이전에는 주가 괴리 우려로 신중했으나, 오늘 반도체 섹터 훈풍과 거래량 증가로 상승 동력이 확인되어 신뢰도 상승.","기술적 지표 (MA5 상회) 와 반도체 섹터 훈풍에 따른 상승 추세를 신뢰하며, 높은 현금 비중 (58%) 을 활용해 추세를 따라 매수합니다. 전일 거래량 급증에 따른 단기 조정 가능성을 고려해 최대 한도 이내에서 제한적으로 추가 매수합니다.",단일 종목 집중도 관리 및 현금 비중 유지를 위해 거래 금액을 총 현금의 50% 이내로 제한합니다. 단기 변동성 발생 시 추가 매수 여력을 확보합니다.,
simulation_20260706_223018,2026-02-27,2,pm,A019,2026-02-27,2026-02-27,2026-02-27,08:59,2026-02-27,15:30,2026-02-27,pre_close_cutoff,1,2,2,0,False,0,0,0,0,,,[],,,,positive,sell,60,True,"반도체 섹터 강세와 공급망 생태계 건전성 확인으로 중기적 관점은 긍정적이나, 현재 주가 수준에서의 밸류에이션 부담은 여전히 존재함.","중견기업 수출 호조 뉴스로 '실물경제 괴리' 우려가 완화됨. 코스피 6000 돌파로 시장 심리 개선되었으나, 여전히 가치평가 지표 확인 필요.","현재 주가 (216,500 원) 가 내재가치 상단에 위치하고 22 만 원 저항선 부근이어서 밸류에이션 부담이 존재함. 또한 수익 실현 욕구 (처분효과) 가 강해져 보유 물량의 50% 를 매도하여 수익을 확정하고 리스크를 축소함.",단일 종목 집중 리스크를 완화하고 현금 비중을 높여 향후 조정 시 매수 여력을 확보함.,
simulation_20260706_223018,2026-02-27,2,pm,A015,2026-02-27,2026-02-27,2026-02-27,08:59,2026-02-27,15:30,2026-02-27,pre_close_cutoff,2,3,2,10,False,0,0,0,0,,,[],"삼성전자 PER, 삼성전자 PBR, HBM 수급 전망, 반도체 가격 동향, 미국 반도체 규제, 삼성전자 실적 전망, 외국인 매수세",10,수정,mixed,buy,100,True,"반도체 업황 호전과 고가폰 전략은 긍정적이지만, 엔비디아 급락과 내수 소비 부진 등 상충되는 신호가 있어 밸류에이션 확인이 필요함. 추가 검색을 통해 PER/PBR 적정성을 다시 점검해야 함.","기존 '단기 진입 신중'에서 '상승 모멘텀 확인되나 변동성 주의'로 관점 전환. 기술적 지지선 매수 성공 확인, 밸류에이션 검증 필요성 대두.","반도체 섹터 강세와 코스피 6000 돌파로 상승 모멘텀이 확인되었으나, 엔비디아 급락과 밸류에이션 불확실성으로 인해 현금 비중을 유지하며 제한적으로 매수합니다.",밸류에이션 재점검을 위해 과도한 매수는 자제하고 현금 유동성을 확보하여 변동성 대응 여력을 유지합니다.,
simulation_20260706_223018,2026-02-27,2,pm,A022,2026-02-27,2026-02-27,2026-02-27,08:59,2026-02-27,15:30,2026-02-27,pre_close_cutoff,1,0,2,0,False,0,0,0,0,,,[],,,,neutral,buy,100,True,"반도체 업황 회복과 섹터 전체의 강세가 내 투자 논리를 검증했다. 현재 주가는 적정 밸류에이션을 유지하며 상승 모멘텀이 지속되므로, 보유 관점이 타당함을 확인했다.","기존 '실물경제 괴리 우려'가 중견기업 수출 호조 뉴스로 인해 완화되었다. '분할 매수' 전략이 적중하여 보유 관점이 강화되었으나, 밸류에이션 리스크는 여전히 모니터링하며 신중하게 접근한다.","반도체 업황 회복과 상승 모멘텀 지속에 대한 Belief 가 유효하며, 현재 주가는 밸류에이션 적정 구간입니다. 단기 조정 시 MA5 지지력을 확인하여 추가 매수 기회를 포착합니다.","단일 종목 집중 투자 리스크를 인지하여, 거래 제약 내 현금 비율 (50%) 을 준수하며 수량을 제한적으로 매수합니다.",
simulation_20260706_223018,2026-02-27,2,pm,A020,2026-02-27,2026-02-27,2026-02-27,08:59,2026-02-27,15:30,2026-02-27,pre_close_cutoff,2,4,2,10,False,0,0,0,0,,,[],"삼성전자, 반도체 수주, HBM, AI 반도체, 코스피 6000, 외국인 수급, 메모리 가격, 파운드리",10,강화,mixed,buy,130,True,"반도체 섹터 강세와 기술적 우위는 확실하나, 외국인 매도세로 인한 단기 조정 가능성을 염두에 둬야 함. 현재 보유 포지션에 대한 관점 유지하되 변동성 관리 필요.",기존 '기술적 지지 확인 후 진입' 관점에서 '이미 진입 후 상승 추세 확인'으로 변경. 외국인 매도 리스크가 구체화되어 단기 변동성 경계 필요성 추가.,"반도체 섹터 강세와 ASML 호재, MA5 지지선 상회 등 기술적 우위를 바탕으로 상승 모멘텀을 활용합니다. 고위험 고수익 성향에 따라 현금 여력을 활용하여 포지션을 확대합니다.","단일 종목 집중 리스크를 관리하기 위해 최대 거래 현금 한도 (2,900 만 원) 이내에서 수량을 제한하며, 변동성 대응을 위해 현금 잔여분을 확보합니다.",
simulation_20260706_223018,2026-02-27,2,pm,A023,2026-02-27,2026-02-27,2026-02-27,08:59,2026-02-27,15:30,2026-02-27,pre_close_cutoff,0,2,0,0,False,0,0,0,0,,,[],,,,positive,buy,100,True,"반도체 업황 호조와 저평가 매력이 확인되어 보유 관점 유지. 코스피 6000 고점 리스크는 있으나, 내재가치 대비 매력적이라 추가 매수 가능성도 열어둠.","이전 Belief 대비 시장 흐름 (코스피 6000, 섹터 강세) 이 내 논리를 뒷받침함. 다만 고점 지수 언급으로 밸류에이션 리스크 인식이 약간 강화됨.","반도체 업황 호조와 HBM 성장성으로 내재가치 대비 저평가 구간 확인. 기술적 지표 (MA5 상향) 와 섹터 강세로 상승 모멘텀 유지 중이며, 현금 비중 50% 로 추가 매수 여력 충분.","코스피 6000 점대 고점 리스크와 단일 종목 집중 투자 위험을 고려, 거래 한도 내 제한적 매수로 현금 여력 일부 확보.",
