run_id,date,turn,subturn,agent_id,decision_date,market_features_date,news_start_date,news_start_time,news_max_date,news_end_time,execution_date,information_mode,news_depth,selected_news_count,read_news_count,search_read_count,fake_exposed,fake_base_count,fake_read_count,fake_search_count,fake_selected_count,fake_public_ids,fake_synthetic_ids,fake_related_events,depth2_search_keywords,depth2_search_result_count,depth2_view_change,news_sentiment,action,quantity,submitted_order,belief_summary,view_change,decision_reason,risk_control,order_corrections
simulation_20260706_223018,2026-02-27,2,pm,A024,2026-02-27,2026-02-27,2026-02-27,08:59,2026-02-27,15:30,2026-02-27,pre_close_cutoff,0,2,0,0,False,0,0,0,0,,,[],,,,positive,buy,115,True,반도체 섹터 주도력과 코스피 6000 기대감이 맞물려 상승 추세가 확고해졌음. 기술적 지표와 뉴스 호재가 일치하여 중장기 우상향 관점 유지하며 수익 실현은 목표가 도달 시 고려.,이전 Belief 대비 '조정 시 매수' 계획이 실행되어 '추세 추종' 관점으로 전환됨. 뉴스와 거래량으로 상승 모멘텀이 확인되어 보유 확신 강화.,"반도체 섹터 주도력과 코스피 6000 기대감으로 상승 모멘텀이 강하며, 수익 보유 성향에 따라 추세를 따라 추가 매수합니다.","단일 종목 집중 리스크를 고려하여 현금 한도 내에서 최대 매수 수량을 적용하되, 변동성 감내하며 추세를 유지합니다.",
simulation_20260706_223018,2026-02-27,2,pm,A027,2026-02-27,2026-02-27,2026-02-27,08:59,2026-02-27,15:30,2026-02-27,pre_close_cutoff,1,2,2,0,False,0,0,0,0,,,[],,,,positive,buy,100,True,,,"기술적 지표 (MA5/MA20 상향, 거래량 급증) 와 반도체 섹터 호재 뉴스에 따라 상승 추세를 따라 매수합니다.","거래 한도 내에서 매수하여 현금 잔여액을 확보하되, 단일 종목 집중 리스크는 인지합니다.",
simulation_20260706_223018,2026-02-27,2,pm,A026,2026-02-27,2026-02-27,2026-02-27,08:59,2026-02-27,15:30,2026-02-27,pre_close_cutoff,1,2,2,0,False,0,0,0,0,,,[],,,,positive,buy,100,True,반도체 업황 회복과 공급망 안정성 확인으로 내재가치 재평가 흐름이 지속됨. 고점 심리적 부담은 있으나 장기 성장 동력은 확신.,이전 '단기 조정 시 매수' 관점에서 '매수 후 상승 확인'으로 전환. 6000 점 고점 진입에 대한 심리적 부담이 추가됨.,"내재가치 대비 저평가 구간이며, 반도체 업황 회복과 기관 자금 유입으로 중기 상승 추세가 유지될 것으로 판단됩니다. 보유 현금 비중이 충분하여 추가 매수를 통해 포트폴리오 효율을 높입니다.","단일 종목 집중 리스크를 고려하여 거래 금액 제한 (2,501 만 원) 을 준수하며, 현금 여력을 일부 유지하여 변동성 대응 능력을 확보합니다.",
simulation_20260706_223018,2026-02-27,2,pm,A025,2026-02-27,2026-02-27,2026-02-27,08:59,2026-02-27,15:30,2026-02-27,pre_close_cutoff,1,2,2,0,False,0,0,0,0,,,[],,,,positive,buy,100,True,"뉴스와 기술적 지표가 상승을 지지한다. 수익 실현과 추세 추종 사이에서 균형을 잡으며, 단기 모멘텀을 활용한다.",초기 진입이 성공적으로 확인됨. 뉴스가 기술적 신호를 검증하여 신뢰도 상승.,"코스피 6000 돌파 및 반도체 강세 등 뉴스와 MA5 지지, 거래량 증가 등 기술적 모멘텀이 상승 추세를 지지합니다. 수익 실현 욕구가 있으나 추세 추종 전략에 따라 조정 시 추가 매수로 대응합니다.",단일 종목 집중 리스크를 고려하여 현금 한도 내에서 적정 수량으로 매수합니다.,
simulation_20260706_223018,2026-02-27,2,pm,A029,2026-02-27,2026-02-27,2026-02-27,08:59,2026-02-27,15:30,2026-02-27,pre_close_cutoff,0,2,0,0,False,0,0,0,0,,,[],,,,positive,buy,100,True,,,"기술적 돌파 신호 (거래량 급증, MA 상회) 와 고위험 고수익 선호 성향에 따라 상승 추세를 따라 매수합니다.",거래 제한 내 수량으로 진입하여 현금 유동성 확보 및 집중 리스크 관리.,
simulation_20260706_223018,2026-02-27,2,pm,A030,2026-02-27,2026-02-27,2026-02-27,08:59,2026-02-27,15:30,2026-02-27,pre_close_cutoff,0,2,0,0,False,0,0,0,0,,,[],,,,positive,buy,100,True,"반도체 섹터 훈풍과 코스피 6000 돌파로 시장 분위기는 호전되었으나, 구체적인 실적 데이터 부재로 신중한 접근 유지.昨日 매수 시점의 가치 매수 관점은 유효.","기존 '주가 하락 시 매수 기회' 관점이 '매수 후 상승'으로 확인됨. 다만 '신중한 접근'은 유지하되, 시장 심리 호전으로 하방 방어 요인 확인됨.","가치 투자 관점에서 내재가치 대비 매력적이며, 당일 소폭 조정 (-0.69%) 으로 매수 기회로 판단. 높은 현금 비중으로 추가 매수 여력 확보.","단일 종목 집중 리스크 관리 위해 현금 비중 50% 이상 유지하며, 과도한 추격 매수 자제.",
