run_id,date,turn,subturn,agent_id,decision_date,market_features_date,news_start_date,news_start_time,news_max_date,news_end_time,execution_date,information_mode,news_depth,selected_news_count,read_news_count,search_read_count,fake_exposed,fake_base_count,fake_read_count,fake_search_count,fake_selected_count,fake_public_ids,fake_synthetic_ids,fake_related_events,depth2_search_keywords,depth2_search_result_count,depth2_view_change,news_sentiment,action,quantity,submitted_order,belief_summary,view_change,decision_reason,risk_control,order_corrections
simulation_20260706_223018,2026-02-27,1,am,A002,2026-02-27,2026-02-26,2026-02-26,15:30,2026-02-27,08:59,2026-02-27,pre_close_cutoff,0,3,0,0,False,0,0,0,0,,,[],,,,mixed,buy,238,True,국민연금의 매수 신호와 기술력 우위를 바탕으로 저평가 구간으로 판단. 단기 조정 후 중장기 가치 실현을 노림.,중립적 관점에서 기관 매수 신호와 주가 하락을 기회로 인식하며 긍정적 관점으로 전환.,"국민연금 매수 신호와 210,000 원의 저평가 구간을 기회로 판단하여 매수합니다. AI 수요 지속과 반도체 업황 회복 기대감으로 중장기 우상향 전망합니다.",단일 종목 집중 투자 성향으로 인한 리스크를 완화하기 위해 현금의 50% 한도 내에서 매수하여 유동성을 확보합니다. 추가 조정 시 대응 여력을 남깁니다.,
simulation_20260706_223018,2026-02-27,1,am,A005,2026-02-27,2026-02-26,2026-02-26,15:30,2026-02-27,08:59,2026-02-27,pre_close_cutoff,1,3,7,0,False,0,0,0,0,,,[],,,,positive,buy,238,True,"HBM4E 기술력과 국민연금의 매수 유지를 통해 삼성전자의 성장성과 안정성을 확인했습니다. 단기 하락은 매수 기회로 보고, 내재가치 기반의 집중 투자 가치를 높게 평가합니다.","중립적 관점에서 '매수 기회'로 전환되었습니다. 국민연금의 매도 중단과 HBM4E 기술 경쟁력 확인으로 성장성과 안전성이 입증되어, 기존 현금 보유 상태에서 진입을 고려하게 되었습니다.","HBM4E 기술 우위와 국민연금 매수 유지로 성장성과 안정성을 확인했습니다. 내재가치 대비 저평가 구간이며, 단기 조정 매수 기회로 판단하여 거래 제약 범위 내에서 집중 투자합니다.","거래 제약상 최대 50% 한도를 준수하여 리스크를 관리하며, 실물경제 괴리 우려가 지속될 경우 추가 진입 전 변동성 관리를 우선시합니다.",
simulation_20260706_223018,2026-02-27,1,am,A001,2026-02-27,2026-02-26,2026-02-26,15:30,2026-02-27,08:59,2026-02-27,pre_close_cutoff,1,3,7,0,False,0,0,0,0,,,[],,,,mixed,buy,238,True,"국민연금의 매도 중단과 HBM 기술 경쟁력 확보로 장기적 가치 상승이 유력하다. 단기 조정 시 매수 기회로 삼되, 실물 경제 괴리 리스크는 관리해야 한다.",중립적 관점에서 기관 자금 유입과 기술력 확인으로 '가치 매수' 관점으로 전환. 다만 실물 경제 우려로 진입 타이밍은 신중하게 검토.,"국민연금 매도 중단과 HBM 호재로 저평가 구간으로 판단하여, 단기 조정 시 매수 기회로 삼습니다.","과거 투자 성과 부진으로 인한 손실 공포를 고려하여, 현금의 50% 이내로 제한적으로 진입합니다. 추가 하락 시 현금 여력을 확보합니다.",
simulation_20260706_223018,2026-02-27,1,am,A003,2026-02-27,2026-02-26,2026-02-26,15:30,2026-02-27,08:59,2026-02-27,pre_close_cutoff,1,3,7,0,False,0,0,0,0,,,[],,,,positive,buy,238,True,국민연금의 매도 중단과 HBM4E 기술 경쟁력 확보로 삼성전자의 하방 경직성과 성장성이 동시에 확인되었다. 현재 주가는 가치 투자 관점에서 매력적인 진입점으로 판단된다.,"중립적 관점에서 긍정적 매수 관점으로 전환. 국민연금의 자금 유입과 HBM 기술 뉴스가 ""안정적 검증 자산""이라는 기존 신념을 확고히 했다.",국민연금 매도 중단과 HBM4E 기술 경쟁력 확보로 하방 경직성이 강화된 점을 확인했습니다. 21 만 원대 (MA5 상단) 는 내재가치 대비 저평가 구간으로 판단되어 가치 투자 관점에서 매수합니다. 거래 제약상 최대 50% 한도인 5000 만 원 범위 내에서 진입합니다.,"초기 진입 시 현금 50% 를 유지하여 추후 평균 단가 조정 여력을 확보합니다. MA5(200,920 원) 이탈 시 상승 추세 붕괴 신호로 간주하여 손절 라인 설정을 검토합니다.",
simulation_20260706_223018,2026-02-27,1,am,A008,2026-02-27,2026-02-26,2026-02-26,15:30,2026-02-27,08:59,2026-02-27,pre_close_cutoff,1,3,7,0,False,0,0,0,0,,,[],,,,positive,buy,238,True,HBM 기술 경쟁력과 국민연금의 기관 매수세로 상승 추세가 확고해짐. 시가 하락은 오히려 기술적 지지선 내에서의 매수 기회로 해석함.,중립적 관점에서 긍정적 관점으로 전환. 국민연금 매수 중단과 HBM 호재로 인해 기술적 지표와 뉴스가 상승 신호로 일치함.,"HBM4E 수주와 국민연금 매수 중단 호재로 상승 모멘텀이 강하며, 시가 하락은 MA5 지지선 근처에서 기술적 매수 기회로 판단됨. 고위험 고수익 성향에 따라 제한된 범위 내에서 진입 확신을 가지고 매수함.","단일 종목 투자 한도 (50%) 를 준수하여 현금 여력을 확보하고, 과거 성과가 낮아 손절 라인 (MA5 이탈 시) 을 철저히 설정하여 리스크를 관리함.",
simulation_20260706_223018,2026-02-27,1,am,A006,2026-02-27,2026-02-26,2026-02-26,15:30,2026-02-27,08:59,2026-02-27,pre_close_cutoff,1,3,7,0,False,0,0,0,0,,,[],,,,positive,buy,238,True,"HBM 수혜와 기관 매수세로 장기적 관점은 긍정적이지만, 단기 급락으로 인해 진입 타이밍을 신중히 고려한다.",중립에서 '관망 후 매수 기회'로 전환. 뉴스 호재와 기술적 지지선 (MA5) 유지로 낙관적 관점 강화.,"HBM4E 수혜와 기관 매수세로 장기 상승 추세 유지 예상되나, 전일 3.67% 하락으로 일시적 할인 구간으로 판단. 안정적 자산 선호 성향과 단일 종목 집중 전략에 따라 최대 허용 범위 내에서 매수.","MA5(200,920 원) 지지선 이탈 시 추가 매수 (손절) 전략을 명확히 하며, 현금 여력을 남겨 변동성 대응 및 손실 시 추가 매수 (Disposition Effect) 에 대비.",
simulation_20260706_223018,2026-02-27,1,am,A004,2026-02-27,2026-02-26,2026-02-26,15:30,2026-02-27,08:59,2026-02-27,pre_close_cutoff,1,0,7,0,False,0,0,0,0,,,[],,,,neutral,buy,238,True,기술적 돌파와 HBM4E 호재로 상승 추세 확인. 기관 매수세도 있어 단기 매수 관점. 다만 과열 우려로 분할 진입 고려.,중립에서 긍정적 관점으로 전환. 기술적 지표 (MA5 돌파) 와 HBM4E 뉴스가 기존 중립적 입장을 긍정적으로 바꾸는 결정적 요인.,"기술적 지표 (MA5 돌파) 와 HBM4E 호재로 상승 모멘텀이 확인되어 진입합니다. 과거 손실 경험으로 고점 매수 공포가 있으나, 분할 진입 원칙에 따라 허용된 최대 현금 비율 (50%) 을 활용하여 초기 포지션을 형성합니다.",단일 종목 집중 성향으로 인해 현금 50% 를 유지하며 변동성 리스크를 관리합니다. 추후 추가 매수 여력을 확보합니다.,
simulation_20260706_223018,2026-02-27,1,am,A007,2026-02-27,2026-02-26,2026-02-26,15:30,2026-02-27,08:59,2026-02-27,pre_close_cutoff,2,5,7,10,False,0,0,0,0,,,[],"삼성전자 밸류에이션 지표, HBM4E 수율 경쟁력, 외국인 삼성전자 매수세, 메모리 반도체 가격 전망 2026, 국내 소비 지표 반도체, 삼성전자 배당 수익률, 엔비디아 HBM 수주 현황",10,수정,mixed,buy,150,True,"HBM 호재와 기관 지지만으로는 부족하며, 정책 리스크와 밸류에이션 부담을 고려해 신중한 접근이 필요함.",중립적 관점에서 '정책 리스크 + 밸류에이션 부담'으로 구체화됨. HBM 호재와 정책 리스크 사이에서 밸류에이션 확인이 시급해짐.,"HBM4E 호재와 기관 자금 유입은 중장기 성장 동력이지만, 현재 주가는 밸류에이션 부담이 있고 정책 리스크가 존재합니다. 따라서 신중한 접근을 위해 최대 거래 한도 이내에서 제한적으로 매수합니다.",현금 여력을 확보하여 단기 조정 시 추가 매수 기회 활용 및 단일 종목 집중 리스크 관리.,
simulation_20260706_223018,2026-02-27,1,am,A010,2026-02-27,2026-02-26,2026-02-26,15:30,2026-02-27,08:59,2026-02-27,pre_close_cutoff,1,3,7,0,False,0,0,0,0,,,[],,,,mixed,buy,200,True,"HBM4E 기술 경쟁력 확보로 장기적 우위는 확인되었으나, 실물경제와의 괴리 우려로 단기 진입은 신중해야 한다. 오늘 시가 하락은 가치투자 관점에서 진입 조건을 검토해볼 만한 수준이다.","초기 중립적 관점에서, HBM 호재와 기관 매수세로 장기적 우위를 인정하게 되었으나, 실물경제 괴리 뉴스로 인해 단기 진입 타이밍에 신중함을 더했다.","어제 종가 하락으로 진입 장벽이 낮아졌고, HBM4E 기술 우위와 기관 매수세로 중장기 상승 추세가 유효하다고 판단됩니다. 가치투자 관점에서 안전마진이 충분하지는 않으나, 초기 진입 시점으로서 집중 투자 성향에 따라 허용 범위 내에서 상당 부분 매수합니다.","실물경제 괴리 우려로 인한 추가 조정 가능성에 대비해 현금 여력을 일부 유지하며, 단기 변동성 발생 시 손절 라인 설정을 고려합니다.",
simulation_20260706_223018,2026-02-27,1,am,A011,2026-02-27,2026-02-26,2026-02-26,15:30,2026-02-27,08:59,2026-02-27,pre_close_cutoff,1,3,7,0,False,0,0,0,0,,,[],,,,positive,buy,238,True,"HBM4E 기술 우위와 기관 자금 유입으로 삼성전자 매수 타이밍이 성숙했다. 단기 조정 후 상승 모멘텀이 강하며, 저평가 구간에서 집중 투자할 계획이다.","중립적 관점에서 적극적 매수 관점으로 전환했다. HBM4E 기술 호재와 국민연금의 매도 중단이 성장성을 확신하게 만들었으며, 주가 하락을 기회로 판단했다.","HBM4E 기술 우위와 엔비디아 공급망 확대에 따른 성장성 확신. 단기 조정 (-3.6%) 은 저평가 매수 기회로 판단하여, 고위험 고수익 성향에 따라 시스템 허용 최대 금액 (5000 만 원) 범위 내에서 집중 투자.",단일 종목 집중 투자 리스크를 고려하여 50% 비중으로 제한적 진입. 실물경제 리스크 모니터링 및 추후 추가 매수 여력 확보를 통해 손절 원칙 대비 방어.,
simulation_20260706_223018,2026-02-27,1,am,A012,2026-02-27,2026-02-26,2026-02-26,15:30,2026-02-27,08:59,2026-02-27,pre_close_cutoff,1,3,7,0,False,0,0,0,0,,,[],,,,positive,buy,238,True,"HBM4E 기술 우위와 기관 매수세로 상승 추세가 명확하다. 단기 하락은 매수 기회로 간주하며, 기술적 지지선 확인 시 매수 관점을 유지한다.",중립적 관점에서 기술적 지표와 호재 뉴스를 통해 매수 관점으로 전환했다. 단기 하락을 조정으로 해석하고 매수 타이밍을 탐색 중이다.,HBM4E 수주 및 기관 매수세 등 긍정적 호재와 MA5 지지선 확보로 매수 기회로 판단. 단기 조정 국면 (전일 대비 -3.7%) 이므로 손실 시 추가 매수 성향에 따라 진입합니다.,단일 종목 집중 리스크를 고려하여 현금 50% 를 유동성으로 확보. 추가 하락 시 평균 단가 하향 (Buy the Dip) 을 위한 여력 보유.,
simulation_20260706_223018,2026-02-27,1,am,A014,2026-02-27,2026-02-26,2026-02-26,15:30,2026-02-27,08:59,2026-02-27,pre_close_cutoff,1,3,7,0,False,0,0,0,0,,,[],,,,positive,buy,238,True,"반도체 업황과 기관 매수세로 상승 추세는 유효하나, 실물 경기 괴리 리스크를 인지하며 기술적 지지선에서 접근할 것.",중립적 관점에서 '상승 추세 유지'로 전환. 국민연금 뉴스와 기술적 지표 (MA5 상회) 가 매수 신호로 작용함.,"MA5(200,920 원) 상회로 기술적 지지선 확인 및 국민연금, 엔비디아 등 기관 매수세로 상승 추세 유지 판단. 부산에서 혼자 투자하며 삼성전자를 '안정적 자산'으로 믿어 초기 진입 시 집중 투자 성향을 반영하여 매수.","단일 종목 집중 리스크를 인지하여 현금 50% 한도 내에서 진입, 실물 경기 괴리 및 변동성 대비 여력 확보.",
simulation_20260706_223018,2026-02-27,1,am,A013,2026-02-27,2026-02-26,2026-02-26,15:30,2026-02-27,08:59,2026-02-27,pre_close_cutoff,1,3,7,0,False,0,0,0,0,,,[],,,,positive,buy,238,True,"HBM4E 수주와 국민연금 동향 등 호재가 명확하며, 기술적 추세와 맞물려 강세장이 예상됨.",중립적 관점에서 적극적 매수 관점으로 전환. 뉴스와 차트 신호가 일치하여 신뢰도 높음.,HBM4E 수주 및 엔비디아 공급 확정 등 호재와 기술적 돌파 신호 (21 만 원) 로 강세장 예상. 고위험 고수익 선호 성향과 손실 회복 욕구에 따라 시스템 허용 범위 내에서 최대 비중 (50%) 으로 집중 매수.,"시스템 제약 (단일 거래 50% 한도) 을 준수하여 현금 유동성 일부 확보. 과거 성과 부진으로 인한 과도한 집중 리스크를 인지하되, 모멘텀 추종 전략 우선.",
simulation_20260706_223018,2026-02-27,1,am,A009,2026-02-27,2026-02-26,2026-02-26,15:30,2026-02-27,08:59,2026-02-27,pre_close_cutoff,0,3,0,0,False,0,0,0,0,,,[],,,,mixed,buy,238,True,"HBM 호재와 기술적 지지선은 긍정적이지만, 경쟁사 우위 뉴스와 주가 괴리 우려로 단기 변동성 확대 예상. 기술적 돌파 신호 확인 전까지는 신중한 접근 필요.",초기 중립에서 '기술적 신호 우선' 관점으로 구체화. 뉴스의 부정적 요소 (경쟁사 비교) 에 민감해져서 판단을 더 유보함.,"MA5, MA20 위에 중기 상승 추세 유지 및 21 만원 지지선 방어 가능성 확인. 기술적 신호를 우선시하여 매수 진입.","포트폴리오 50% 이내로 단일 종목 집중 제한 준수, 21 만원 이탈 시 즉시 손절 원칙 적용.",
simulation_20260706_223018,2026-02-27,1,am,A016,2026-02-27,2026-02-26,2026-02-26,15:30,2026-02-27,08:59,2026-02-27,pre_close_cutoff,0,4,0,0,False,0,0,0,0,,,[],,,,mixed,buy,200,True,"국민연금의 안정적 매수 신호와 주가 하락을 저평가 기회로 보되, SK 하이닉스와의 기술 격차 확인 후 진입을 고려합니다.","초기 중립에서 하방 방어 요인 확인으로 저평가 관심으로 전환. 다만, 뉴스 깊이 부족으로 신중한 접근 유지.","내재가치 대비 저평가 구간 진입 및 국민연금 매수 신호로 하방이 제한적이라 판단되나, 기술 격차 우려와 뉴스 깊이 부족으로 신중한 접근을 위해 제한적 수량을 매수합니다.","최대 거래 비율 (50%) 이내에서 진입하여 현금 여력을 확보하고, 변동성 확대 시 추가 대응 능력을 유지합니다.",
simulation_20260706_223018,2026-02-27,1,am,A015,2026-02-27,2026-02-26,2026-02-26,15:30,2026-02-27,08:59,2026-02-27,pre_close_cutoff,2,4,7,10,False,0,0,0,0,,,[],"삼성전자 PER PBR 역사적 평균, 2026 년 반도체 수요 전망, 엔비디아 HBM4E 공급량, 한국은행 기준금리, 삼성전자 내재가치 평가, 외국인 순매수 동향, 삼성전자 배당 수익률",10,수정,mixed,buy,200,True,"HBM4E 기술 우위와 수급 호재로 장기 성장성은 긍정적이지만, 거시경제 리스크와 밸류에이션 부담으로 단기 진입은 신중해야 함.","'중립'에서 '신중한 매수 관점'으로 수정. 초기에는 기술 호재만 보았으나, 거시 리스크 (관세, GDP 괴리) 를 확인하여 진입 타이밍을 조정함.","HBM4E 수주 호재와 국민연금 지분 확대 등 장기 성장성은 긍정적이지만, 미·중 무역 리스크와 밸류에이션 부담으로 단기 진입은 신중해야 함. 210,000 원 MA5 지지선 부근에서 기술적 매수 기회로 판단하여, 현금 여력을 확보하기 위해 총 자산의 40% 수준으로 제한적으로 매수.","거시경제 리스크와 고 밸류에이션 조정 리스크에 대비하여 현금 보유 비율을 60% 이상 유지하며, 추가 하락 시 대응 여력을 확보합니다.",
simulation_20260706_223018,2026-02-27,1,am,A018,2026-02-27,2026-02-26,2026-02-26,15:30,2026-02-27,08:59,2026-02-27,pre_close_cutoff,0,3,0,0,False,0,0,0,0,,,[],,,,mixed,buy,238,True,"엔비디아 HBM7 호재와 기술적 상승 추세에 힘입어 매수 관점을 강화한다. 단기 조정 시 추가 매수 기회를 노리되, 경쟁사 비교에 따른 심리적 흔들림은 통제한다.",이전 중립적 관점에서 '상승 추세 확인'으로 변경. 엔비디아 관련 뉴스와 MA5 상회 등 기술적 지표가 매수 신호로 작용하여 관점이 전환됨.,"AI 수요와 HBM7 호재, 기술적 상승 추세 (MA5 상회) 에 따라 매수 관점 강화. 전일 대비 하락 (210,000 원) 을 매수 기회로 인식하고, 고위험 선호 성향에 따라 허용된 현금 비율 (50%) 범위 내에서 집중 매수.",현금 50% 를 유보하여 추가 하락 시 매수 여력 확보 (손실 시 추가 매수 성향 반영). SK 하이닉스 비교 뉴스 등 악재 발생 시 기술적 지표 재검토.,
simulation_20260706_223018,2026-02-27,1,am,A019,2026-02-27,2026-02-26,2026-02-26,15:30,2026-02-27,08:59,2026-02-27,pre_close_cutoff,1,3,7,0,False,0,0,0,0,,,[],,,,mixed,buy,120,True,"기술적 우위와 기관 매수세는 긍정적이지만, 실물경제 괴리와 현재 주가 수준을 고려해 신중한 접근이 필요하다는 관점.","초기 중립에서 기술 우위 확인으로 긍정적 관점으로 전환했으나, 실물경제 괴리 뉴스로 인해 가치평가 검증 필요성을 추가함.","HBM4E 기술 우위와 기관 매수세로 중기 상승 흐름이 유효하나, 현재 주가 (21 만 원) 가 내재가치 대비 높게 평가되어 밸류에이션 리스크가 존재함. 가치투자자로서 진입 타이밍 실수를 피하기 위해 전량 매수하지 않고 제한적으로 진입함.","현금의 25% 수준 (약 2,520 만 원) 으로 제한하여 진입, 향후 단기 조정 시 추가 매수 여력을 확보하고 단일 종목 집중 리스크를 관리함.",
simulation_20260706_223018,2026-02-27,1,am,A017,2026-02-27,2026-02-26,2026-02-26,15:30,2026-02-27,08:59,2026-02-27,pre_close_cutoff,2,4,7,10,False,0,0,0,0,,,[],"삼성전자 기술지표, HBM 수율, 기관 매수, 반도체 재고, AI 수요, 외국인 매수, 거시경제",10,강화,positive,buy,140,True,"AI 수요와 수급 안정으로 상승 모멘텀은 확실하나, 실물경제 괴리 우려와 기술적 확인이 필요해 신중한 매수 관점 유지.","'중립적 관점'에서 '상승 모멘텀 확인되나 기술적 진입 타이밍 대기'로 변경. 엔비디아 수급과 국민연금 지원으로 펀더멘털 확신, 매수 시점은 기술적 지표 확인 후 결정.","AI 수요와 수급 안정으로 상승 모멘텀이 있으나, 21 만원 저항선과 기술적 돌파 신호 미확인으로 인해 초기 진입 시 과도한 집중을 피하기 위해 제한적으로 매수합니다.","집중 투자 성향으로 리스크 관리가 중요하므로 현금 여력을 확보하고, MA5 부근 조정 시 추가 매수 기회를 노립니다.",
simulation_20260706_223018,2026-02-27,1,am,A021,2026-02-27,2026-02-26,2026-02-26,15:30,2026-02-27,08:59,2026-02-27,pre_close_cutoff,0,4,0,0,False,0,0,0,0,,,[],,,,mixed,buy,200,True,상승 추세는 유지되나 주가 괴리 우려로 신중한 접근 필요. 기술적 지지선 확인 후 매수 기회 탐색.,초기 중립에서 기술적 상승 신호와 뉴스의 괴리 우려를 모두 고려한 '신중한 낙관'으로 전환.,"기술적 지표상 MA5 상회로 상승 추세 유효하나, 뉴스상 주가 괴리 우려로 신중한 접근 필요. 현금의 50% 이내 (약 42%) 로 제한적 매수하여 진입.",단일 종목 과도한 집중 방지 및 현금 여력 확보를 통해 변동성 대비.,
simulation_20260706_223018,2026-02-27,1,am,A022,2026-02-27,2026-02-26,2026-02-26,15:30,2026-02-27,08:59,2026-02-27,pre_close_cutoff,1,3,7,0,False,0,0,0,0,,,[],,,,mixed,buy,238,True,"HBM4E 기술 우위와 기관 매수세는 장기적 강세 신호이나, 실물경제 괴리와 현재 주가 수준을 고려해 분할 매수 관점으로 접근.","중립적 관점에서 '기술적 우위 확인'과 '고평가 우려'를 동시에 인지하며, 진입 타이밍에 대한 판단을 구체화함.","21 만 원 선에서 전일 대비 하락하여 가치 투자 관점에서 매수 매력도가 상승했으나, 밸류에이션 과열 우려로 인해 최대 허용 범위인 50% 현금 비중으로 분할 매수합니다. HBM4E 수주 기대감과 반도체 사이클 회복을 장기적으로 신뢰하지만, 실물경제 괴리 리스크를 고려한 신중한 진입입니다.","초기 투자 단계이므로 과신하지 않고 현금 여력을 확보하여 추가 조정 시 대응합니다. 단일 종목 집중 성향이 있으나, 초기 진입 시 리스크 분산을 위해 50% 제한을 준수합니다.",
simulation_20260706_223018,2026-02-27,1,am,A020,2026-02-27,2026-02-26,2026-02-26,15:30,2026-02-27,08:59,2026-02-27,pre_close_cutoff,2,4,7,10,False,0,0,0,0,,,[],"삼성전자 외국인 수급, HBM4E 양산 일정, 삼성전자 기술적 분석, 반도체 재고 사이클, 미국 금리 전망, 삼성전자 주가 목표가, 실물경제와 증시 괴리",10,수정,mixed,buy,200,True,"HBM 호재와 기술적 상승 추세는 명확하나, 거시 리스크와 실물경제 괴리로 신중한 접근 필요. 기술적 지지 확인 후 진입 고려.",중립에서 기술적 상승 신호 확인으로 전환. 다만 거시 리스크로 인해 공격적 매수보다는 관망 또는 소량 진입 관점 유지.,"HBM4E 호재와 기관 수급으로 상승 모멘텀이 확인되나, 단기 과매수 및 거시 리스크 존재. 기술적 지지선 (MA5) 부근에서 소량 진입하여 추이 확인.","과거 투자 성과가 낮아 리스크 관리를 최우선으로 하며, 최대 매수 비율 제한을 준수하고 현금 여력을 유지합니다.",
simulation_20260706_223018,2026-02-27,1,am,A023,2026-02-27,2026-02-26,2026-02-26,15:30,2026-02-27,08:59,2026-02-27,pre_close_cutoff,0,3,0,0,False,0,0,0,0,,,[],,,,mixed,buy,238,True,HBM 성장성과 저평가 매력이 확인되어 매수 기회로 판단. 기관 안정화 신호로 리스크 관리하며 진입 준비.,중립에서 매수 관점으로 전환. 뉴스에서 확인된 저평가 구간과 기관 안정화 신호가 결정적 근거.,"HBM 호재와 저평가 구간 확인, 기관 매수 중단 신호로 매수 기회로 판단. 가치 투자 관점에서 내재가치 대비 매력적이나, 뉴스 의존성 리스크를 고려해 최대 허용 범위 내에서 진입.",단일 종목 집중 투자 리스크 관리 차원에서 현금의 50% 이내로 제한 매수. 추가 변동성 대비 현금 여력 확보.,
simulation_20260706_223018,2026-02-27,1,am,A026,2026-02-27,2026-02-26,2026-02-26,15:30,2026-02-27,08:59,2026-02-27,pre_close_cutoff,1,3,7,0,False,0,0,0,0,,,[],,,,positive,buy,238,True,"HBM 기술 우위와 기관 자금 유입으로 삼성전자의 내재가치가 재평가될 것으로 판단. 단기 조정 시 매수 기회로 보고, 장기 성장 동력을 믿고 접근한다.",중립적 관점에서 긍정적 매수 관점으로 전환. 국민연금의 매도 중단과 HBM 기술 경쟁력 확보가 핵심 근거로 작용하여 투자 확신도 상승.,"HBM 기술 우위와 내재가치 저평가 평가를 바탕으로 단기 조정 시 매수 기회로 판단. allowed_actions 에 buy 만 허용되어 있으며, 초기 진입 시 집중 투자 성향에 맞춰 최대 허용 범위 내에서 매수합니다.","거래 제약상 최대 50% 현금 비중으로 진입하여 리스크를 분산하고, 추후 추가 매수나 손절 시 현금 여력을 확보합니다.",
simulation_20260706_223018,2026-02-27,1,am,A029,2026-02-27,2026-02-26,2026-02-26,15:30,2026-02-27,08:59,2026-02-27,pre_close_cutoff,0,4,0,0,False,0,0,0,0,,,[],,,,mixed,buy,238,True,,,MA5/20 상향 정렬 및 전일 거래량 증가에 따른 조정 매수 기회로 판단. 고위험 고수익 성향에 따라 최대 허용 비중 (50%) 활용.,단일 종목 집중 리스크 관리 위해 50% 비중 제한 준수. 추가 하락 시 평균 매수 여력 확보 및 MA5 이탈 시 손절 라인 모니터링.,
simulation_20260706_223018,2026-02-27,1,am,A024,2026-02-27,2026-02-26,2026-02-26,15:30,2026-02-27,08:59,2026-02-27,pre_close_cutoff,0,5,0,0,False,0,0,0,0,,,[],,,,mixed,buy,238,True,HBM 호재와 기술적 상승 추세로 인해 중장기 우상향 관점 유지. 단기 변동성은 있으나 고위험 선호 성향에 맞춰 조정 시 매수 계획.,중립적 관점에서 기술적 지표 (MA5>MA20) 와 HBM 호재 뉴스를 통해 '신중한 매수' 관점으로 전환.,"HBM 수요 증가 및 반도체 사이클 회복 기대에 따른 21 만원대 조정 구간 매수 기회로 판단. 고위험 선호 성향에 따라 허용된 최대 50% 현금 비중 (약 5,000 만 원) 으로 진입하여 중장기 우상향 추세에 베팅함.","단일 종목 집중도 제한 (50% 이내) 을 준수하며, MA5(20 만 9 천 원) 하단 이탈 시 이성적 손절 원칙을 적용하여 리스크 관리.",
