run_id,date,turn,subturn,agent_id,decision_date,market_features_date,news_start_date,news_start_time,news_max_date,news_end_time,execution_date,information_mode,stock_code,direction,quantity,price,order_type,reason
simulation_20260702_175730,2026-02-27,1,am,A016,2026-02-27,2026-02-26,2026-02-26,15:30,2026-02-27,08:59,2026-02-27,pre_close_cutoff,005930,buy,120,211000.0,limit,"HBM 성장 기대와 국민연금 매수 신호 등 기관 매수세 유입을 긍정적으로 평가하여 초기 진입을 결정함. 전일 단기 조정 (-3.67%) 으로 인해 가치투자 관점에서 진입 기회가 열렸다고 판단. 다만, 주가 - 실물 괴리 우려와 밸류에이션 불확실성으로 인해 최대 매수 한도 (5,000 만 원) 의 절반 수준인 약 2,500 만 원 (120 주) 으로 분할 매수하여 진입함."
simulation_20260702_175730,2026-02-27,1,am,A036,2026-02-27,2026-02-26,2026-02-26,15:30,2026-02-27,08:59,2026-02-27,pre_close_cutoff,005930,buy,200,211000.0,limit,"가치투자 관점에서 현재 주가는 내재가치 대비 저평가 구간 (주가·실물 괴리) 으로 판단되며, 국민연금 등 기관의 매수 지지와 기술적 강세 (MA20 상회) 가 확인되었습니다. 포트폴리오가 전량 현금 상태이므로, 집중 투자 성향에 따라 진입이 필요합니다. 뉴스상 경쟁사 우려가 있으나 장기 성장 동력 (HBM, AI) 을 신뢰합니다."
simulation_20260702_175730,2026-02-27,1,am,A014,2026-02-27,2026-02-26,2026-02-26,15:30,2026-02-27,08:59,2026-02-27,pre_close_cutoff,005930,buy,190,211000.0,limit,"엔비디아 HBM4E 수주 및 국민연금 매수 유지 호재 확인 (핵심 뉴스 심층 검토). 기술적 지표 (MA5, MA20) 우상향 확인. 현금 100% 보유로 진입 가능. 단기 조정 (-3.67%) 이후 MA5 지지선 (200,920 원) 상회로 매수 신호."
simulation_20260702_175730,2026-02-27,1,am,A066,2026-02-27,2026-02-26,2026-02-26,15:30,2026-02-27,08:59,2026-02-27,pre_close_cutoff,005930,buy,1,210000.0,limit,
simulation_20260702_175730,2026-02-27,1,am,A037,2026-02-27,2026-02-26,2026-02-26,15:30,2026-02-27,08:59,2026-02-27,pre_close_cutoff,005930,buy,200,210000.0,limit,"1 개월 내 상승 추세는 유지되나 오늘 -3.67% 하락으로 단기 조정 가능성 존재. 기술적 지지선 (MA5) 부근까지 하락할 경우 더 좋은 진입이 가능하지만, 상승 모멘텀과 HBM 수주 등 호재로 인해 기회 놓칠까 봐 현재가 기준 진입을 결정함. 과거 손실 경험으로 고점 매수 두려움이 있으나, 제한된 현금으로 집중 투자 전략을 따름."
simulation_20260702_175730,2026-02-27,1,am,A075,2026-02-27,2026-02-26,2026-02-26,15:30,2026-02-27,08:59,2026-02-27,pre_close_cutoff,005930,buy,200,211000.0,limit,"단기 조정 (전일 대비 -3.67%) 으로 주가가 210,000 원 수준까지 하락했으나, 5 일 이동평균선 (200,920 원) 을 이탈하지 않아 중장기 상승 구조는 유지되고 있습니다. HBM 등 기술적 우위는 장기 성장 동력으로 작용할 가능성이 높으며, 현재 가격대는 가치 투자 관점에서 매수 기회로 판단됩니다. 다만, 밸류에이션 부담과 거시경제 리스크가 존재하므로 즉시 매수보다는 지정가 주문을 통해 진입 타이밍을 조절하고자 합니다. 보유 현금 1 억 원으로 진입 유연성이 확보되어 있어, 단일 종목 집중 투자 성향에 따라 삼성전자를 매수합니다."
simulation_20260702_175730,2026-02-27,1,am,A092,2026-02-27,2026-02-26,2026-02-26,15:30,2026-02-27,08:59,2026-02-27,pre_close_cutoff,005930,buy,230,211500.0,limit,"HBM4E 수급 호조와 국민연금 매도 중단 등 강력한 기관 매수세 뉴스 (뉴스), 주가가 MA5 및 MA20 위에 위치하며 기술적 돌파 신호가 확인됨 (시장 데이터), 현재 현금 100% 보유로 단일 종목 집중 투자 전략에 따라 진입 필요 (포트폴리오)."
simulation_20260702_175730,2026-02-27,1,am,A099,2026-02-27,2026-02-26,2026-02-26,15:30,2026-02-27,08:59,2026-02-27,pre_close_cutoff,005930,buy,220,212000.0,limit,국민연금의 매수 유지와 HBM4E 기술 호재 (뉴스) 로 저평가 구간 판단. 이동평균선 정배열 및 기관 매수세 (시장 데이터) 로 상승 모멘텀 우세. 현금 100% 보유 (포트폴리오) 로 진입 필요.
simulation_20260702_175730,2026-02-27,1,am,A009,2026-02-27,2026-02-26,2026-02-26,15:30,2026-02-27,08:59,2026-02-27,pre_close_cutoff,005930,buy,200,210500.0,limit,"현재 포트폴리오가 100% 현금 상태이므로 매수 진입이 필수적임. 기술적 분석상 MA5(200,920 원) 지지선이 유지되고 있으며, 현재가 21 만 원은 역사적 저평가 구간으로 판단됨. 비록 명확한 돌파 신호는 부족하나, 기관 매수세와 HBM 호재로 하방이 지지받을 것으로 예상되어 지지선 부근에서 진입을 결정함."
