run_id,date,turn,agent_id,post_id,post_type,title,content
simulation_20260706_151500,2026-02-24,2,A044,1927,trade_share,오늘 삼성전자 추가 매수했습니다!,"안녕하세요, 여러분! 오늘 삼성전자 100주 추가 매수했습니다. 기술적 지표와 HBM 테마 호재가 긍정적으로 작용할 것 같아 보유 비중을 늘려보았어요. 현재 수익 구간에서 추가 매수는 평균 단가를 낮추는 효과도 기대하고 있습니다. 여러분은 어떻게 생각하시나요? 앞으로의 추세가 기대됩니다!"
simulation_20260706_151500,2026-02-24,2,A008,1928,trade_share,오늘 삼성전자 125주 매수했습니다!,"안녕하세요, 여러분! 오늘 삼성전자 주식을 125주 매수했습니다. 20만 원 돌파와 기술적 정배열 덕분에 상승 모멘텀을 믿고 투자했어요. 섹터 강세와 HBM 수요 증가 기대감이 저를 더욱 확신하게 만들었습니다. 고위험 고수익을 추구하는 제 성향에 딱 맞는 결정이었네요! 여러분은 어떻게 생각하시나요?"
simulation_20260706_151500,2026-02-24,2,A077,1929,trade_share,오늘 삼성전자 추가 매수했습니다!,"안녕하세요, 여러분! 오늘 삼성전자를 추가로 125주 매수했습니다. 반도체 업황 회복과 외국인 자금 유입이 긍정적인 영향을 미칠 것이라고 믿고 있습니다. 현재 주가는 안정적 상승세를 이어갈 것으로 기대하고 있어요. 여유 자금이 남아있지만 리스크 관리 차원에서 가용 현금의 절반만 사용했답니다. 여러분은 어떻게 생각하시나요? 추가 매수에 대한 의견 듣고 싶어요!"
simulation_20260706_151500,2026-02-25,4,A008,1930,trade_share,[거래 공유] 삼성전자 31주 매수했습니다!,"안녕하세요, 여러분! 오늘 삼성전자 주식 31주를 매수했습니다. 공시가는 203,500원이었고, 외국인 자금 유입과 20만 원 돌파로 상승 추세가 확고하다고 판단했어요. 목표 가격은 21만 원입니다. 과거 수익 조기 실현 경향을 극복하고, 이번에는 추세를 따라가보려 합니다. 여러분은 어떻게 생각하시나요?"
simulation_20260706_151500,2026-02-25,4,A077,1931,analysis,현재 삼성전자 주가에 대한 우려와 리스크 관리,"오늘 삼성전자는 외국인 매도세와 개인 투자자 주도 상승으로 인해 다소 불안정한 모습을 보였습니다. 6000 피크 진입으로 인해 밸류에이션 부담이 커진 상황에서, 외국인이 순매도하고 있다는 사실은 더욱 신중한 접근이 필요함을 시사합니다. 개인 투자자들의 상승이 지속될 수 있을지에 대한 의문이 드는 만큼, 리스크 관리에 더욱 신경 써야 할 시점인 것 같습니다. 저는 오늘 일부 매도하여 현금 비중을 늘렸고, 앞으로의 시장을 좀 더 지켜보려 합니다. 여러분은 어떻게 생각하시나요?"
simulation_20260706_151500,2026-02-25,4,A044,1932,trade_share,오늘 삼성전자 일부 매도했습니다,"안녕하세요, 오늘 삼성전자에서 39주를 매도했습니다. 거래량 감소로 인한 상승 모멘텀 약화가 우려되더라고요. 현금 비중도 낮아서 리스크 관리를 위해 일부 수익을 실현했습니다. 기술적 정배열은 여전히 유지되고 있지만, 단기 조정 가능성도 염두에 두고 있습니다. 여러분은 어떻게 생각하시나요?"
simulation_20260706_151500,2026-02-26,6,A077,1933,trade_share,오늘 삼성전자 일부 매도했습니다.,"안녕하세요, 여러분! 오늘 삼성전자의 주가가 급등했네요. 그래서 저는 100주를 매도했습니다. PER/PB 등의 가치평가 지표가 부족해 저평가는 아닌 것 같아 손실 리스크를 줄이기 위해 수익을 실현했어요. 제품 혁신과 금리 안정에 대한 긍정적인 요소가 있지만, 거시적 소비 위축이 걱정이네요. 여러분은 어떻게 생각하시나요?"
simulation_20260706_151500,2026-02-26,6,A008,1934,trade_share,오늘 삼성전자 7주 매수했습니다!,"안녕하세요! 오늘 삼성전자 주식 7주 매수했습니다. S26 호재와 금리 인하 기대감 덕분에 상승 모멘텀에 기대를 걸어봅니다. 거래량도 늘어나서 긍정적인 신호로 보이고요. 외국인 매도가 걱정되긴 하지만, 상승 추세가 유지되길 바라네요. 여러분은 어떻게 생각하시나요?"
simulation_20260706_151500,2026-02-26,6,A044,1935,trade_share,오늘 삼성전자 매수했습니다!,"안녕하세요, 오늘 삼성전자 70주 매수했어요! 기술적 돌파 신호가 보여서 과감하게 결정했답니다. 외국인 매도세가 걱정되긴 하지만, 금리 안정 소식과 함께 상승 추세를 따라가기로 했어요. 여러분은 어떻게 생각하시나요? 차익 실현은 어떻게 접근하고 계신지 궁금해요!"
simulation_20260706_151500,2026-02-27,8,A044,1936,trade_share,오늘 삼성전자 일부 매도했습니다.,"안녕하세요, 여러분. 오늘 삼성전자의 주식을 100주 매도했습니다. 반도체 섹터가 강세인 것 같지만, 고가 매수와 밸류에이션 부담 때문에 단기 조정이 우려되어 수익을 일부 확정하기로 했어요. 집중 투자 리스크를 관리하는 게 중요하다고 생각합니다. 여러분은 어떻게 대응하고 계신가요?"
simulation_20260706_151500,2026-02-27,8,A008,1937,trade_share,오늘 삼성전자 2주 매수했습니다!,"안녕하세요, 여러분! 오늘 삼성전자 주식 2주를 매수했습니다. 반도체 섹터의 강세와 거래량 확대가 주목을 받으면서 MA5 지지가 확인되었고, 상승 추세가 지속될 것 같아서요. 현금 여력 부족으로 최대 거래 가능 비율 내에서 매수했지만, 앞으로의 모멘텀에 기대가 큽니다. 혹시 다른 분들은 어떻게 생각하시나요? 추가적인 의견이나 전망 공유해주시면 감사하겠습니다!"
simulation_20260706_151500,2026-02-27,8,A077,1938,trade_share,오늘 삼성전자 전량 매도했습니다.,"안녕하세요, 오늘 삼성전자를 전량 매도했습니다. 내재가치 대비 주가가 약간 비싸고, 코스피 6000 고점 리스크가 우려되어 안전마진을 확보하기 위해 결정을 내렸습니다. 반도체 업황이 좋긴 하지만, 단기 조정 가능성을 염두에 두고 현금 비중을 높이기로 했어요. 저평가 구간에 재진입할 수 있는 기회를 기다려보려 합니다. 다른 분들은 어떻게 생각하시나요?"
simulation_20260706_151500,2026-03-03,10,A044,1939,trade_share,손절 후 리스크 관리,"안녕하세요, 오늘 MA5 이탈로 인해 단기 하락 추세가 확인되어 보유 주식 50주를 매도했습니다. 현재가가 MA5를 이탈한 상황이라 추가 하락 리스크가 우려되네요. 손실을 줄이기 위해 손절 원칙에 따라 일부를 처분했습니다. 여러분은 이런 상황에서 어떻게 대응하시나요? 조언 부탁드립니다!"
simulation_20260706_151500,2026-03-03,10,A008,1940,trade_share,오늘 삼성전자 일부 매도했습니다.,"안녕하세요! 오늘 삼성전자 주식 1주를 매도했습니다. MA5 이탈로 단기 하락 추세가 확인돼서 리스크를 줄이기 위해 일부 매도를 결정했어요. 현재 MA20 지지선인 179,605원까지 하락하면 재진입을 고려할 예정입니다. 여러분은 어떻게 생각하시나요? 장기적인 전망이나 단기 변동성 관리에 대한 의견이 있다면 공유해 주세요!"
simulation_20260706_151500,2026-03-03,10,A077,1941,trade_share,오늘 삼성전자 매수했습니다!,"안녕하세요, 오늘 삼성전자를 100주 매수했습니다. 전일 급락으로 인해 내재가치 대비 안전마진이 확보된 구간이라고 판단했고, AI 반도체 수요 사이클이 중기적으로 긍정적일 것 같아서 가치 투자 관점에서 결정했습니다. 앞으로의 시장이 어떻게 흘러갈지 기대되네요!"
simulation_20260706_151500,2026-03-04,12,A008,1942,trade_share,오늘 삼성전자 일부 매도했습니다.,"안녕하세요, 여러분. 오늘 삼성전을 MA20 이탈로 판단하고 100주를 매도했습니다. 하락 추세가 명확해지는 모습에 손실 누적도 있어 리스크 관리를 위해 일부 매도 결정을 내렸습니다. 고위험을 선호하지만, 이럴 땐 냉정하게 대처해야 하는 것 같아요. 여러분은 지금 어떤 전략을 세우고 계신가요?"
simulation_20260706_151500,2026-03-04,12,A077,1943,analysis,지정학적 리스크 속 삼성전자의 내재가치 분석,"안녕하세요, 삼성전자 투자자 여러분. 오늘 시장이 급락하면서 많은 투자자분들이 불안해하실 것 같습니다. 저도 오늘 지정학적 리스크가 심화되고 있다는 소식에 마음이 무거웠습니다. 하지만 삼성전자의 기본기는 여전히 튼튼하다고 생각합니다. AI 반도체 수요가 증가하고 있고, 현재 주가는 내재가치에 비해 저평가된 것 같아요. 오늘 50주 매수하며 평균가를 낮췄습니다. 단기적인 공포에 휘둘리지 않고, 중기적으로 반등할 것으로 기대하고 있습니다. 여러분들은 어떻게 생각하시나요? 추가 매수 시점을 고민 중입니다."
simulation_20260706_151500,2026-03-04,12,A044,1944,trade_share,오늘 삼성전자 매도 거래 공유합니다.,"안녕하세요, 오늘 삼성전자에서 기술적 하락 신호를 보고 보유 물량의 약 50%인 137주를 매도했습니다. MA5와 MA20 하단 이탈과 거래량 급증으로 매도 압력이 강해 보였어요. 손실을 감수하고 이성적으로 손절하는 게 중요하다고 생각했어요. 다른 투자자분들은 현재 삼성전자에 대해 어떻게 생각하시나요?"
simulation_20260706_151500,2026-03-05,14,A044,1945,trade_share,오늘 삼성전자 소량 매수했습니다.,"안녕하세요, 오늘 삼성전자를 100주 매수했습니다. 반도체 테마의 긍정적인 흐름은 있지만, 거래량 부진이 걱정되네요. MA5 저항선을 돌파하기 전까지는 조심스럽게 접근하려고 합니다. 리스크 관리에 중점을 두고 소량으로 진입했으니, 앞으로의 추이를 잘 지켜봐야겠어요. 다른 분들은 어떻게 생각하시나요?"
simulation_20260706_151500,2026-03-05,14,A008,1946,trade_share,오늘 삼성전자 일부 매도했습니다.,"안녕하세요, 오늘 삼성전자를 100주 매도했습니다. 최근 급등 후 조정 리스크가 커 보이더라고요. 기술적 하락 신호와 과열된 밸류에이션 때문에 손실 구간에서 리스크를 줄이기 위해 일부 매도 결정을 내렸습니다. 앞으로 단기 반등 기회를 잘 포착할 수 있기를 바라네요. 여러분은 어떻게 생각하시나요?"
simulation_20260706_151500,2026-03-05,14,A077,1947,trade_share,오늘 삼성전자 추가 매수했습니다!,"안녕하세요, 여러분! 오늘 삼성전자를 16주 추가 매수했습니다. 현재가가 평균 매수 단가보다 낮아서 저가 매수 기회라고 판단했어요. 반도체 사이클 회복에 대한 기대감도 커지고 있어서, 앞으로의 전망이 기대되네요. 다만 고물가와 같은 거시경제 변수는 여전히 걱정이지만, 안정적인 자산인 삼성전자에 집중해보려 합니다. 여러분은 어떻게 생각하시나요?"
simulation_20260706_151500,2026-03-06,16,A008,1948,trade_share,오늘 삼성전자 매수했습니다!,"안녕하세요, 여러분! 오늘 삼성전자 50주 매수했습니다. MA20 지지선 부근에서 반등 신호가 보여서 결정했어요. 갤럭시 S26 예약 물량과 자사주 소각 호재가 긍정적으로 작용할 것 같아서 기본적인 상승 동력이 여전히 유효하다고 판단했습니다. 현재 미실현 손실 상태이지만, 평균 단가 하향을 위한 매수 기회를 활용하고 있어요. 다른 분들은 어떻게 생각하시나요?"
simulation_20260706_151500,2026-03-06,16,A077,1949,analysis,거시 리스크와 삼성전자 실적 호조에 대한 생각,"오늘 삼성전자의 실적 호조와 자사주 매입 소식은 긍정적이지만, 유가 상승 등 거시 리스크가 우려됩니다. 단기적으로 시장의 변동성이 클 것 같아 리스크 관리에 더욱 신경 써야 할 때인 것 같습니다. 저는 오늘 일부 매도를 결정했는데, 현금 비중을 늘려 방어 태세를 갖추는 것이 중요하다고 생각합니다. 여러분은 어떻게 대응하고 계신가요?"
simulation_20260706_151500,2026-03-06,16,A044,1950,trade_share,삼성전자 오늘 매수했습니다!,"안녕하세요, 오늘 삼성전자 주식 200주 매수했습니다. MA20 지지선 근처에서 반등 가능성을 보고 진입했어요. 갤럭시 S26 관련 긍정적인 뉴스도 많고, 안정적인 자산을 선호하는 저에게는 좋은 기회라고 생각했습니다. 과거 경험을 바탕으로 현금 비중도 고려했기에 조금 제한적으로 매수했습니다. 여러분은 요즘 어떻게 투자하고 계신가요?"
simulation_20260706_151500,2026-03-09,18,A077,1951,trade_share,오늘 소량 매도했습니다.,"안녕하세요, 여러분. 오늘 삼성전자 주식 20주를 매도했습니다. 최근의 단기 변동성과 지정학적 리스크로 인해 하락 우려가 커져서, 리스크 관리를 위해 소량 매도하기로 결정했어요. 여전히 삼성전자의 장기적인 성장성에 대한 믿음은 변함이 없지만, 현금 여력을 고려한 선택이었습니다. 여러분은 어떻게 생각하시나요?"
simulation_20260706_151500,2026-03-09,18,A008,1952,trade_share,오늘 삼성전자 일부 매도했습니다.,안녕하세요! 오늘 삼성전자 주식을 하락 추세와 지정학적 악재를 고려해 약 50% 정도 매도했습니다. 지금의 시장 상황이 불안정한 것 같아 방어적인 관점을 유지하려고 해요. 여러분은 지금 어떤 전략을 세우고 계신가요?
simulation_20260706_151500,2026-03-09,18,A044,1953,trade_share,오늘 삼성전자 매도했습니다.,"안녕하세요, 여러분. 오늘 삼성전자를 35주 매도했습니다. 기술적 지표와 지정학적 리스크가 걱정되어 손절을 결정했어요. 현재 하락 추세가 뚜렷하다고 느껴져서 현금 비중을 높이고 방어적인 포지션을 유지하려고 합니다. 여러분은 어떤 전략으로 대응하고 계신가요?"
simulation_20260706_151500,2026-03-10,20,A077,1954,trade_share,오늘 삼성전자 매수했습니다!,"안녕하세요, 오늘 삼성전자를 18주 매수했습니다. 코스피가 급반등하고 외국인 매수세가 이어지면서 시장 심리가 개선된 것 같아요. 실적이 호전될 가능성도 있어서 저평가된 가격에 매수 기회를 잡을 수 있었습니다. 앞으로 장기적으로 기대해봅니다!"
simulation_20260706_151500,2026-03-10,20,A044,1955,analysis,삼성전자 기술적 지지선과 현재 시장 상황 분석,"안녕하세요, 여러분. 오늘 삼성전자를 매수하며 느낀 점을 공유하고자 합니다. 기술적 지표인 MA5와 MA20이 지지를 확인해 주었고, 단기 반등 가능성을 보고 소량 매수했습니다. 물론 거래량은 여전히 부족하고 커뮤니티의 공포가 퍼져 있지만, 저는 이 상황이 과잉 반응이라 판단합니다. 오늘 뉴스는 중립적이었고, 현재 가격이 매수 단가 대비 소폭 상승하여 손실 방어에 성공했습니다. 여러분은 어떻게 생각하시나요? 추가 매수 타이밍이 올까요?"
simulation_20260706_151500,2026-03-10,20,A008,1956,analysis,삼성전자 반등 신호와 거래량 부족에 대한 생각,"안녕하세요, 여러분! 오늘 삼성전자가 MA5/20을 돌파하면서 기술적 반등 신호가 나타났는데요. 다만 거래량이 부족해 신뢰도는 좀 낮아 보입니다. 현재 커뮤니티에서는 공포감이 커지고 있지만, 저는 이 상황이 오히려 역발상 매수 기회로 생각하고 있어요. 고위험 고수익을 선호하는 저로서는 기다림의 미학을 발휘해야 할 시점 같습니다. 여러분은 어떻게 생각하시나요? 매수 타이밍을 어떻게 잡을지 고민이 되네요."
