run_id,date,turn,subturn,agent_id,decision_date,market_features_date,news_start_date,news_start_time,news_max_date,news_end_time,execution_date,information_mode,news_depth,selected_news_count,read_news_count,search_read_count,depth2_search_keywords,depth2_search_result_count,depth2_view_change,news_sentiment,action,quantity,submitted_order,belief_summary,view_change,decision_reason,risk_control,order_corrections
simulation_20260703_212933,2026-02-27,1,am,A078,2026-02-27,2026-02-26,2026-02-26,15:30,2026-02-27,08:59,2026-02-27,pre_close_cutoff,1,3,7,0,,,,positive,buy,238,True,"삼성전자는 긍정적인 기술 경쟁력과 국민연금의 투자 증가로 인해 향후 상승할 가능성이 높습니다. 현재 주가는 적정하다고 판단하며, 시장 심리는 긍정적입니다.","기존 Belief에서 긍정적인 기술 경쟁력과 국민연금의 투자 증가로 인해 주가 상승 가능성을 높게 평가하게 되었습니다. 실물 경제와 주가 간 괴리 문제는 여전히 우려스럽지만, 전반적인 투자 심리는 긍정적으로 변화했습니다.",삼성전자의 긍정적인 기술 경쟁력과 국민연금의 투자 증가로 인해 주가 상승 가능성이 높다고 판단하여 매수합니다.,현금 여력을 남기고 단일 종목에 대한 과도한 집중을 피하기 위해 최대 매수 수량의 절반인 238주를 매수합니다.,
simulation_20260703_212933,2026-02-27,1,am,A012,2026-02-27,2026-02-26,2026-02-26,15:30,2026-02-27,08:59,2026-02-27,pre_close_cutoff,1,3,7,0,,,,positive,buy,476,True,삼성전자의 기술 경쟁력 강화와 국민연금의 주식 비중 증가로 긍정적인 시장 전망을 가지고 있습니다. 그러나 실물 경기와 주가 간 괴리 문제는 여전히 주의해야 할 요소입니다.,"기존 Belief에서 긍정적인 뉴스가 추가되어 삼성전자의 향후 주가 상승 가능성에 대한 전망이 강화되었습니다. 실물 경기와 주가 간 괴리 문제는 여전히 우려스럽지만, 전반적인 투자 심리는 긍정적으로 변화했습니다.",삼성전자의 기술 경쟁력 강화와 긍정적인 시장 전망을 바탕으로 현재 주가가 상승세를 보일 것으로 예상되므로 전량 매수합니다.,"실물 경기와 주가 간 괴리 문제를 염두에 두고, 매수 후 시장 상황을 지속적으로 모니터링합니다.",
simulation_20260703_212933,2026-02-27,1,am,A086,2026-02-27,2026-02-26,2026-02-26,15:30,2026-02-27,08:59,2026-02-27,pre_close_cutoff,1,4,7,0,,,,positive,buy,476,True,삼성전자의 기술 경쟁력과 국민연금의 주식 비중 증가로 인해 긍정적인 전망을 가지고 있습니다. 하지만 실물 경제와 주가 간 괴리 문제는 여전히 주의가 필요합니다.,기존 Belief에서 긍정적인 요소가 많아 주가 상승 전망이 강화되었습니다. 그러나 실물 경제와 주가 간 괴리 문제에 대한 우려가 여전히 존재합니다.,"삼성전자의 기술 경쟁력 강화와 긍정적인 시장 심리를 바탕으로 주가 상승이 예상되므로, 현재 보유 현금을 활용해 최대한 매수합니다.","주가 상승세에 따른 추격 매수 리스크를 감안하여, 매수 후에도 여유 자금을 남겨두어 변동성에 대비합니다.",
simulation_20260703_212933,2026-02-27,1,am,A008,2026-02-27,2026-02-26,2026-02-26,15:30,2026-02-27,08:59,2026-02-27,pre_close_cutoff,1,3,7,0,,,,positive,buy,476,True,"삼성전자는 긍정적인 기술 경쟁력과 국민연금의 주식 비중 증가로 인해 향후 상승세가 예상됩니다. 현재 주가는 적정하다고 판단하며, 시장 심리는 긍정적입니다.","기존 Belief에서 긍정적인 기술 경쟁력과 국민연금의 주식 비중 증가가 확인되었으며, 이는 주가 상승 전망을 강화하는 요소로 작용했습니다.","삼성전자의 긍정적인 기술 경쟁력과 국민연금의 주식 비중 증가로 인해 향후 상승세가 예상되며, 현재 주가는 적정하다고 판단합니다.","전체 현금의 50%를 사용하여 매수하므로, 포트폴리오 리스크를 분산하고 단기 변동성에 대비합니다.",
simulation_20260703_212933,2026-02-27,1,am,A033,2026-02-27,2026-02-26,2026-02-26,15:30,2026-02-27,08:59,2026-02-27,pre_close_cutoff,1,4,7,0,,,,positive,buy,476,True,삼성전자의 기술 경쟁력과 국민연금의 주식 비중 증가로 인해 긍정적인 전망을 가지고 있습니다. 그러나 실물 경제와 주가 간 괴리 문제는 여전히 주의가 필요합니다.,"기존 Belief에서 긍정적인 요소가 확인되었으나, 실물 경제와 주가 간 괴리 문제에 대한 우려가 추가되었습니다.","삼성전자의 기술 경쟁력 강화와 반도체 시장 호조로 인해 긍정적인 전망을 가지고 있으며, 현재 주가는 적정하다고 판단됩니다.","실물 경제와 주가 간 괴리 문제를 인지하고 있으나, 매수 후에도 현금 여력을 남겨두어 리스크를 관리합니다.",
simulation_20260703_212933,2026-02-27,1,am,A047,2026-02-27,2026-02-26,2026-02-26,15:30,2026-02-27,08:59,2026-02-27,pre_close_cutoff,0,3,0,0,,,,positive,buy,200,True,"삼성전자의 기술력과 성장 전망이 긍정적이지만, 경쟁사와의 비교에서 우려가 남아 있습니다. 안정적인 투자 환경 속에서 주가는 상승할 것으로 보입니다.","기존 Belief에서 삼성전자의 기술 경쟁력과 성장 전망이 긍정적이라는 점이 확인되었으나, SK하이닉스와의 비교에서 우려가 추가되었습니다.","삼성전자의 기술 경쟁력과 긍정적인 성장 전망이 주가에 긍정적인 영향을 미칠 것으로 예상되며, 현재 주가가 적정하다고 판단하여 매수합니다.","주가 상승세를 고려하되, SK하이닉스와의 비교 우려를 감안하여 매수 수량을 조절합니다.",
simulation_20260703_212933,2026-02-27,1,am,A040,2026-02-27,2026-02-26,2026-02-26,15:30,2026-02-27,08:59,2026-02-27,pre_close_cutoff,1,4,7,0,,,,positive,buy,238,True,삼성전자는 기술 경쟁력과 긍정적인 시장 반응으로 인해 향후 상승세가 예상됩니다. 그러나 실물 경제와 주가 간의 괴리 문제는 여전히 주의가 필요합니다.,"기존의 중립적 관점에서 긍정적인 신호가 확인되었고, 기술적 우위와 국민연금의 주식 비중 증가로 인해 주가 상승 전망이 강화되었습니다.",삼성전자의 기술 경쟁력 강화와 긍정적인 시장 심리를 바탕으로 상승세가 예상되므로 매수합니다.,주가 조정 가능성을 고려하여 전체 현금의 50% 이하로 매수합니다.,
simulation_20260703_212933,2026-02-27,1,am,A022,2026-02-27,2026-02-26,2026-02-26,15:30,2026-02-27,08:59,2026-02-27,pre_close_cutoff,1,3,7,0,,,,positive,buy,200,True,오늘의 정보에 따르면 삼성전자는 긍정적인 기술 경쟁력과 국민연금의 주식 비중 증가로 인해 향후 주가 상승이 기대됩니다. 그러나 실물 경제와의 괴리 문제는 여전히 주의가 필요합니다.,"이전 Belief에서 긍정적인 뉴스가 확인되었고, 삼성전자의 기술 경쟁력 강화가 주가에 긍정적인 영향을 미칠 것이라는 점에서 관점이 강화되었습니다. 그러나 실물 경제와의 괴리 문제에 대한 우려는 여전히 유지됩니다.",국민연금의 주식 비중 증가와 반도체 시장의 긍정적인 전망을 반영하여 삼성전자의 주가 상승이 기대되므로 매수합니다.,실물 경제와의 괴리 문제를 고려하여 매수 후에도 현금을 일부 남겨두어 리스크를 관리합니다.,
simulation_20260703_212933,2026-02-27,1,am,A011,2026-02-27,2026-02-26,2026-02-26,15:30,2026-02-27,08:59,2026-02-27,pre_close_cutoff,1,4,7,0,,,,positive,buy,238,True,"삼성전자의 기술 경쟁력과 긍정적인 시장 심리로 인해 주가 상승이 예상됩니다. 현재 주가는 적정하다고 판단하며, 반도체 업황의 호조가 지속될 것으로 보입니다.","기존 Belief에서 긍정적인 기술 경쟁력과 국민연금의 주식 비중 증가가 추가되어, 향후 주가 상승에 대한 확신이 강화되었습니다.","삼성전자의 기술 경쟁력과 긍정적인 시장 심리를 반영하여 주가 상승이 예상되므로, 현재 적정 가격에서 매수합니다.",현금 여력을 남기고 단일 종목에 대한 집중을 피하기 위해 최대 매수 수량의 절반인 238주를 매수합니다.,
simulation_20260703_212933,2026-02-27,1,am,A007,2026-02-27,2026-02-26,2026-02-26,15:30,2026-02-27,08:59,2026-02-27,pre_close_cutoff,2,4,7,10,"반도체 시장 전망, HBM 기술 동향, 국민연금 투자 전략, 실물 경제 성장률, 삼성전자 경쟁사 동향, AI 수요 증가, 글로벌 반도체 수급",10,강화,positive,buy,238,True,"삼성전자의 HBM 기술 경쟁력과 반도체 시장의 성장 가능성이 더욱 확고해졌으며, 국민연금의 투자 전략 변화가 긍정적인 영향을 미칠 것으로 보인다. 그러나 실물 경제와 주가 간의 괴리 문제는 여전히 우려스럽다.",기존의 중립적 관점에서 긍정적으로 변화하였다. HBM 기술 경쟁력과 국민연금의 투자 전략 변화가 주가에 긍정적인 영향을 미칠 것이라는 확신이 생겼다.,"삼성전자의 HBM 기술 경쟁력과 반도체 시장의 성장 가능성이 긍정적이며, 현재 주가가 적정하다고 판단되므로 매수합니다.","단기 하락세를 고려하여 매수 수량을 조절하고, 실물 경제와 주가 간의 괴리 문제를 주의합니다.",
simulation_20260703_212933,2026-02-27,2,pm,A047,2026-02-27,2026-02-27,2026-02-27,08:59,2026-02-27,15:30,2026-02-27,pre_close_cutoff,0,2,0,0,,,,positive,buy,100,True,"삼성전자는 반도체 업황의 긍정적인 흐름에 힘입어 향후 상승할 것으로 보이며, 현재 주가는 적정하다고 판단합니다. 시장 심리는 긍정적이며, 투자자들의 기대감이 높아지고 있습니다.","기존 Belief와 비교했을 때, 반도체 업황의 긍정적인 뉴스가 더 확실하게 확인되었고, 이에 따라 주가 상승에 대한 기대감이 강화되었습니다.","반도체 업황의 긍정적인 흐름과 현재 주가가 적정하다고 판단하여 추가 매수를 결정했습니다. 현재 보유 현금이 충분하고, 주가 상승세가 지속될 것으로 예상됩니다.","매수 후에도 현금 여력을 남겨두어 유동성 문제를 방지하고, 특정 종목에 대한 집중을 관리합니다.",
simulation_20260703_212933,2026-02-27,2,pm,A022,2026-02-27,2026-02-27,2026-02-27,08:59,2026-02-27,15:30,2026-02-27,pre_close_cutoff,1,2,2,0,,,,positive,buy,100,True,"오늘의 긍정적인 뉴스와 시장 심리를 반영하여, 삼성전자의 주가는 향후 상승할 것으로 기대된다. 현재 주가는 적정하며, 반도체 업황의 회복세가 긍정적인 영향을 미칠 것이다.","기존 Belief와 비교할 때, 반도체 업황의 긍정적인 흐름이 더욱 확고해졌고, 중견기업 수출 증가가 삼성전자의 성장 가능성을 높여줄 것이라는 점에서 기대감이 커졌다.",반도체 업황의 긍정적인 흐름과 현재 주가가 평균 매수 단가와 비슷하여 추가 매수 기회로 판단했습니다.,"현금 여력을 남기고, 특정 종목에 대한 집중 투자를 피하기 위해 매수 수량을 조절합니다.",
simulation_20260703_212933,2026-02-27,2,pm,A040,2026-02-27,2026-02-27,2026-02-27,08:59,2026-02-27,15:30,2026-02-27,pre_close_cutoff,1,2,2,0,,,,positive,buy,231,True,"반도체 업황의 긍정적인 흐름과 시장 심리 개선으로 삼성전자의 주가는 상승할 것으로 보입니다. 현재 주가는 적정하며, 향후 실적 개선이 기대됩니다.","기존 Belief에서 반도체 업황의 긍정적인 변화가 확인되었고, 이에 따라 삼성전자의 주가 상승 가능성에 대한 확신이 더욱 강화되었습니다.",반도체 업황의 긍정적인 흐름과 시장 심리 개선으로 삼성전자의 주가 상승 가능성이 높아 추가 매수를 결정했습니다.,"현재 보유 현금의 50%를 사용하여 리스크를 분산하고, 주가 상승세에 따른 추격 매수 리스크를 관리합니다.",
simulation_20260703_212933,2026-02-27,2,pm,A078,2026-02-27,2026-02-27,2026-02-27,08:59,2026-02-27,15:30,2026-02-27,pre_close_cutoff,1,2,2,0,,,,positive,buy,231,True,"반도체 업종의 강세와 긍정적인 경제 지표로 인해 삼성전자의 주가는 상승할 것으로 예상합니다. 현재 주가는 적정하며, 시장 심리는 긍정적입니다.","유지. 반도체 업황의 긍정적인 변화가 기존 관점을 더욱 확고히 해주었으며, 추가적인 의문이나 변화는 없었습니다.","반도체 업종의 긍정적인 전망과 현재 주가가 적정하다고 판단되며, 현금 비중이 높아 추가 매수를 통해 포트폴리오를 강화할 기회로 보고 있습니다.","매수 후에도 현금 여력을 남겨두고, 단일 종목에 대한 과도한 집중을 피하기 위해 분산 투자를 고려합니다.",
simulation_20260703_212933,2026-02-27,2,pm,A086,2026-02-27,2026-02-27,2026-02-27,08:59,2026-02-27,15:30,2026-02-27,pre_close_cutoff,1,2,2,0,,,,positive,sell,476,True,"삼성전자는 반도체 업황 호조로 인해 긍정적인 전망을 가지고 있으며, 현재 주가는 적정하다고 판단합니다. 시장 심리도 긍정적이어서 상승세가 지속될 것으로 기대합니다.","기존 Belief와 비교할 때, 반도체 업종의 강세가 더욱 확고해졌다는 점에서 긍정적인 변화가 있었습니다. 실적 개선 기대감이 강화되었습니다.","현재 주가가 상승세를 보이고 있으며, 반도체 업종의 긍정적인 전망에 따라 실적 개선 기대감이 높아졌습니다. 보유 주식을 전량 매도하여 수익을 실현합니다.","전체 포트폴리오의 리스크를 분산하기 위해 현금 비중을 높이고, 특정 종목에 대한 집중 투자를 줄입니다.",
simulation_20260703_212933,2026-02-27,2,pm,A008,2026-02-27,2026-02-27,2026-02-27,08:59,2026-02-27,15:30,2026-02-27,pre_close_cutoff,1,2,2,0,,,,positive,sell,476,True,"반도체 업종의 강세와 긍정적인 시장 심리로 인해 삼성전자의 주가는 상승할 것으로 예상합니다. 현재 주가는 적정하며, 긍정적인 거시경제 환경이 뒷받침되고 있습니다.","기존 Belief와 비교했을 때, 반도체 업종의 강세와 코스피 상승에 대한 긍정적인 신호가 확인되어 향후 주가 상승 전망이 더욱 확고해졌습니다.","현재 주가가 평균 매수 단가보다 높아 손실을 피할 수 있는 상황이며, 반도체 업종의 강세와 긍정적인 시장 심리를 고려해 매도 결정을 내립니다.",전체 포트폴리오의 리스크를 줄이기 위해 보유 주식을 전량 매도하여 현금 비중을 높입니다.,
simulation_20260703_212933,2026-02-27,2,pm,A033,2026-02-27,2026-02-27,2026-02-27,08:59,2026-02-27,15:30,2026-02-27,pre_close_cutoff,1,2,2,0,,,,positive,sell,476,True,"반도체 업황의 긍정적인 흐름과 시장 심리를 반영하여, 삼성전자의 주가는 상승할 것으로 예상합니다. 현재 주가는 적정하며, 앞으로의 성장 가능성에 기대를 걸고 있습니다.","기존 Belief에서 반도체 업황의 긍정적인 흐름이 확인되었고, 이에 따라 삼성전자의 주가 상승 가능성에 대한 기대감이 커졌습니다.","현재 주가가 상승세에 있으며, 보유 주식의 평균 매수 단가와 비슷하여 안정적인 손익 상태를 유지하고 있습니다. 시장의 긍정적인 흐름을 반영하여 전체 포트폴리오 리스크를 줄이기 위해 매도 결정을 내립니다.","모든 보유 주식을 매도하여 현금 비중을 높이고, 향후 추가 매수 기회를 확보합니다.",
simulation_20260703_212933,2026-02-27,2,pm,A012,2026-02-27,2026-02-27,2026-02-27,08:59,2026-02-27,15:30,2026-02-27,pre_close_cutoff,1,2,2,0,,,,positive,sell,476,True,"반도체 업종의 강세와 긍정적인 시장 심리를 바탕으로 삼성전자의 주가는 상승할 것으로 예상합니다. 현재 주가는 적정하다고 판단하며, 실적 개선 기대감이 큽니다.",이전 Belief와 비교해 반도체 업종의 강세가 지속되고 있다는 점이 확인되어 긍정적인 전망이 강화되었습니다. 실물 경기와 주가 간 괴리 문제에 대한 경계는 여전히 유지됩니다.,"현재 주가가 상승세를 보이고 있으며, 보유 주식의 평균 매수 단가와 동일하여 손실 없이 전량 매도합니다.","모든 보유 주식을 매도하여 현금을 확보하고, 향후 가격 조정 시 재매수 기회를 고려합니다.",
