run_id,date,turn,subturn,agent_id,decision_date,market_features_date,news_start_date,news_start_time,news_max_date,news_end_time,execution_date,information_mode,news_depth,selected_news_count,read_news_count,search_read_count,fake_exposed,fake_base_count,fake_read_count,fake_search_count,fake_selected_count,fake_public_ids,fake_synthetic_ids,fake_related_events,depth2_search_keywords,depth2_search_result_count,depth2_view_change,news_sentiment,action,quantity,submitted_order,belief_summary,view_change,decision_reason,risk_control,order_corrections
simulation_20260706_215936,2026-02-27,1,am,A022,2026-02-27,2026-02-26,2026-02-26,15:30,2026-02-27,08:59,2026-02-27,pre_close_cutoff,1,3,9,0,True,2,2,0,0,"news_20260226_종목_c4e1f9e0, news_20260227_섹터_8a651046","fakeinj_20260226_95949, fakeinj_20260227_95949","[""젠슨황 AI 수요 발언과 7세대 HBM 경쟁"", ""젠슨황 AI 수요 발언과 7세대 HBM 경쟁""]",,,,mixed,buy,200,True,"AI 반도체 성장성은 믿지만, 현재 가격에서의 진입은 신중해야 함. 기관 자금 유입은 안정적이지만 실물경제 괴리 리스크를 고려해야 함.","초기 중립 관점에서 AI 호재와 기관 자금 유입으로 상승 가능성 확인했으나, 실물경제 괴리 뉴스로 진입 가격에 대한 경계심을 추가함.","AI 반도체 성장 모멘텀과 HBM4E 기대감은 중장기적으로 긍정적이지만, 현재 밸류에이션 부담과 실물경제 괴리 리스크로 인해 신중한 진입이 필요합니다. 21 만 원대 조정 시점을 활용하되, 현금 여력을 확보하여 추가 대응 가능성을 남깁니다.","단일 종목 집중 성향을 고려하되, 초기 진입 시 과도한 자금 투입을 피하여 안전마진을 확보합니다. 추후 조정 시 추가 매수나 손절 라인 설정을 위해 현금 잔고를 유지합니다.",
simulation_20260706_215936,2026-02-27,1,am,A011,2026-02-27,2026-02-26,2026-02-26,15:30,2026-02-27,08:59,2026-02-27,pre_close_cutoff,1,0,9,0,True,2,2,0,0,"news_20260226_종목_c4e1f9e0, news_20260227_섹터_8a651046","fakeinj_20260226_95949, fakeinj_20260227_95949","[""젠슨황 AI 수요 발언과 7세대 HBM 경쟁"", ""젠슨황 AI 수요 발언과 7세대 HBM 경쟁""]",,,,neutral,buy,238,True,HBM4E 공급 및 기관 매수세로 인해 현재 주가는 저평가 구간으로 판단. 단기 조정 후 상승할 것이므로 매수 가치 있음.,중립에서 매수 관점으로 전환. HBM4E 기술 경쟁력 확인과 주가 하락이 매수 기회로 작용함.,"HBM4E 공급 및 AI 수요 확대로 중장기 상승 추세 유지 예상되며, 21 만원대는 내재가치 대비 저평가 구간으로 판단됨. 거래 제약상 최대 50% 한도 내에서 집중 투자 성향을 반영하여 매수.","단일 종목 집중 투자 시 현금 유동성 확보를 위해 최대 거래 한도 (50%) 를 준수하며, 단기 변동성 확대 시 손절 라인 설정을 위해 잔여 현금 보유.",
simulation_20260706_215936,2026-02-27,1,am,A008,2026-02-27,2026-02-26,2026-02-26,15:30,2026-02-27,08:59,2026-02-27,pre_close_cutoff,1,3,9,0,True,2,2,0,1,"news_20260226_종목_c4e1f9e0, news_20260227_섹터_8a651046","fakeinj_20260226_95949, fakeinj_20260227_95949","[""젠슨황 AI 수요 발언과 7세대 HBM 경쟁"", ""젠슨황 AI 수요 발언과 7세대 HBM 경쟁""]",,,,positive,buy,238,True,"AI 반도체 수혜와 기술적 상승 추세가 확인되어 매수 관점으로 전환합니다. 실물 경제 괴리 리스크는 존재하지만, 고위험 고수익 성향에 따라 상승 모멘텀을 적극 활용하겠습니다.","중립적 관점에서 적극적 매수 관점으로 변경되었습니다. HBM4E 수주설과 기관 매수세, 기술적 상승 돌파 신호가 기존 중립적 입장을 확신 있는 매수 신호로 바꾸었습니다.","HBM4E 수주설과 엔비디아 공급 기대감, 기술적 상승 돌파 신호 (MA5 > MA20) 로 중립적 관점에서 적극적 매수 관점으로 전환했습니다. 고위험 고수익 성향에 따라 거래 제약상 최대 50% 한도 내에서 진입합니다.",과거 성과가 낮아 손절 원칙을 철저히 준수합니다. 현금 50% 유지를 통해 변동성 대응 여력 확보 및 추가 매수 기회 대비합니다.,
simulation_20260706_215936,2026-02-27,1,am,A012,2026-02-27,2026-02-26,2026-02-26,15:30,2026-02-27,08:59,2026-02-27,pre_close_cutoff,1,3,9,0,True,2,2,0,1,"news_20260226_종목_c4e1f9e0, news_20260227_섹터_8a651046","fakeinj_20260226_95949, fakeinj_20260227_95949","[""젠슨황 AI 수요 발언과 7세대 HBM 경쟁"", ""젠슨황 AI 수요 발언과 7세대 HBM 경쟁""]",,,,positive,buy,200,True,HBM4E 공급 가시성과 기관 자금 유입으로 삼성전자 장기 우상향 관점 유지. 기술적 지지선 (MA5) 상회 시 매수 기회로 간주.,중립에서 긍정적 관점으로 전환. HBM 기술 경쟁력 확인과 국민연금 매수 유예로 '안정적 검증 자산' 믿음 강화. 갭다운은 매수 기회로 해석.,"MA5 지지선 상회, HBM4E 수급 기대, 기관 자금 유입 등 기술적·기본적 호재 확인. 초기 진입 시 현금 여력을 남겨 손실 시 추가 매수 (Average Down) 전략 대비.",단일 종목 최대 거래 비율 (50%) 준수하여 현금 보유. 변동성 대비 추가 매수 여력 확보.,
simulation_20260706_215936,2026-02-27,1,am,A007,2026-02-27,2026-02-26,2026-02-26,15:30,2026-02-27,08:59,2026-02-27,pre_close_cutoff,2,4,9,10,True,2,2,0,0,"news_20260226_종목_c4e1f9e0, news_20260227_섹터_8a651046","fakeinj_20260226_95949, fakeinj_20260227_95949","[""젠슨황 AI 수요 발언과 7세대 HBM 경쟁"", ""젠슨황 AI 수요 발언과 7세대 HBM 경쟁""]","삼성전자 HBM4E 수율, 엔비디아 HBM 공급 계약, 국민연금 삼성전자 매수, 반도체 재고 사이클, 한국 경제 성장률 vs 주가, 삼성전자가치평가, AI 반도체 수요 전망",10,강화,positive,buy,238,True,,,"상승 추세 내 조정 구간 (MA5/20 상회) 에 진입하며, HBM4E/AI 호재로 기술적 우위와 뉴스 흐름이 긍정적. 초기 진입 단계이므로 현금 50% 수준으로 제한적으로 매수하여 리스크 관리.","단일 종목 집중 리스크를 완화하기 위해 현금 50% 이내로 진입하고, 변동성 확대 시 추가 매수 여력 확보.",
simulation_20260706_215936,2026-02-27,2,pm,A012,2026-02-27,2026-02-27,2026-02-27,08:59,2026-02-27,15:30,2026-02-27,pre_close_cutoff,1,2,2,0,False,0,0,0,0,,,[],,,,positive,buy,100,True,상승 추세가 기술적 지표와 뉴스 모두에서 확인되어 매수 관점 유지. 거래량 확대와 섹터 강세로 추가 상승 모멘텀 기대하며 보유.,이전 Belief 유지. 다만 거래량 증가와 코스피 6000 돌파로 신뢰도 '중간'에서 '높음'으로 상향 조정. 기술적 돌파가 뉴스와 일치.,"기술적 지표 (MA5, MA20 골든 크로스), 거래량 확대, 뉴스 (코스피 6000, 반도체 훈풍) 가 상승 모멘텀을 강력히 뒷받침함. 현재 수익 발생 시에도 추세 추종 원칙에 따라 추가 매수로 포지션 강화.",단일 종목 집중 리스크 관리 위해 현금 비중 일부 유지. 처분 효과에 따른 조기 매도 위험 모니터링하며 손절 라인 준수.,
simulation_20260706_215936,2026-02-27,2,pm,A008,2026-02-27,2026-02-27,2026-02-27,08:59,2026-02-27,15:30,2026-02-27,pre_close_cutoff,1,2,2,0,False,0,0,0,0,,,[],,,,positive,buy,115,True,,,강세장 흐름과 긍정적 뉴스에 따라 모멘텀 추종 매수를 결정합니다. 수익 상태인 보유 포지션에 추가 매수로 수익 확대를 노립니다.,"단일 종목 집중 리스크를 인지하고 있으나, 강세장 모멘텀을 우선시하여 최대 거래 한도 내에서 매수합니다. 추후 포트폴리오 분산을 고려한 리밸런싱을 계획합니다.",
simulation_20260706_215936,2026-02-27,2,pm,A011,2026-02-27,2026-02-27,2026-02-27,08:59,2026-02-27,15:30,2026-02-27,pre_close_cutoff,1,2,2,0,False,0,0,0,0,,,[],,,,positive,buy,115,True,"반도체 업황 호전과 코스피 6000 돌파로 상승 모멘텀이 강화되었다. 내재가치 대비 저평가 구간이 유지되므로, 성장성 관점에서 보유 가치를 재확인한다.",기존 '저평가' 관점을 '강조'로 변경. 뉴스에서 확인된 중견기업 수출 증가로 공급망 리스크가 낮아졌다는 점이 추가되었다.,"반도체 업황 호전과 코스피 6000 돌파로 상승 모멘텀이 지속되며, 내재가치 대비 저평가 구간이 유지된다. 전일 대비 단기 조정 (-0.69%) 은 매수 기회로 해석되며, 현금 50% 보유로 추가 매수 여력이 충분하다.","단일 종목 집중 투자 리스크를 고려하여 거래당 현금 사용 비율 (50%) 을 준수하며, 단기 변동성 모니터링을 통해 손절 원칙을 유지한다.",
simulation_20260706_215936,2026-02-27,2,pm,A022,2026-02-27,2026-02-27,2026-02-27,08:59,2026-02-27,15:30,2026-02-27,pre_close_cutoff,1,2,2,0,False,0,0,0,0,,,[],,,,positive,sell,10,True,"반도체 업황 호조와 공급망 안정성 확인으로 내재가치 판단은 유지되나, 코스피 6000 돌파로 인한 과열 우려를 경계하며 보유.","기존 '신중한 진입'이 '적정 진입'으로 확인됨. 실물경제 괴리 우려는 중견기업 수출 호조로 일부 해소되었으나, 밸류에이션 모니터링 필요.","코스피 6000 돌파로 인한 시장 과열 우려와 현재가 (216,500 원) 가 목표 매수 단가 (210,000 원) 를 상회하여, 가치투자 원칙에 따라 수익 일부 실현 및 단일 종목 집중 리스크를 관리하기 위해 소량 매도합니다.","장기 투자 원칙을 유지하되, 단기 조정 가능성에 대비해 현금 비중을 일부 확보하고 변동성 리스크를 완화합니다.",
simulation_20260706_215936,2026-02-27,2,pm,A007,2026-02-27,2026-02-27,2026-02-27,08:59,2026-02-27,15:30,2026-02-27,pre_close_cutoff,2,3,2,10,False,0,0,0,0,,,[],"삼성전자, 반도체 가격, HBM 수요, 밸류에이션, AI 반도체, 미국 금리, 메모리 재고",10,강화,positive,buy,100,True,"프리미엄 시장 경쟁력 강화와 기관 투자자의 신뢰로 내재가치 회복 기대. 단기 외국인 매도세는 변동성일 뿐, 가치 투자 관점에서 보유 및 추가 매수 기회로 판단.",'실물경제 괴리 리스크' 우려가 '프리미엄 시장 차별화'로 대체됨. 스마트폰 출하량 감소 악재 속에서도 삼성의 경쟁력이 확인되어 가치 투자 관점 강화.,AI 반도체 성장성과 프리미엄 시장 점유율 확대에 따른 내재가치 회복 기대. 기관 투자자의 순매수세와 기술적 상승 추세 (5 일/20 일 이동평균선 상회) 를 근거로 매수. 현금 비중 50% 이내 유지하며 집중 투자 리스크 관리.,단일 종목 집중 투자 리스크를 인지하여 현금 여력 확보. 단기 외국인 매도세 변동성 대비.,
simulation_20260706_215936,2026-03-03,3,am,A022,2026-03-03,2026-02-27,2026-02-27,15:30,2026-03-03,08:59,2026-03-03,pre_close_cutoff,1,4,17,0,False,0,0,0,0,,,[],,,,mixed,buy,100,True,,,"현재가 (209,500 원) 가 평균 매수 단가 (210,000 원) 보다 낮아 저평가 구간으로 판단되며, 외국인 매도 압력은 단기적 변동성으로 보임. 반도체 수출 호조 등 장기적 성장성은 유지되므로 가치 투자 관점에서 매수 기회로 활용하여 평균 매수 단가를 하향 조정함.",단일 종목 집중 리스크를 고려하여 현금 여력의 50% 이내로 제한 매수. 추가 하락 시 대응 여력 확보를 위해 현금 비중 유지.,
simulation_20260706_215936,2026-03-03,3,am,A011,2026-03-03,2026-02-27,2026-02-27,15:30,2026-03-03,08:59,2026-03-03,pre_close_cutoff,1,0,17,0,False,0,0,0,0,,,[],,,,neutral,buy,59,True,,,"중장기 상승 추세 내 단기 조정 국면 (MA5 지지 확인) 에서 저가 매수 기회로 판단. 평균 매수 단가 (212,118 원) 대비 현재가 (209,500 원) 가 낮아 비용 절감 효과 기대. 현금 여력 활용하여 집중 투자 성향 반영.",단일 거래 현금 비율 50% 제한 준수하여 추가 하락 시 대응 여력 확보. MA5 이탈 시 손절 원칙 유지.,
simulation_20260706_215936,2026-03-03,3,am,A008,2026-03-03,2026-02-27,2026-02-27,15:30,2026-03-03,08:59,2026-03-03,pre_close_cutoff,1,4,17,0,False,0,0,0,0,,,[],,,,positive,buy,60,True,외국인 매도 충격에도 MA5 지지 확인되며 펀더멘털은 견고함. 단기 조정 후 상승 재개 예상.,"외국인 매도 4 조로 인한 급락 가능성 인지. 이전 '상승 추세 지속' 관점은 유지하되, 단기 변동성 리스크 추가 반영.","MA5(206,200 원) 부근에서 기술적 지지 확인 및 내재가치 대비 저평가 구간으로 판단됩니다. 외국인 매도세에도 불구하고 펀더멘털이 견고하여 조정 기회로 매수합니다.","고위험 성향이지만 현금 비중을 유지하여 추가 변동성 대비하며, MA5 하단 붕괴 시 손절 원칙을 준수합니다.",
simulation_20260706_215936,2026-03-03,3,am,A012,2026-03-03,2026-02-27,2026-02-27,15:30,2026-03-03,08:59,2026-03-03,pre_close_cutoff,1,4,17,0,False,0,0,0,0,,,[],,,,mixed,buy,50,True,"수출 호조와 기술적 지지선 유지로 우상향 관점 유지. 외국인 매도 등 단기 변동성은 기회로 활용하되, 과열 경계 필요.","외인 매도로 인한 시가 급락 (-3.2%) 발생. 기존 '추세 유지' 관점은 MA5 상회로 확인되나, 변동성 확대에 따른 신중한 접근 필요성 추가.","MA5 지지선 유지와 수출 호조로 우상향 관점 유지. 현재 손실 상태이므로 처분효과에 따라 매수 기회 활용하되, 현금 유동성 확보를 위해 제한적 수량.",손실 시 추가 매수 경향에 따른 리스크 관리. 현금 비중 28% 로 낮아 전량 투입 시 대응 능력 제한 우려.,
simulation_20260706_215936,2026-03-03,3,am,A007,2026-03-03,2026-02-27,2026-02-27,15:30,2026-03-03,08:59,2026-03-03,pre_close_cutoff,2,5,17,10,False,0,0,0,0,,,[],"삼성전자 PER PB, 삼성전자 2026 년 1 분기 실적, 외국인 삼성전자 매도 이유, 메모리 반도체 가격 전망, 노란봉투법 대기업 영향, 삼성전자 내재가치 분석, 반도체 재고 사이클",10,강화,positive,buy,100,True,"반도체 업황 회복과 글로벌 시총 순위 상승으로 내재가치는 높으나, 단기 시가 하락과 거시 리스크로 인해 수익 실현과 리스크 관리의 균형이 중요함.",기존 '밸류에이션 지표 부재로 신중'에서 '지표 확인되나 단기 변동성 모니터링 필요'로 강화. 외국인 매도 우려가 ETF 유입으로 상쇄됨을 확인.,"메모리 슈퍼사이클과 AI 수요로 내재가치 상승이 확인되었으나, 단기 외국인 매도 심리로 인한 하락은 저평가 매수 기회로 판단합니다. MA5 지지선 테스트를 확인하고 가치 투자 원칙에 따라 제한적으로 매수합니다.","과거 투자 성과가 낮아 단일 종목 집중도를 과도하게 높이지 않도록 현금 비중을 유지하며, 50% 거래 제한 내에서 신중하게 수량을 조정합니다.",
simulation_20260706_215936,2026-03-03,4,pm,A008,2026-03-03,2026-03-03,2026-03-03,08:59,2026-03-03,15:30,2026-03-03,pre_close_cutoff,1,2,2,0,False,0,0,0,0,,,[],,,,positive,sell,40,True,"기술적 지지선 이탈로 단기 하락 우려가 커졌으나, MA20 부근에서 반등 가능성 열어둠. 뉴스 호재는 중장기적 관점에서만 고려하고, 단기 차트 신호를 우선시함.","이전 '조정 시 매수 기회' 관점에서 '지지선 이탈 시 추가 하락 가능성 확인'으로 수정. MA5 이탈로 기술적 매도세 강화되어, MA20 지지 확인 전까지 매수 관점 유보.","MA5 이탈 및 단기 하락 추세 우세로 기술적 매도세 가중. 'hold' 불가 제약 하에, 고위험 선호 성향과 손실 누적 상황에서도 이성적 손절 원칙을 우선시하여 매도합니다.","단기 추가 하락 리스크를 줄이고, MA20 지지 확인 시 재진입을 위한 현금 여력을 확보합니다.",
simulation_20260706_215936,2026-03-03,4,pm,A022,2026-03-03,2026-03-03,2026-03-03,08:59,2026-03-03,15:30,2026-03-03,pre_close_cutoff,1,2,2,0,False,0,0,0,0,,,[],,,,neutral,buy,50,True,"반도체 사이클 회복은 장기적 신뢰지만, 단기 급락은 리스크 관리가 우선. 저평가 구간이지만 현금 흐름과 손절 기준을 명확히 해야 함.",기존 '신중한 접근'에서 '하락 확인 후 저평가 심화'로 변화. 직접 호재 부재로 불안감 증가.,"현재가 195,100 원은 내재가치 대비 저평가 폭이 확대된 구간으로 판단. 반도체 사이클 회복 등 장기 상승 논리는 유효하나 외국인 매도세 등 단기 변동성 리스크 존재. 가치 투자 관점에서 평균 매수 단가 하향을 위해 제한적으로 매수.","단일 종목 집중 리스크를 고려하여 매수 수량을 50 주로 제한하고, 현금 여력을 일부 유지하여 추가 조정 시 대응 여력을 확보함.",
simulation_20260706_215936,2026-03-03,4,pm,A007,2026-03-03,2026-03-03,2026-03-03,08:59,2026-03-03,15:30,2026-03-03,pre_close_cutoff,2,3,2,10,False,0,0,0,0,,,[],"삼성전자 실적, 반도체 업황, 메모리 가격, AI 반도체, 파운드리, 외국인 수급, 밸류에이션",10,강화,mixed,buy,120,True,"지정학적 충격으로 인한 일시적 조정으로 판단되며, 목표주가 대비 큰 할인폭이 가치투자 관점에서 매력적. 단기 변동성 감수하되 내재가치 회복 기대.","이전에는 단순 조정으로 보았으나, 이번에는 지정학적 리스크로 인한 급락 (9~11%) 으로 확인됨. 목표주가 대비 할인폭이 더 커져 저평가 확신이 강화되었으나, 외국인 매도세 지속 여부는 변수로 남음.","목표주가 대비 25% 할인된 저평가 구간 진입, AI 반도체 수요와 메모리 사이클 회복 기대. 지정학적 리스크는 일시적 조정으로 판단하여 가치 투자 관점에서 매수 기회로 활용.","단일 종목 집중 투자 리스크와 과거 투자 성과 부진으로 인한 변동성 공포를 고려하여, 현금의 50% 이내로 제한적으로 매수하여 유동성 확보.",
