run_id,date,turn,subturn,agent_id,decision_date,market_features_date,news_start_date,news_start_time,news_max_date,news_end_time,execution_date,information_mode,stock_code,action,quantity,reason
simulation_20260714_232753_419193_11485,2026-02-27,1,am,A004,2026-02-27,2026-02-26,2026-02-26,15:30,2026-02-27,08:59,2026-02-27,pre_close_cutoff,005930,buy,238,"기술적 지표 (MA5 지지) 와 기관 매수세, 정부 지원 호재를 근거로 낙관적 관점에서 진입합니다. 단일 종목 집중 성향을 반영하여 허용된 최대 금액으로 매수합니다."
simulation_20260714_232753_419193_11485,2026-02-27,1,am,A003,2026-02-27,2026-02-26,2026-02-26,15:30,2026-02-27,08:59,2026-02-27,pre_close_cutoff,005930,buy,238,"내재가치 대비 저평가 구간으로 판단되며, 단기 조정 후 상승 재개 전망에 따라 50% 현금 비중 제한 내에서 집중 투자 성향을 반영하여 최대 수량 매수합니다."
simulation_20260714_232753_419193_11485,2026-02-27,1,am,A002,2026-02-27,2026-02-26,2026-02-26,15:30,2026-02-27,08:59,2026-02-27,pre_close_cutoff,005930,buy,200,"실적 대비 저평가 구간 (21 만 원) 이며 기관 매수 (국민연금) 로 하방 지지력이 형성되어 진입 시점으로 판단됨. 기술적 지표 (MA5, MA20) 도 양호하나 경쟁사 리스크로 인해 전량 매수는 지양함."
simulation_20260714_232753_419193_11485,2026-02-27,1,am,A005,2026-02-27,2026-02-26,2026-02-26,15:30,2026-02-27,08:59,2026-02-27,pre_close_cutoff,005930,buy,238,"반도체 사이클 회복과 AI 수요 등 장기 펀더멘털이 견고하며, 오늘 시가 하락 (-3.67%) 은 가치투자 관점에서 안전마진을 확보할 기회로 판단됩니다. 기관 매수세와 정부 지원 호재를 반영하여, 초기 진입이므로 거래 제한 범위 내에서 최대한 매수하되 현금 여력을 유지합니다."
simulation_20260714_232753_419193_11485,2026-02-27,1,am,A006,2026-02-27,2026-02-26,2026-02-26,15:30,2026-02-27,08:59,2026-02-27,pre_close_cutoff,005930,buy,238,"AI 수요 증가 및 기관 자금 유입 뉴스에 따른 상승 모멘텀 확인. 단기 조정 (210,000 원) 을 저가 매수 기회로 판단하여 기술적 지지선 부근 진입. 현금 50% 제한 내에서 집중 투자 성향 반영."
simulation_20260714_232753_419193_11485,2026-02-27,1,am,A001,2026-02-27,2026-02-26,2026-02-26,15:30,2026-02-27,08:59,2026-02-27,pre_close_cutoff,005930,buy,238,"21 만 원 선은 가치투자 관점에서 진입에 무난한 수준이며, 국민연금 매도 중단과 기관 매수세로 하방이 지지됩니다. 전남에서 서울 증시를 보며 장기 성장성을 믿고 진입합니다."
simulation_20260714_232753_419193_11485,2026-02-27,1,am,A007,2026-02-27,2026-02-26,2026-02-26,15:30,2026-02-27,08:59,2026-02-27,pre_close_cutoff,005930,buy,238,"중기 상승 추세 (MA5, MA20 상향) 가 유지되고 있으며, 단기 조정 (-3.67%) 은 가치투자 관점에서 저가 매수 기회로 판단됨. 집중투자 성향을 반영하여 허용 범위 내에서 진입."
simulation_20260714_232753_419193_11485,2026-02-27,1,am,A008,2026-02-27,2026-02-26,2026-02-26,15:30,2026-02-27,08:59,2026-02-27,pre_close_cutoff,005930,buy,238,"AI 수요 증가와 반도체 업황 회복, 기관 매수세 (국민연금) 로 상승 모멘텀이 명확함. 기술적 지표 (MA5 돌파) 와 맞물려 매수 기회로 판단하여 고위험 고수익 성향에 따라 최대 허용 범위 내에서 진입."
