run_id,date,turn,subturn,agent_id,decision_date,market_features_date,news_start_date,news_start_time,news_max_date,news_end_time,execution_date,information_mode,stock_code,direction,quantity,price,order_type,reason
simulation_20260702_185755,2026-02-27,1,am,A001,2026-02-27,2026-02-26,2026-02-26,15:30,2026-02-27,08:59,2026-02-27,pre_close_cutoff,005930,buy,200,211000.0,limit,"뉴스 (HBM4E 기술 우위, 기관 매수세) 와 시장 데이터 (단기 조정 기회) 를 근거로 매수 방향 결정. 포트폴리오 상태 (전액 현금 보유) 로 진입 가능. 현재가 210,000 원 대비 0.5% 상향 호가 (211,000 원) 로 체결 확률 확보."
simulation_20260702_185755,2026-02-27,1,am,A002,2026-02-27,2026-02-26,2026-02-26,15:30,2026-02-27,08:59,2026-02-27,pre_close_cutoff,005930,buy,200,211000.0,limit,"국민연금 매수세와 HBM 수혜 기대감으로 내재가치 대비 저평가 구간으로 판단. MA5, MA20 상향 유지로 기술적 지지 확인. 과거 투자 성과가 낮아 신중하나, 가치 평가 지표 (PE/PB) 에 기반한 저평가 매수 기회로 진입."
simulation_20260702_185755,2026-02-27,1,am,A003,2026-02-27,2026-02-26,2026-02-26,15:30,2026-02-27,08:59,2026-02-27,pre_close_cutoff,005930,buy,230,211000.0,limit,"HBM4E 기술 경쟁력 강화 및 기관 자금 유입 (dim_1, dim_4) 관련 뉴스가 긍정적 신호. 현재 주가 (210,000 원) 는 5 일/20 일 이동평균선 지지 및昨日 하락 (3.6%) 로 인한 매수 기회. 포트폴리오 현금 100% 보유로 초기 진입 단계이므로 성장 동력이 확실할 경우 적정 가격으로 수용."
simulation_20260702_185755,2026-02-27,1,am,A004,2026-02-27,2026-02-26,2026-02-26,15:30,2026-02-27,08:59,2026-02-27,pre_close_cutoff,005930,buy,230,211000.0,limit,"MA5(200,920 원) 돌파 신호와 HBM4E 수주 호재, 국민연금 매수세 확인. 기술적 모멘텀과 뉴스 헤드라인에 기반하여 상승 추세를 따르는 매수."
simulation_20260702_185755,2026-02-27,1,am,A005,2026-02-27,2026-02-26,2026-02-26,15:30,2026-02-27,08:59,2026-02-27,pre_close_cutoff,005930,buy,230,211000.0,limit,"HBM4E 기술 경쟁력 확보와 기관 매수 지속에 따른 내재가치 상승 기대감, 현재 21 만 원대 주가는 내재가치 대비 저평가 구간으로 판단되어 가치 투자 관점에서 매력적 진입. 5 일 및 20 일 이동평균선 상회로 기술적 지지력 확인. 현금 100% 보유 상태로 집중 투자 기회 활용."
