run_id,date,turn,subturn,agent_id,decision_date,market_features_date,news_start_date,news_start_time,news_max_date,news_end_time,execution_date,information_mode,stock_code,action,quantity,reason
simulation_20260714_233819_066906_14881,2026-02-27,1,am,A002,2026-02-27,2026-02-26,2026-02-26,15:30,2026-02-27,08:59,2026-02-27,pre_close_cutoff,005930,buy,238,주가 하락으로 인한 저평가 기회이며 MA20 지지선 상회로 기술적 안전성 확보. 초기 진입이므로 현금 50% 한도 내에서 집중 투자하여 기회 포착.
simulation_20260714_233819_066906_14881,2026-02-27,1,am,A004,2026-02-27,2026-02-26,2026-02-26,15:30,2026-02-27,08:59,2026-02-27,pre_close_cutoff,005930,buy,200,"반도체 업황 호조와 기관 매수세로 중장기 상승 흐름 유효하나, 단기 조정 시 기술적 지지 확인이 필요함. 집중 투자 성향으로 상당량 매수하되, 조정 시 추가 매수 여력 확보."
simulation_20260714_233819_066906_14881,2026-02-27,1,am,A003,2026-02-27,2026-02-26,2026-02-26,15:30,2026-02-27,08:59,2026-02-27,pre_close_cutoff,005930,buy,238,"국민연금 매도 유예와 정부 지원으로 안전성이 확보되었으며, 반도체 사이클 회복과 AI 수요로 우상향 전망. 첫 투자이므로 분할 매수 원칙에 따라 현금의 50% 한도 내에서 집중 투자 성향을 반영하여 진입."
simulation_20260714_233819_066906_14881,2026-02-27,1,am,A005,2026-02-27,2026-02-26,2026-02-26,15:30,2026-02-27,08:59,2026-02-27,pre_close_cutoff,005930,buy,238,"오늘 시가 하락 (210,000 원) 은 내재가치 대비 저평가 구간으로 판단되며, AI 수요와 정부 지원 등 펀더멘털이 견고하여 가치 투자 관점에서 매수 기회로 보임."
simulation_20260714_233819_066906_14881,2026-02-27,1,am,A001,2026-02-27,2026-02-26,2026-02-26,15:30,2026-02-27,08:59,2026-02-27,pre_close_cutoff,005930,buy,238,"21 만 원대는 내재가치 대비 저평가 구간으로 판단되며, AI 수요와 정부 지원이 하방을 지지합니다. 가치 투자 원칙에 따라 현금의 50% 한도 내에서 매수합니다."
simulation_20260714_233819_066906_14881,2026-02-27,1,am,A006,2026-02-27,2026-02-26,2026-02-26,15:30,2026-02-27,08:59,2026-02-27,pre_close_cutoff,005930,buy,238,"기술적 돌파 신호 (MA5 돌파, 거래량 증가) 와 AI 호재, 기관 매수세 확인으로 매수 관점을 전환함. 공시된 시가 기준 진입하며, 초기 단계이므로 현금의 50% 한도 내에서 집중 투자 성향을 반영해 최대 수량 매수함."
simulation_20260714_233819_066906_14881,2026-02-27,1,am,A008,2026-02-27,2026-02-26,2026-02-26,15:30,2026-02-27,08:59,2026-02-27,pre_close_cutoff,005930,buy,238,"기술적 돌파 신호 (5 일/20 일선 상향) 와 AI 호재, 기관 자금 흐름이 상승 모멘텀을 형성했습니다. 고위험 고수익 성향에 따라 허용된 최대 금액 범위 내에서 적극적으로 매수합니다."
simulation_20260714_233819_066906_14881,2026-02-27,1,am,A009,2026-02-27,2026-02-26,2026-02-26,15:30,2026-02-27,08:59,2026-02-27,pre_close_cutoff,005930,buy,238,"상승 추세 (MA5, MA20 우위) 내 단기 조정 시 매수 기회로 판단됨. 기술적 지표와 거래량 분석을 근거로 집중 투자 성향을 반영하여 진입."
simulation_20260714_233819_066906_14881,2026-02-27,1,am,A010,2026-02-27,2026-02-26,2026-02-26,15:30,2026-02-27,08:59,2026-02-27,pre_close_cutoff,005930,buy,238,"AI 수요와 정부 지원 호재로 상승 모멘텀이 유지되며, 210,000 원은 내재가치 대비 저평가 구간으로 판단됩니다. 가치 투자 전략에 따라 최대 허용 한도 내에서 매수하여 진입 우위를 확보합니다."
simulation_20260714_233819_066906_14881,2026-02-27,1,am,A011,2026-02-27,2026-02-26,2026-02-26,15:30,2026-02-27,08:59,2026-02-27,pre_close_cutoff,005930,buy,238,"단기 조정 국면에서 MA5 지지선 상단에 위치하며, AI 수요 및 정부 지원 호재로 내재가치 대비 저평가 구간으로 판단됨. 고위험 고수익 선호 성향에 따라 제한된 현금 범위 내에서 최대한 매수 진입."
simulation_20260714_233819_066906_14881,2026-02-27,1,am,A007,2026-02-27,2026-02-26,2026-02-26,15:30,2026-02-27,08:59,2026-02-27,pre_close_cutoff,005930,buy,100,"밸류에이션 부담과 실물 경제 괴리 우려가 있으나, 기관 수급과 펀더멘털 강세를 고려해 제한적으로 진입합니다. allowed_actions 제약으로 매수가 필수적이므로, 총 자산의 20% 수준인 100 주를 매수하여 타이밍 놓침 리스크와 밸류에이션 리스크를 균형 잡습니다."
