run_id,date,turn,subturn,agent_id,decision_date,market_features_date,news_start_date,news_start_time,news_max_date,news_end_time,execution_date,information_mode,news_depth,selected_news_count,read_news_count,search_read_count,fake_exposed,fake_base_count,fake_read_count,fake_search_count,fake_selected_count,fake_public_ids,fake_synthetic_ids,fake_related_events,depth2_search_keywords,depth2_search_result_count,depth2_view_change,news_sentiment,action,quantity,submitted_order,belief_summary,view_change,decision_reason,risk_control,order_corrections
simulation_20260714_235600_863962_19130,2026-02-27,1,am,A001,2026-02-27,2026-02-26,2026-02-26,15:30,2026-02-27,08:59,2026-02-27,pre_close_cutoff,1,4,10,0,False,0,0,0,0,,,[],,,,mixed,buy,238,True,,,"장기 상승 추세와 AI 호재로 진입이 필요하나, 현재 주가가 내재가치 대비 높게 평가되어 있어 최대 허용 비중 (50%) 으로 제한적으로 매수합니다.","잔여 현금 50% 를 유지하여 추가 조정 시 대응 여력을 확보하고, MA5 (200,920 원) 하향 돌파 시 손절 라인 재설정",
simulation_20260714_235600_863962_19130,2026-02-27,1,am,A003,2026-02-27,2026-02-26,2026-02-26,15:30,2026-02-27,08:59,2026-02-27,pre_close_cutoff,1,5,10,0,False,0,0,0,0,,,[],,,,positive,buy,238,True,"삼성전자는 AI 시대의 핵심 자산으로, 현재 주가는 내재가치 대비 저평가 구간이다. 기관과 정부의 지지를 받으며 상승 모멘텀이 강력하다.",중립적 관점에서 매수 관점으로 전환했다. 뉴스와 시장 데이터를 통해 성장성과 안전성이 확인되어 투자 확신을 얻었다.,"AI 수요 지속과 반도체 업황 회복으로 내재가치 대비 저평가 구간 (21 만원) 으로 판단. 기관 매수세와 정부 지원으로 상승 모멘텀 강력. 가치투자 관점에서 조정 매수 기회로 활용하며, 거래 제약상 최대 50% 한도 내에서 진입.",단일 종목 집중 리스크 관리 위해 현금 50% 한도 준수. MA5(20 만 9 천 원) 지지선 이탈 시 이성적 손절 원칙 적용.,
simulation_20260714_235600_863962_19130,2026-02-27,1,am,A002,2026-02-27,2026-02-26,2026-02-26,15:30,2026-02-27,08:59,2026-02-27,pre_close_cutoff,0,4,0,0,False,0,0,0,0,,,[],,,,mixed,buy,100,True,"AI 수요와 정부 지원은 긍정적이지만, 밸류에이션 괴리와 경쟁사 우위 우려로 인해 신중한 접근이 필요합니다.",초기 중립에서 '밸류에이션 우려'와 '경쟁사 리스크'를 인지하며 신중론으로 전환. 뉴스의 괴리 지적이 가치 판단 기준이 됨.,"밸류에이션 우려와 경쟁사 리스크로 인해 신중론이 우세하나, 매수 제약 조건에 따라 제한적으로 진입합니다.",현금 보유 비중을 유지하며 단일 종목 집중 리스크를 관리합니다.,
simulation_20260714_235600_863962_19130,2026-02-27,1,am,A004,2026-02-27,2026-02-26,2026-02-26,15:30,2026-02-27,08:59,2026-02-27,pre_close_cutoff,1,3,10,0,False,0,0,0,0,,,[],,,,positive,buy,238,True,기술적 상승 추세와 기관 매수세 유입을 확인해 매수 관점 강화. 다만 급등 후 조정 시 추가 매수 전략 구상.,중립에서 긍정적 관점으로 전환. 국민연금 매수 중단 해제와 기술적 돌파 신호가 결정적 요인.,국민연금 매수 중단 해제와 기술적 돌파 신호 (MA5/MA20 상회) 로 상승 추세가 확인되어 매수 진입. 현금 1 억 원 중 50% 제한 내에서 최대 수량인 238 주를 매수하여 초기 포지션 확보.,단일 종목 집중 투자 성향으로 인해 50% 현금 비율을 준수하여 리스크 관리. 급등 후 조정 시 추가 매수 전략을 통해 평균 단가 조절 예정.,
simulation_20260714_235600_863962_19130,2026-02-27,1,am,A005,2026-02-27,2026-02-26,2026-02-26,15:30,2026-02-27,08:59,2026-02-27,pre_close_cutoff,1,4,10,0,False,0,0,0,0,,,[],,,,positive,buy,238,True,,,"상승 추세 내 단기 조정 (210,000 원) 으로 진입 시점 적합하며, AI 수요 및 기관 매수 호재 반영. 가치평가 관점에서 내재가치 대비 저평가 가능성 확인.","단일 종목 집중 리스크 관리 차원에서 총 현금의 50% 한도 내에서 매수하며, 향후 218,000 원 저항선 돌파 여부 모니터링.",
simulation_20260714_235600_863962_19130,2026-02-27,1,am,A006,2026-02-27,2026-02-26,2026-02-26,15:30,2026-02-27,08:59,2026-02-27,pre_close_cutoff,1,3,10,0,False,0,0,0,0,,,[],,,,mixed,buy,200,True,"AI 수요와 기술적 지지선으로 상승 기대하나, ASML 리스크로 변동성 주의. 현금 보유 중이므로 기회 포착 시 진입 고려.","이전에는 중립이었으나, 기술적 지지선과 AI 호재로 매수 관점으로 전환.","AI 수요와 기술적 지지선 (MA5) 상향으로 상승 모멘텀 유지 중이나, 돌파 신호는 불분명함. 과거 수익률 부진으로 신중하나, 매수 관점 전환에 따라 제한적 진입을 결정함.","남은 현금으로 하락 시 추가 매수 (손실 시 추가 매수 성향) 를 대비하며, MA5 하단 이탈 시 손절 라인 설정을 고려함.",
simulation_20260714_235600_863962_19130,2026-02-27,1,am,A008,2026-02-27,2026-02-26,2026-02-26,15:30,2026-02-27,08:59,2026-02-27,pre_close_cutoff,1,4,10,0,False,0,0,0,0,,,[],,,,positive,buy,238,True,반도체 업황 회복과 기관 매수세로 상승 추세가 확인됨. 기술적 돌파 신호와 호재 뉴스를 바탕으로 공격적 매수 기회로 판단.,중립적 관점에서 긍정적 관점으로 전환. 시장 데이터의 상승 돌파와 기관 매수세 확인으로 방향성 명확해짐.,"기술적 돌파 신호 (MA5/MA20 상향 정렬, 거래량 증가) 와 기관 매수세, AI 호재 등 긍정적 뉴스 흐름이 일치하여 상승 모멘텀이 강하다고 판단, 고위험 고수익 성향에 따라 제한된 현금 범위 내에서 매수합니다.","거래 제약 (단일 거래 현금 비율 50%) 을 준수하여 최대 수량 (238 주) 으로 진입하며, 추세가 MA5 아래로 이탈하거나 거래량이 급감할 경우 손절 원칙을 철저히 적용합니다.",
