run_id,date,turn,agent_id,decision_date,market_features_date,news_start_date,news_start_time,news_max_date,news_end_time,execution_date,information_mode,news_depth,selected_news_count,read_news_count,search_read_count,depth2_search_keywords,depth2_search_result_count,depth2_view_change,news_sentiment,action,quantity,order_type,price,submitted_order,belief_summary,view_change,decision_reason,risk_control,order_corrections
simulation_20260701_174227,2026-02-27,1,A086,2026-02-27,2026-02-26,2026-02-26,15:30,2026-02-27,15:30,2026-02-27,pre_close_cutoff,1,3,9,0,,,,mixed,buy,229,limit,215000.0,True,,,"포트폴리오 상태 (현금 100% 보유로 진입 필요), 시장 데이터 (현재가 218,000 원은 20 일선 대비 24% 프리미엄으로 가치투자 관점에서 안전마진 확보 필요), 뉴스 (HBM4E 기술 우위 및 사이클 회복 기대감으로 장기적 매수 기회로 판단).","단일 종목 집중 투자 성향으로 최대 매수 한도 (5000 만 원) 를 활용하되, 지정가 주문을 통해 단기 과열 리스크 관리. 매수 실패 시 추가 현금 확보로 조정 시 평균 단가 하향 가능.",
simulation_20260701_174227,2026-02-27,1,A033,2026-02-27,2026-02-26,2026-02-26,15:30,2026-02-27,15:30,2026-02-27,pre_close_cutoff,1,3,9,0,,,,mixed,buy,229,limit,218000.0,True,"HBM 기술 우위와 기관 지지는 강세 신호이나, 실물경제 괴리 리스크를 인지하며 접근을 신중히 검토. 검증된 자산으로서의 가치 인정.",중립에서 긍정적 관점으로 전환. 국민연금 매도 중단과 HBM4E 기술 경쟁력 확인으로 신뢰도 상승. 실물경제 괴리는 주의 요인.,"HBM4E 기술 경쟁력 확인과 국민연금 매도 중단 등 긍정적 요인으로 Belief 가 중립에서 긍정적으로 전환되었습니다. 기술적 우위 (MA5, MA20 상회) 와 기관 매수세로 상승 모멘텀이 유력하나, 내재가치 대비 저평가 구간은 아닙니다. 그러나 검증된 자산으로서의 안정성과 장기 성장성을 고려하여, 현재 시점에서의 진입을 결정했습니다.","단일 종목 집중 투자 리스크를 고려하여, 거래 제약 내 최대 허용 금액 (현금의 50%) 인 5,000 만 원 범위 내에서 수량을 산정했습니다. 실물경제와 증시 괴리 리스크가 존재하므로, 추후 손절 기준을 명확히 유지하며 변동성을 주시하겠습니다.",
simulation_20260701_174227,2026-02-27,1,A012,2026-02-27,2026-02-26,2026-02-26,15:30,2026-02-27,15:30,2026-02-27,pre_close_cutoff,0,4,0,0,,,,mixed,buy,150,limit,216000.0,True,"기술적 상승 추세와 기관 안정성 신호가 우상향 근거이나, 경쟁사 대비 상대적 약세로 진입 타이밍 신중히 고려한다.",초기 중립에서 기술적 상승 신호 (MA5/20 돌파) 와 기관 안정성 뉴스에 따라 '신중한 매수 관점'으로 전환.,"기술적 지표 (MA5/20 돌파) 와 거래량 증가가 상승 모멘텀을 지지하며, 반도체 업황 회복 등 거시 환경도 긍정적입니다. 다만 현재 주가가 MA5 대비 8.5% 이상 상승하여 단기 과매수 우려가 있으므로, 추격 매수를 피하고 신중한 진입을 위해 전일 종가 기준 약간 하향된 가격에 지정가 매수 주문을 제출합니다.","총 현금의 약 32% 수준 (3,240 만 원) 으로 진입하여 현금 잔고를 확보합니다. 이는 추후 주가 조정 시 추가 매수 (평균 단가 하향) 를 위한 여유 자금을 확보하기 위함이며, 지정가 주문을 통해 불필요한 고가 매수 리스크를 관리합니다.",
simulation_20260701_174227,2026-02-27,1,A008,2026-02-27,2026-02-26,2026-02-26,15:30,2026-02-27,15:30,2026-02-27,pre_close_cutoff,1,3,9,0,,,,positive,buy,200,limit,219000.0,True,,,"핵심 근거는 기술적 지표와 뉴스 호재의 일치입니다. MA5 와 MA20 의 정배열, 거래량 증가 등 기술적 돌파 신호가 강세 추세를 확인하며, AI 및 HBM 관련 뉴스와 기관 매수세 유입이 호재로 작용합니다. 포트폴리오가 현금 100% 상태이므로 명확한 진입 기회를 포착하기 위해 매수합니다.","최대 거래 제약 (50%) 내에서 44% 수준으로 진입하여 현금 잔여액을 확보합니다. 고위험 고수익 성향이지만 과거 성과가 낮아 신중함을 유지하며, 추후 손절 라인 설정을 통해 손실 가능성을 관리합니다.",
simulation_20260701_174227,2026-02-27,1,A095,2026-02-27,2026-02-26,2026-02-26,15:30,2026-02-27,15:30,2026-02-27,pre_close_cutoff,1,3,9,0,,,,mixed,buy,150,limit,218000.0,True,국민연금의 안정적 매수 신호와 기술적 상승 추세가 확인되어 매수 관점 강화. 다만 실물경제 괴리 리스크는 모니터링.,중립에서 긍정적 관점으로 전환. 국민연금의 국내주식 비중 조정 유예와 기술적 MA5 돌파가 진입 신호로 작용.,국민연금의 안정적 지지 신호 (뉴스) 와 MA5 돌파 및 거래량 증가 (기술적 지표) 를 확인하여 진입 시점으로 판단. 현재 현금 100% 보유 상태 (포트폴리오) 이므로 시장 진입 필요. 다만 밸류에이션 부담으로 과열 우려 경계.,"실물경제 괴리 및 고점 매수 리스크 존재. 현금의 30% 수준 (약 3,270 만 원) 으로 제한하여 손실 발생 시 추가 대응 여력 확보. 단기 급등 시 처분효과에 따른 조기 매도 가능성 고려.",
simulation_20260701_174227,2026-02-27,1,A047,2026-02-27,2026-02-26,2026-02-26,15:30,2026-02-27,15:30,2026-02-27,pre_close_cutoff,1,3,9,0,,,,positive,buy,200,limit,222000.0,True,HBM4E 기술 경쟁력 확보와 국민연금의 지분 안정성이 저평가된 삼성전자에 대한 투자 확신을 높였다. 반도체 업황 회복과 거시경제 개선이 맞물려 상승 추세가 예상되므로 가치 투자 관점에서 매력적인 자산으로 판단한다.,초기 중립적 관점에서 긍정적 관점으로 전환. HBM4E 기술 우위와 국민연금의 매수 유예가 가치 평가 기준에 부합하여 저평가 신호로 해석함.,"핵심 근거는 오늘의 Belief(HBM4E 기술 우위, 국민연금 지분 안정성)와 시장 분석(강세장 진입, 저평가 신호)입니다. 전일 7.12% 상승에도 내재가치 대비 매력적이며, 100% 현금 포트폴리오 상태이므로 진입 기회를 활용합니다. 뉴스(국민연금 매수 유예)와 거시경제 개선 흐름이 상승 모멘텀을 뒷받침합니다.","단일 종목 집중 리스크를 고려하여 최대 거래 금액 (5,000 만 원) 이내에서 4,440 만 원 (약 44%) 을 투입하여 현금 잔여분을 확보합니다. 단기 급등에 따른 조정 리스크가 있으므로, 손절 라인 설정을 철저히 하고 실물경제 괴리 뉴스 모니터링을 지속합니다.",
simulation_20260701_174227,2026-02-27,1,A040,2026-02-27,2026-02-26,2026-02-26,15:30,2026-02-27,15:30,2026-02-27,pre_close_cutoff,1,3,9,0,,,,positive,buy,1,limit,218000.0,True,"HBM4E 기술 우위와 기관 자금 유입으로 상승 모멘텀이 확인되었습니다. 기술적 돌파 신호와 호재가 일치하므로, 변동성을 감수하며 추세를 따르겠습니다.",중립적 관점에서 기술적 돌파와 호재 확인으로 '상승 추종' 관점으로 전환했습니다. 실물경제 괴리 우려는 있으나 단기 모멘텀을 우선시합니다.,,,"hold->buy, price<=0->current_price"
simulation_20260701_174227,2026-02-27,1,A022,2026-02-27,2026-02-26,2026-02-26,15:30,2026-02-27,15:30,2026-02-27,pre_close_cutoff,1,4,9,0,,,,mixed,buy,229,limit,218000.0,True,"HBM 기술력과 기관 자금 유입으로 성장성은 입증되었으나, 실물 경제 괴리 우려로 밸류에이션을 꼼꼼히 확인 후 진입할 계획입니다.",중립적 관점에서 기관 매수세와 기술 호재로 인해 '신중한 낙관'으로 전환. 실물 경제 괴리 뉴스로 인해 진입 타이밍에 더 신중해짐.,"HBM4E 기술 우위와 기관 매수세로 장기 성장성은 입증되었으나, 7% 급등으로 인한 단기 밸류에이션 부담을 고려하여 전일 종가 기준 지정가 매수 주문을 제출합니다. 추격 매수 (FOMO) 를 경계하고 가치 투자 원칙에 따라 진입 타이밍을 신중하게 선택합니다.","단일 종목 집중 투자 리스크를 관리하기 위해 총 현금의 50% 한도 내에서 매수합니다. 실물 경제와의 괴리 우려 및 금리·환율 변동성을 모니터링하며, 내재가치 대비 과열 시 추가 매수 보류 또는 손절 기준을 적용할 예정입니다.",
simulation_20260701_174227,2026-02-27,1,A078,2026-02-27,2026-02-26,2026-02-26,15:30,2026-02-27,15:30,2026-02-27,pre_close_cutoff,2,4,9,10,"삼성전자 PER, 삼성전자 PBR, HBM4E 양산, 메모리 반도체 가격, 외국인 순매수, 미국 금리, 반도체 재고",10,수정,mixed,buy,229,limit,215000.0,True,"HBM 기술 경쟁과 기관 수급 호조로 장기적 가치는 높으나, 단기 급등과 실물경제 괴리로 인해 신중한 접근이 필요함.","초기 중립에서 기술 호재와 기관 수급 확인으로 긍정적 관점으로 전환. 다만, 가치평가 지표 부족으로 과열 우려는 유지.","장기적인 AI 수요와 HBM 기술 우위, 기관 수급 안정성 (국민연금 매도 중단) 을 근거로 매수 방향을 결정하였습니다. 다만, 단기간 7.1% 급등으로 인한 밸류에이션 부담과 실물경제 성장률 (2%) 과의 괴리 우려가 있으므로, 현재가 (218,000 원) 보다 약간 하향된 215,000 원에 지정가 매수 주문을 제출하여 진입 비용을 절감하고 리스크를 관리하고자 합니다. 보유 현금 1 억 원 중 50% 한도 내에서 최대 수량 (229 주) 을 매수하여 포지션을 형성하되, 추후 조정 시 추가 매수 여력을 확보합니다.","단기 과열로 인한 조정 리스크와 실물경제 괴리 심화 가능성을 고려하여, 진입 후 주가가 급락할 경우 손절 기준을 명확히 설정할 예정입니다. 또한, 현금 비중을 50% 이상 유지하여 변동성에 대응하고, 미·중 갈등 및 금리 변동성 등 거시경제 리스크를 지속적으로 모니터링하겠습니다.",
